id,slug,name,released,metacritic,rating,ratings_count,playtime,added,twitch_count,youtube_count,description,website,reddit_url,platforms,genres,tags,developers,publishers,year
34338,alien-force,Alien Force,1990-01-01,,0.0,0,0,9,0,0,"<p>Alien Force is an arcade game developed by Robert Epps. It came out on 01-01-1990. Robert Epps published the game. <br>Alien Force is available on PC. <br>It was produced by Donna Smith and Glen Murakami. It was scored by Kristopher Carter, Lolita Ritmanis, Michael McCuistion and Parry Gripp. <br></p>",,,PC,Arcade,,Robert Epps,Robert Epps,1990
32764,airstrike-usa,Airstrike USA,1990-01-01,,0.0,0,0,9,0,0,"<p>Airstrike USA is an arcade game developed by Digital Integration. It was originally released in 1990. Spotlight Software published the game. <br>You can play Airstrike USA on PC. </p>

<p></p>",,,PC,Arcade,,Digital Integration,Spotlight Software,1990
53988,pictionary-1990,Pictionary (1990),1990-07-01,,0.0,0,0,9,0,0,"Pictionary, taglined The Game of Video Quick Draw, is a video board game developed by Software Creations and published by LJN for the Nintendo Entertainment System. It is based on the board game of the same name. Players may play in up to four teams of unlimited players.",,,NES,"Board Games, Puzzle","Singleplayer, Multiplayer",Software Creations,LJN,1990
33017,earthrise-a-guild-investigation,EarthRise: A Guild Investigation,1990-01-01,,0.0,0,0,9,0,0,"<p>EarthRise: A Guild Investigation is an adventure game developed by Interstel. It came out on 01-01-1990. Interstel published the game. <br>EarthRise: A Guild Investigation is available on PC. </p>

<p></p>",,,PC,Adventure,,Interstel,Interstel,1990
55387,cloud-kingdoms,Cloud Kingdoms,1990-01-01,,0.0,0,0,9,0,0,"Cloud Kingdoms is a computer game created by Dene Carter and released in April 1990 for the Amiga, Atari ST, Commodore 64 and MS-DOS computers.
There is an unofficial version of the game for the Commodore Plus/4.",,,"Commodore / Amiga, Atari ST, PC",,Singleplayer,"Logotron, Trigram, Brainware, Electralyte, Dancing Bear",Millennium Interactive,1990
30058,fire-forget-2-the-death-convoy,Fire & Forget 2: The Death Convoy,1990-01-01,,0.0,0,0,9,0,0,"<p>Fire & Forget 2: The Death Convoy is an action-racing game developed by Titus Interactive. It came out on 01-01-1990. It was published by Titus Interactive. <br>You can play Fire & Forget 2: The Death Convoy on PC. </p>

<p></p>",,,PC,"Action, Racing",,Titus Interactive,Titus Interactive,1990
55789,pitman-1990,Pitman (1990),1990-06-01,,0.0,0,0,9,0,0,"Pitman, also known as Catrap in the US, is a puzzle-platform video game released by Asmik for the Nintendo Game Boy in 1990, originally developed for the Sharp MZ-700 computer in 1985. The Game Boy version of Pitman was rereleased on the Nintendo 3DS Virtual Console in October 2011. The word 'Catrap' refers to the frequent amount of times the player is trapped and needs to reverse their movements and the two anthropomorphic cats the player must manoeuvre to advance through the levels. The game is credited with having originated the time-rewind mechanic, which later appeared in titles like Blinx: The Time Sweeper, Prince of Persia: The Sands of Time, Braid and Pullblox.",,,"Game Boy, Nintendo 3DS",Puzzle,Singleplayer,"Asmik Ace Entertainment, Asmik","Asmik Ace Entertainment, Asmik",1990
54134,wall-street-kid,Wall Street Kid,1990-06-01,,0.0,1,0,9,0,0,"Wall Street Kid is a video game released by SOFEL for the NES. It was originally released in Japan as The Money Game II: Kabutochou no Kiseki (ザ・マネーゲームII「兜町の奇跡」, ""The Money Game 2: The Miracle of Kabutochou""), which was the sequel to The Money Game.
The story line from the two versions are different but the layout and the scheme of the office are almost exactly the same. Only cosmetic changes were made to make it relevant with the North American audiences. Both of these games expect the player to exercise his avatar and go out on dates.
The player must prove himself worthy by taking $500,000 in seed money and growing it to $1,000,000 in order to gain a six-hundred-billion-dollar inheritance from the extremely wealthy Benedict family. Successfully investing it in the American stock market results in rewards like going shopping on the weekend and being able to acquire expensive items such as a house. The names of the companies listed in the stock market are slight variants on actual U.S. companies in operation at the time of the game's release. The player is also encouraged to spoil his girlfriend. The game terminates if the player is unable to raise the money needed for a key item such as a boat or the house, causing the stockbroker to be disowned by the family.",,,NES,Strategy,Singleplayer,SOFEL,SOFEL,1990
55297,solarstriker,SolarStriker,1990-01-26,,0.0,1,0,9,0,0,"Solar Striker (ソーラーストライカー) is a vertical scrolling shooter video game developed by Nintendo R&D1 with Minakuchi Engineering for the Nintendo Game Boy. It was first published in Japan on January 26, 1990, then released later in North America in February, and finally in Europe on September 28.",,,Game Boy,,Singleplayer,"Nintendo, Minakuchi Engineering",Nintendo,1990
53725,bo-jackson-baseball,Bo Jackson Baseball,1990-10-01,,0.0,0,0,9,0,0,"Bo Jackson Baseball is a baseball video game that was released for the Nintendo Entertainment System, Commodore Amiga and IBM PC-compatibles. The game features athlete Bo Jackson, who at the time of the game's release was a star in professional baseball and a former professional football player. In Europe, the game was released by Mindscape as TV Sports: Baseball, part of the TV Sports series that included TV Sports: Basketball and other games based on hockey and American football.",,,NES,Sports,"Singleplayer, Multiplayer","Beam Software, Krome Studios Melbourne","MINDSCAPE, Data East",1990
53788,dirty-harry,Dirty Harry,1990-12-14,,0.0,0,0,9,0,0,"Dirty Harry is a 1990 video game based on the Dirty Harry film franchise starring Clint Eastwood. Though the game is sometimes incorrectly referred to as ""Dirty Harry: The War Against Drugs"", nowhere on the box or in the game does it state that subtitle.",,,NES,Action,Singleplayer,"Mindscape, Gray Matter",MINDSCAPE,1990
53918,loopz,Loopz,1990-01-01,,0.0,0,0,9,0,0,"Loopz is a puzzle video game originally designed and programmed by Ian Upton for the Atari ST in 1989. He previously worked as head game designer for Audiogenic, who acquired exclusive rights to the game, then in 1990 arranged for Mindscape to publish it for computers in North America and consoles worldwide.
The Nintendo Entertainment System version (programmed by Bits Studios) and the Game Boy version (programmed by Argonaut Software) were released in 1990. A sequel, Super Loopz, was published for the Super NES by Imagineer and for the Commodore Amiga CD32 by Audiogenic. Audiogenic also published versions of the original game for the Acorn Electron, BBC Micro, ZX Spectrum, Amstrad CPC, Commodore 64, Atari ST, Commodore Amiga, and IBM PC in 1990 and 1991.
An Apple Macintosh version was in development for Audiogenic, but never completed, and a version was written for the Atari Lynx, also for Audiogenic by Hand Made Software but lay unreleased until picked up by Songbird Productions in 2004.
An agreement was reached between Audiogenic Software and the defunct Atari Classics Programmer's Club in 1995 for development of an Atari 800XL version of the game. This version remained incomplete by the time it was abandoned in October 1998. There was some discussion in 2005 over the possibility of resurrecting this version of the game but the project remains on hold.
Audiogenic licensed the Loopz concept to Capcom who developed a prototype coin-op, but it was never released. Similarly Audiogenic developed an SWP (skill-with-prizes) version on behalf of Barcrest, a leading UK manufacturer of pub games, and this too remains unreleased.
The main focus is on the playing board where random pieces of different shapes are presented to the player. A shape is either a single square containing a straight line or 90° corner or a combination of multiple such squares. The player must then try to make loops out of them. Once a loop is completed, all pieces involved will disappear. (You cannot make any line overlapping the edge, in other words, it cannot be placed in this way)
There exist three different play modes, two of which can be played with two players. The third mode of play starts with a loop already created and then takes away random pieces of it, so the player has to put them back in after they show up.
The cover art is reminiscent of the band Pink Floyd's The Dark Side of the Moon album.",,,"Commodore / Amiga, Atari ST, Game Boy, Atari Lynx, NES, PC","Strategy, Puzzle",Singleplayer,"Milestone, Audiogenic",MINDSCAPE,1990
57154,rastan-saga-ii,Rastan Saga II,1990-07-06,,0.0,1,0,9,0,0,"Rastan Saga II (ラスタンサーガ2), known in Europe as Nastar and in North America as Nastar Warrior (except for the North American Sega Mega Drive/Genesis version, which was known as Rastan Saga II) is a hack and slash platform arcade game developed and released by Taito in 1988. It is the sequel to Rastan Saga (released simply as Rastan in North America).
Description:
A side scrolling hack-and-slash-em-up where you take the role of a barbarian who tries to defeat the evil wizard. Many of the bosses are based on mythological characters such as minotaurs and Medusa.",,,"Wii, Genesis",,"Singleplayer, cooperative, 2 players",Taito,Taito,1990
34282,mindbender,Mindbender,1990-01-01,,0.0,0,0,9,0,0,"<p>Mindbender is a game developed by Magic Bytes. It was originally released in 1990. It was published by Gremlin Graphics. <br>You can play Mindbender on PC. </p>

<p></p>",,,PC,,,Magic Bytes,Gremlin Graphics,1990
56348,beverly-hills-cop-1990,Beverly Hills Cop (1990),1990-01-01,,0.0,0,0,9,0,0,"Beverly Hills Cop is a game developed by Tynesoft and released in 1990, with a story loosely based on the first film from the Beverly Hills Cop series. The player takes control of Axel Foley, the main character of the series. There are four distinct sub games including a side-scrolling action game, a driving game, an overhead view shooter and a first person shooter. The game was released on Commodore 64, ZX Spectrum, BBC Micro, Amstrad CPC, Amiga, Atari ST, and PC. The BBC version only contains the driving game.
Blast Entertainment released a Beverly Hills Cop game in Europe for the PlayStation 2 in 2006, which was heavily panned by fans of the movie.",,,"PC, Commodore / Amiga, Atari ST",,"Story, Driving, character, Movie",,,1990
32158,colorado,Colorado,1990-01-01,,0.0,0,0,9,0,0,"<p>Colorado is an arcade game developed by Silmarils. It came out on 01-01-1990. It was published by Silmarils. <br>You can play Colorado on PC. </p>

<p></p>",,,PC,Arcade,,Silmarils,Silmarils,1990
57027,f1-circus,F1 Circus,1990-01-01,,0.0,0,0,9,0,0,F1 Circus (エフワン サーカス) is a series of Formula One-based racing video games developed and published by Nichibutsu starting on the PC Engine in 1990.,,,"NES, Genesis",Racing,,"Micronics, Nihon Bussan, Make Software, Cream",Nichibutsu,1990
53991,pin-bot,Pin Bot,1990-04-01,,0.0,0,0,9,0,0,"Pin Bot is a pinball video game developed by Rare and published by Nintendo for the Nintendo Entertainment System. It was released in North America in April 1990. It is a conversion of the pinball machine by the same name (developed and manufactured by Williams in 1986). The NES version of the game accurately reproduces some of the game-play and aesthetics of the pinball machine, while introducing new features and added challenges.",,,NES,,"Singleplayer, Multiplayer",Rare,Nintendo,1990
55160,venus-the-flytrap,Venus The Flytrap,1990-01-01,,0.0,0,0,9,0,0,Venus The Flytrap is a post-apocalyptic side-scrolling video game released in 1990 for the Amiga and Atari ST.,,,"Atari ST, Commodore / Amiga",,Singleplayer,"Gremlin Interactive, Gremlin Graphics","Gremlin Interactive, Gremlin Graphics",1990
34270,7-cards,7 Cards,1990-01-01,,0.0,0,0,9,0,0,"<p>7 Cards is a card game developed by SoftStar. It was originally released in 1990. SoftStar published the game. <br>You can play 7 Cards on PC. </p>

<p></p>",,,PC,Card,,SoftStar,SoftStar,1990
34345,big-business,Big Business,1990-01-01,,0.0,0,0,9,0,0,"<p>Big Business is a strategy game developed by Off the Wall Productions. It came out on 01-01-1990. It was published by DigiTek Software. <br>Big Business is available on PC. </p>

<p></p>",,,PC,Strategy,,Off the Wall Productions,DigiTek Software,1990
55911,skate-or-die-bad-n-rad,Skate or Die: Bad 'N Rad,1990-09-01,,0.0,1,0,9,0,0,"Skate or Die: Bad 'N Rad is a 2D action video game developed and published by Konami for the Game Boy. A part of the Skate or Die series created by Electronic Arts, the game was released in North America in September 1990, and in Europe in June 1991.",,,Game Boy,Action,"Singleplayer, exclusive, true exclusive",Konami Digital Entertainment,"Konami, Palcom",1990
55071,masterblazer,Masterblazer,1990-01-01,,0.0,0,0,9,0,0,"Masterblazer is a 1990 computer game developed by Rainbow Arts and published by LucasArts.
It is the sequel and remake of the 1984 game Ballblazer. Played out like a futuristic sport, the playing field is a large rectangle made out of squares. A Plasmorb ball must be moved into a goal as many times as possible within the course of three minutes. This is accomplished by using a Rotofoil vehicle. This game even allows Rotofoils to race against each other (basically a normal game but without the ball).",,,"Atari ST, Commodore / Amiga, PC",Action,Singleplayer,Rainbow Arts,LucasArts Entertainment,1990
251498,scrabble-the-deluxe-computer-edition,Scrabble: The Deluxe Computer Edition,1990-01-01,,0.0,1,0,9,0,0,Scrabble: Deluxe Edition is the first Scrabble game to hit the computer. Pick 7 tiles and form words for points! Play against a friend or the computer (with 9 levels of play).,,,PC,Board Games,words,,,1990
31075,starblade,StarBlade,1990-01-01,,0.0,0,0,9,0,0,<p>StarBlade is an arcade game developed by Silmarils. It came out on 01-01-1990. It was published by Silmarils. <br>You can play StarBlade on PC. <br>It was scored by Shinji Hosoe. <br></p>,,,PC,Arcade,,Silmarils,Silmarils,1990
55513,the-killing-game-show,The Killing Game Show,1990-01-01,,0.0,0,0,9,0,0,"First prize is your life! It's a game show in the 21st century and you're the entertainment! Equip your armored body with high-tech weaponry. Scale the walls and avoid the rising acid as you make your dash for freedom. Dozens of Hostile Artificial Life Forms have targeted you for extermination. Watch your step, booby traps are everywhere! 12 levels of hot arcade action to climb, jump and blast your way through. Choose from over a dozen different weapons to strap onto your body suit. Fatal rewind - step in and re-direct sections of your previous escape attempts. 3 levels of difficulty - hard, harder and hardest!",,,"Atari ST, Commodore / Amiga, Genesis","Action, Platformer",Singleplayer,"Bizarre Creations, Raising Hell Software","Electronic Arts, Psygnosis, SCE Studio Liverpool",1990
53946,metal-mech,Metal Mech,1990-12-14,,0.0,0,0,9,0,0,Metal Mech: Man & Machine (known in Japan as Metal Flame: Psybuster (メタルフレーム・サイバスター)) is a 1990 video game for the Nintendo Entertainment System.,,,NES,Action,Singleplayer,Sculptured Software,Jaleco,1990
55782,timeball,Timeball,1990-01-01,,0.0,0,0,9,0,0,"Timeball is a puzzle video game released by NEC for the TurboGrafx-16. The object of the game is to guide a ball along pieces of track by moving tiles like a sliding puzzle. The game's name in Japan is Blodia, an anagram of Diablo, the title of a computer game upon which Blodia is based. Versions of Blodia were released exclusively in Japan for the original Game Boy and the Sharp X68000. A spin-off titled Blodia Land: Puzzle Quest was released for the Famicom, replacing the ball with cartoon dinosaur-like characters. These versions were developed by Tonkin House and published by Brøderbund.",,,Game Boy,Puzzle,"Singleplayer, Multiplayer, Two-player",Hudson Soft,"Brøderbund, NEC, '''Sharp X68000, Game Boy:''', '''TurboGrafx-16''':",1990
55349,battle-master,Battlemaster,1990-01-01,,0.0,0,0,9,0,0,"Battlemaster is a 1990 fantasy action adventure game designed by Mike Simpson and Simon Jones for PSS and distributed by Mirrorsoft. The game is a fantasy adventure in which the player controls a champion who must battle evil forces to conquer four kingdoms, uniting the four kings' crowns and presenting them to the Watcher in order to restore the world to peace.",,,"Commodore / Amiga, Atari ST, PC, Genesis","Action, Strategy",Singleplayer,"Personal Software Services, PSS",Mirrorsoft,1990
57274,zan-yasha-enbukyoku,Zan: Yasha Enbukyoku,1990-09-04,,0.0,0,0,9,0,0,"Zan: Yasha Enbukyoku (斬 夜叉円舞曲, ""Zan Yasha Waltz"") is a strategy video game that makes noble yaksha warriors go up against malevolent demons. There is a neutral party made of other Japanese generals and rulers. Units must be deployed for both protection and attack. Natural disasters occur on a random basis, and diplomacy doesn't always work, so that combat is the main feature.",,,Genesis,Strategy,Singleplayer,"Namco Tales Studio, Wolf Team",Wolf Team,1990
55683,torvak-the-warrior,Torvak the Warrior,1990-01-01,,0.0,0,0,9,0,0,Torvak the Warrior is a hack and slash platform game published by Core Design in 1990. The game was released for the Commodore Amiga and Atari ST. The gameplay has been compared to that of the Rastan Saga series.,,,"Atari ST, Commodore / Amiga",,Singleplayer,,Core Design,1990
55825,heiankyo-alien,Heiankyo Alien,1990-01-14,,0.0,1,0,9,0,0,"Heiankyo Alien (平安京エイリアン, Heian-kyō Eirian) is a video game created by the University of Tokyo's Theoretical Science Group (TSG) in 1979. The game was originally developed and released as a personal computer game in 1979, and was then published by Denki Onkyō Corporation (電気音響株式会社, Denki Onkyō Kabushiki Gaisha) as an arcade game in May 1980. The game has been ported to several other gaming systems since its original release.",,,Game Boy,"Action, Puzzle",2 players,,"Nihon Bussan, Meldac, Denki Onkyō",1990
55083,operation-stealth,Operation Stealth,1990-01-01,,0.0,0,0,9,0,0,"Operation Stealth, also known as James Bond 007: The Stealth Affair in the United States, is an adventure game from Delphine Software International, released in 1990. The game is mainly the work of Paul Cuisset (programming) and Jean Baudlot (sound).
The game was released with the Bond license in the United States, although this led to some inconsistencies as the MI6 agent appeared to be taking his orders from the CIA.",,,"Commodore / Amiga, Atari ST, PC",Adventure,Singleplayer,Delphine Software International,"Interplay Productions, U.S. Gold",1990
55522,kwik-snax-1990,Kwik Snax (1990),1990-11-01,,0.0,1,0,9,0,0,"Kwik Snax is an arcade style maze video game play developed by the Oliver Twins and was published in 1990 by Codemasters for the Amstrad, Spectrum, Commodore 64, MS-DOS, and Amiga. It was the fifth game in the Dizzy series and is considered a sequel to Fast Food.
After the Oliver twins had completed Operation Gunship they wanted to release another puzzle game similar to Fast Food which only required two weeks of development time, however unexpectedly it required much more time.
The Rear cover (Amstrad Version) says ""Dizzy to the rescue! Outwit Zaks' court jesters, bumble bees, clockwork mice and more in the Land of Personality. Mega features and fantastic fun in the incredibly playable, action packed, arcade puzzle game!""",,,"Atari ST, PC, Commodore / Amiga",Adventure,Singleplayer,Oliver Twins,Codemasters,1990
55498,international-soccer-challenge,International Soccer Challenge,1990-01-01,,0.0,0,0,9,0,0,"""International Soccer Challenge"" is a soccer video game developed by MicroStyle in 1990.",,,"Commodore / Amiga, Atari ST, PC",Sports,2 players,MicroStyle,Red Rat Software,1990
55905,serpent,Serpent,1990-04-06,,0.0,1,0,9,0,0,"Serpent (かこむん蛇, Kakomunja) is a Game Boy snake game developed by Naxat Soft. It was released in 1990 for the North American and Japanese markets.",,,Game Boy,Action,"Singleplayer, Multiplayer, exclusive, true exclusive","Kaga Create, Naxat Soft","Taxan, Naxat Soft",1990
34144,moonbase-a-lunar-colony-simulation,Moonbase: A Lunar Colony Simulation,1990-01-01,,0.0,0,0,9,0,0,"<p>Moonbase: A Lunar Colony Simulation is a strategy game developed by Wesson International and KDT Industries. It came out on 01-01-1990. Wesson International published the game. <br>You can play Moonbase: A Lunar Colony Simulation on PC. </p>

<p></p>",,,PC,Strategy,,"Wesson International, KDT Industries",Wesson International,1990
53822,formula-one-built-to-win,Formula One: Built to Win,1990-11-01,,0.0,1,0,9,0,0,"Formula One: Built to Win is a 1990 racing video game for the Nintendo Entertainment System developed by Winky Soft and published by SETA Corporation.
It was one of the first racing games to feature a career mode, multiple vehicles and an opportunity for the player to increase the performance of their in-game car through car tuning, which were unique elements for a racer of the NES era and a genre only truly revisited during the fifth generation of game consoles where games such as Gran Turismo became popular.
Races start out as single-lap events but become double-lap events as the player starts racing against more experienced competition in places like Las Vegas, Nevada and Hawaii. With gameplay similar to Rad Racer and Pole Position, the driver races towards the back of the screen.
The names of the opponents are chosen partially at random; they can also vary because of the ranking level of the course and the type of vehicle used. Like in Rad Racer, the player can supercharge an automobile to go up to 255 miles per hour or 410 kilometres per hour.",,,NES,"Simulation, Racing",Singleplayer,Winkysoft,SETA,1990
690726,das-boot-german-u-boat-simulation,Das Boot: German U-Boat Simulation,1990-12-31,,0.0,0,0,9,0,0,"Do you think well under pressure? How about 300 pounds per square inch of pressure?
Das Boot: German U-Boat Simulation provides an exact replica of submarine warfare during World War II. Originally published by Artech Digital Entertainment in 1990, Das Boot puts you in the command of a 1941-era Type VII U-Boat, deep under the icy waters of the Atlantic.
Attack Allied submarines and surface vessels rendered in full 3D graphics using an arsenal of torpedoes. Protect yourself from airborne enemies using the depth of the ocean. Decipher transmissions utilizing a code-cracking machine on board, to keep your enemies in the dark. Dodge depth charges or surface to ambush enemy ships with your deck guns. Three difficulty settings keep the challenge high even as your warfare skills increase.
As Captain, it is up to you to outmaneuver, outthink, and overpower your enemy combatants. Someone is sinking to the bottom of the ocean, and it better not be you.
Will you be victorious? Only if you can withstand the pressure.
Strategize to defeat Allied forces in sea, surface and air - all rendered in full 3D
Utilize 4 different torpedoes to sink your enemies - Contact, Acoustic, Looping and Magnetic
Attack Allied Planes and Ships with an 88mm deck gun and anti-aircraft batteries before you dive into the depths for safety
Use your Hydrophone to detect depth charges, enemy submarines, and surface threats
Multiple missions available - taking you from the Strait of Gibraltar to the coastlines of Norway",http://www.ziggurat.games,,PC,"Action, Adventure, Strategy, Simulation","Singleplayer, Action-Adventure, Pixel Graphics, Tactical, Historical, Military, Destruction, World War II, Immersive Sim, Real Time Tactics, Naval, Wargame, 3D Fighter, 3D-файтинг, submarine, Action RTS, Naval Combat",Artech Digital Entertainment,"Ziggurat, Ziggurat Interactive",1990
57219,thunder-fox,Thunder Fox,1990-01-01,,0.0,0,0,9,0,0,Thunder Fox is an arcade game created by Taito. It was released in arcades in 1990 and for the Sega Mega Drive/Genesis in 1991. It was later released on various consoles such as the Xbox and PlayStation 2 in a compilation of Taito classics. The title of the compilation is Taito Legends.,,,Genesis,Action,fox,Taito,Taito,1990
54201,king-neptunes-adventure,King Neptune's Adventure,1990-01-01,,0.0,0,0,8,0,0,"King Neptune's Adventure is an unlicensed adventure game created for the Nintendo Entertainment System by Color Dreams. Players play as King Neptune, as they venture though ships, oceans and Atlantis.",,,NES,Adventure,Singleplayer,Color Dreams,Color Dreams,1990
57035,final-zone,Final Zone,1990-01-01,,0.0,1,0,8,0,0,Final Zone (known in Japan as FZ Senki Axis) is an isometric mecha shooter game created by Wolf Team for Telenet Japan and its Renovation Products subsidiary in 1990. Players take on the role of a mecha operator outfitted in the NAP suit. The NAP suit can carry 14 weapons out of the 20 available weapons and it is up to player to use them to their maximum benefit. It was followed up by a sequel on the TurboGrafx-16.,,,Genesis,,Singleplayer,"Namco Tales Studio, Wolf Team","Telenet Japan, Renovation Products, Wolf Team",1990
55078,nitro,Nitro,1990-01-01,,0.0,1,0,8,0,0,Nitro is a top-down perspective arcade racer for the Amiga and Atari ST. It was developed and published in 1990 by Psygnosis.,,,"Commodore / Amiga, Atari ST",Racing,"Singleplayer, Multiplayer","SCE Studio Liverpool, Psygnosis",Psygnosis,1990
