id,slug,name,released,metacritic,rating,ratings_count,playtime,added,twitch_count,youtube_count,description,website,reddit_url,platforms,genres,tags,developers,publishers,year
59259,monster-rancher-battle-card-episode-ii,Monster Rancher Battle Card: Episode II,2000-08-03,,0.0,3,0,10,0,0,"Monster Rancher Battle Card Episode II is the sequel to Monster Rancher Battle Card GB. But it takes advantage of the PlayStation's superiority in graphics and processing power and adds more complex storyline quests, and expands the card game itself. No knowledge of other Monster Rancher games is needed, however, characters from prior games do play pivotal roles in the storyline.
For the first time, players can see into the personal lives of the characters in the Monster Rancher world, and interact with them while attempting to win matches of the collectible card game, to collect enough cards to complete quests. Along the way, the player is able to visit various locales and meet up with old friends and new acquaintances.
The card game itself features a tutorial mode, on screen help, and the option to turn animations on or off. It is easy enough at low levels for almost anyone to learn the basics, but offers options and higher levels of complexity to reward more patient, and older players.
Cards are acquired through defeating opponents, and via an in-game shrine where you can use music CDs, PlayStation games, or PC CD-ROMs to make cards. The CD shrining feature is unique to the Monster Rancher games.
The game also features a 2P mode designed for players who have played the game on their own and acquired their own cards (and tried and tested their skills) to play card games against each other. It is adequate, but unrelated to the in-game storyline.",,,PlayStation,,"Music, battle, collect, unique",Tecmo,Tecmo,2000
57735,romance-of-the-three-kingdoms-vi-awakening-of-the-,Romance of the Three Kingdoms VI: Awakening of the Dragon,2000-03-31,,0.0,2,0,10,0,0,Romance of the Three Kingdoms VI: Awakening of the Dragon (三國志VI) is the 6th installment in Koei's famous Romance of the Three Kingdoms series.,,,"Dreamcast, PlayStation, PSP, Classic Macintosh",,"Singleplayer, Multiplayer",KOEI,Koei,2000
54485,polaris-snocross,Polaris SnoCross,2000-08-29,,0.0,1,0,10,0,0,"Polaris SnoCross is a snocross snowmobile racing game for the Nintendo 64, PlayStation, Game Boy Color and later PC. It was released in 2000. French publisher Wanadoo Edition released a budget version of the game for the PC in 2001, called SnowCross.",,,"PlayStation, Nintendo 64, Game Boy Color, PC",Racing,"Singleplayer, Multiplayer",Vicarious Visions,Vatical Entertainment,2000
29922,warm-up,Warm Up!,2000-01-01,,0.0,2,0,10,0,0,"<p>Warm Up! is a racing-arcade game developed by Lankhor. It was originally released in 2000. The game is rated as ""Recommended"" on RAWG. <br>Warm Up! is available on PC. </p>

<p></p>",,,PC,"Racing, Arcade",,Lankhor,,2000
32756,magic-turn,Magic Turn,2000-10-01,,0.0,1,0,10,0,0,"<p>Magic Turn is an adventure game developed by Nikita. It was originally released in 2000. Most rawgers rated the game as ""Exceptional"". <br>Magic Turn is available on PC. </p>

<p></p>",,,PC,Adventure,,Nikita,,2000
32274,rally-masters-race-of-champions,Rally Masters: Race of Champions,2000-01-01,,0.0,3,0,10,0,0,"<p>Rally Masters: Race of Champions is a racing-arcade game developed by Infogrames. It was originally released in 2000. Infogrames published the game. Most rawgers rated the game as ""Exceptional"". <br>You can play Rally Masters: Race of Champions on PC. </p>

<p></p>",,,PC,"Racing, Arcade",,Infogrames,Infogrames,2000
25424,aquarium,Aquarium,2000-01-01,,0.0,1,0,10,0,0,"SummaryThis is the summer story of Aqua - a beginning maid carrying a secret - and her master (the player) who lost part of his memory.
The young Master, heir to the Francois family, has the same nightmare every night.
In it, he meets a girl, but they always end up quarreling and parting ways with the words ""I hate you"" ringing in his ears.
But just who is this girl...?
One summer's day, the young Master's elder sister tells him that in order to prepare for succeeding to the Francois family estate, he is to practice his leadership abilities.
To do that, his sister wishes for him to take a new maid under his wing so that he can guide and help her grow.
""I am the new maid, Aqua. From today, I will be responsible for your well-being, Master.""
The young Master immediately finds his heart drawn to Aqua, the new, clumsy maid who is burdened by a certain ""secret"" she cannot speak of. However, the two are separated from one another by an insurmountable wall—their social strata.
What shadow looms over the two as they face challenges and the opposition of society itself?
This is the pure summer love story of two individuals from completely different walks of life.",https://www.entergram.co.jp/aquarium/,,"PC, Nintendo DS","Adventure, Strategy","Singleplayer, Story Rich, Anime, Cute, Sexual Content, Visual Novel, online, Romance, Dating Sim, friends, environment, water, Романтика, hentai, tank, Хентай, plants, Neon, fish","SquareSoft, ENTERGRAM,INC.","Electronic Arts, ENTERGRAM,INC., Ertain",2000
52823,coolboarders-2001,Cool Boarders 2001,2000-10-23,,0.0,4,0,10,0,0,Cool Boarders 2001 is a snowboarding video game developed by Idol Minds and published by Sony Computer Entertainment for the PlayStation and PlayStation 2 and is the only Cool Boarders title to be released only in North America.,,,"PlayStation, PlayStation 2","Sports, Racing","Singleplayer, Multiplayer, exclusive, snow, winter, snowboarding, racing-game, snowboard, sports-game, Snowboard Racing","Idol Minds, Deck Nine Games","Sony Computer Entertainment, Sony Interactive Entertainment",2000
52812,colony-wars-red-sun,Colony Wars: Red Sun,2000-05-02,,0.0,3,0,10,0,0,"Colony Wars: Red Sun (called Colony Wars III: Red Sun in North America) is a space combat simulator video game for the PlayStation developed and released by Psygnosis in 2000. Other two episodes were released beforehand, namely Colony Wars in 1997 and Colony Wars: Vengeance in 1998.
Instead of being a starfighter pilot for the League of Free Worlds or the Colonial Navy, the player now assumes the role of a civilian miner-turned-mercenary.",,,PlayStation,,"Singleplayer, exclusive, true exclusive","SCE Studio Liverpool, Psygnosis","Sony Interactive Entertainment, Psygnosis",2000
31839,infestation,Infestation,2000-09-01,,0.0,2,0,10,0,0,"<p>Infestation is an action-racing game developed by Frontier Developments. It was originally released in 2000. It was published by Ubisoft Entertainment. The game is rated as ""Exceptional"" on RAWG. <br>You can play Infestation on PC. <br>It was scored by Sean Conran. <br></p>",,,PC,"Action, Racing",,Frontier Developments,Ubisoft Entertainment,2000
54753,spawn-in-the-demons-hand,Spawn: In the Demon's Hand,2000-10-01,62.0,0.0,5,0,10,0,0,"The legendary hellbound comic anti-hero comes to life. Straight from the blockbuster arcade game, this home version kicks it up a notch with ever more features and modes of play. Up to 4 players can battle in the ""death match-style"" Battle Royal Mode or choose a computer controlled teammate to take on Team Battle Mode. All your favorite characters from the Spawn series are faithfully recreated in the ultimate death match challenge.",,,Dreamcast,"Action, Adventure","Singleplayer, Multiplayer",Capcom,Capcom,2000
330416,risk-2,Risk 2,2000-03-22,,0.0,2,0,10,0,0,"Risk II is a video game version of the board game Risk, developed by Deep Red Games and published by Hasbro Interactive under the MicroProse label. It's a sequel to the 1996 version of Risk.",https://www.drstudios.co.uk/,,"PC, macOS",Board Games,Board Game,Deep Red Games,Hasbro Interactive,2000
30251,soldier,Soldier,2000-09-01,,0.0,3,0,10,0,0,"Juego para un jugador, de momento contiene 3 modos de juego, Modo Bomba, Modo Desafío y Modo Zombie.
Corre, dispara y acaba con tus enemigos, Terroristas que quieren explotar una oficina, Zombies que buscan tu cerebro y un modo de juego que pondrá a prueba tu paciencia con trampas y salas en las que te preguntaras porque has entrado.
-En el modo bomba, debéras encontrar las tarjetas de acceso para abrir las puertas, derrotar a todos los enemigos y encontrar la posición de la bomba para poder desactivarla antes de que esta explote.
-En el modo desafío, deberás encontrar las tarjetas de acceso para abrir las puertas, superar las pruebas y enfrentarte a hordas de zombies, y enemigos aprovisionados de rifles y poco que perder. ¿podrás superar el modo desafío?
-En el modo Zombie, solo estáis tu rifle y tú, no hay medicina, demuestra que eres el mejor eliminando a todos los zombies que puedas ¡Hazlos explotar con los barriles explosivos!",https://instagram.com/oc__games?igshid=YmMyMTA2M2Y=,,PC,"Action, Shooter, Casual, Indie","Singleplayer, Third Person, Funny, Survival, Action-Adventure, Third-Person Shooter, Zombies, Point & Click, Colorful, 3D, Linear, Bullet Hell, Quick-Time Events, Arena Shooter, Clicker, Logic, Арена-шутер, qte","Sinister Games, Oscar Orio Costoya, OCGames","Southpeak Interactive, Oscar Orio Costoya",2000
56185,ribbit-king,Ribbit King,2000-11-02,,0.0,1,0,10,0,0,"Ribbit King is a 2003 sports video game developed by Infinity and Jamsworks and published by Bandai for the Nintendo GameCube and PlayStation 2. The game is based on the fictional sport of Frolf, which is a golf-like game that is played with frogs. The frogs sit on catapults, which the player whacks with a hammer to send the frog flying into the air. It is the successor to Kero Kero King, released only in Japan in 2000 for the PlayStation.",,,"GameCube, PlayStation 2",Sports,"Singleplayer, Multiplayer","Infinity, Bandai, Jamsworks","Bandai Namco Entertainment, Bandai",2000
460423,metal-slug-2nd-mission,Metal Slug: 2nd Mission,2000-05-22,,0.0,1,0,10,0,0,"<p>Metal Slug: 2nd Mission is an action, shooter and platformer game developed by Ukiyotei. It came out on 22-05-2000. It was published by SNK. The game is rated as ""Skip"" on RAWG. <br>Metal Slug: 2nd Mission is available on Nintendo Switch and Neo Geo. <br>It was scored by Yasuaki Fujita. <br></p>",,,"Nintendo Switch, Neo Geo","Action, Shooter, Platformer",,Ukiyotei,SNK,2000
31379,timeline,Timeline,2000-10-01,,0.0,2,0,10,0,0,"Timeline is a turn-based strategy game where you can play through the human history from stone age to modern times. In the game you command wide range of units, make them collect resources and build buildings, towns and cities, explore the map and meet other players controlled by AI.
Features
Real Earth map or a map that is generated randomly.
Technology tree with over hundred technologies.
Resource system. You can collect resources from the terrain or produce them in your buildings. You need resources to learn new technologies but also to build and upkeep new units and buildings.
Global market that lets you sell resources you don't need and buy what you are missing.
Diplomacy with AI-controlled civilizations.
Combat system that is affected by terrain, generals, unit type and other variables.
Customizable interface, key shortcuts, map zoom level, etc.
Customization
Timeline is designed to be modded without programming knowledge or special tools. It comes with a map editor that is capable to generate random maps or can be used to create a new map manually. Most of the settings in the game are saved to files that are human readable and can be edited by any text editor. Some examples of things that can be changed include:
Unit and building statistics, images and sounds.
Resource colors and names.
Civilization starting positions, units, resources and relations to other civilizations.
Technology names, images and bonuses, what can be built with what technology etc.
Terrain images and statistics.
It's possible to change just some small things and balance the game to your needs or change everything and make a total conversion mod or a campaign.",https://taueon.com/timeline/timeline.html,,"Linux, macOS, PC","Adventure, Strategy, Arcade, Educational, Indie","Singleplayer, 2D, Tactical, Moddable, Historical, Building, Turn-Based Strategy, Management, Procedural Generation, Turn-Based Combat, Turn-Based Tactics, Resource Management, Economy, 4X, Level Editor, Hex Grid, Diplomacy, Wargame, Grid-Based Movement","Taueon, Timeline Comp. Entertainment","Eidos Interactive, Taueon",2000
57821,super-robot-wars-alpha,Super Robot Wars Alpha,2000-04-25,,0.0,2,0,9,0,0,"Super Robot Wars Alpha (スーパーロボット大戦α, Sūpā Robotto Taisen Arufa), is part of the Super Robot Wars franchise, and was published for the PlayStation by Banpresto in 2000. Super Robot Wars Alpha is the first game of the Alpha series, which spans the PlayStation and the PlayStation 2 platforms.",,,"Dreamcast, PlayStation","Action, Strategy","Robots, alpha",Banpresto,Banpresto,2000
54695,nba-2k1,NBA 2K1,2000-11-01,,0.0,3,0,9,0,0,"NBA 2K1 (also known as Sega Sports: NBA 2K1 or NBA2K1) is a basketball video game. It is the second installment in the NBA 2K series of video games. It was developed by Visual Concepts and published by Sega (as Sega Sports). It was the first NBA 2K game to feature online multiplayer and the first game to feature street courses instead of playing a game inside the arena in the first game, famous street courts such as The Cage, Rucker Park, Franklin Park, and Goat Park. It was released on November 1, 2000 in North America with the Dreamcast. Rapper Redman appears in the video game.",,,Dreamcast,Sports,"exclusive, true exclusive",Visual Concepts,SEGA,2000
32565,enemy-engaged-rah-66-comanche-vs-ka-52-hokum,Enemy Engaged: RAH-66 Comanche vs. KA-52 Hokum,2000-03-01,86.0,0.0,0,0,9,0,0,"<p>Enemy Engaged: RAH-66 Comanche vs. KA-52 Hokum is a simulation game developed by Razorworks. It came out on 01-03-2000. It was published by Empire Interactive Entertainment. On review aggregator Metacritic, Enemy Engaged: RAH-66 Comanche vs. KA-52 Hokum has a score of 86. <br>You can play Enemy Engaged: RAH-66 Comanche vs. KA-52 Hokum on PC. </p>

<p></p>",,,PC,Simulation,,Razorworks,Empire Interactive Entertainment,2000
32866,army-men-air-tactics,Army Men: Air Tactics,2000-01-01,,0.0,1,0,9,0,0,"<p>Army Men: Air Tactics is an arcade game developed by The 3DO Company. It was originally released in 2000. It was published by The 3DO Company. Most rawgers rated the game as ""Recommended"". <br>Army Men: Air Tactics is available on PC. </p>

<p></p>",,,PC,Arcade,,The 3DO Company,The 3DO Company,2000
427973,nice-2,N.I.C.E. 2,2000-06-26,,0.0,1,1,9,0,0,"Second part of the well known action racing game series from Synetic.
Before we waste our time here with enumerating marked advertising slogans, which nobody believes anyway and which only bore you, let's rather let the facts speak... ...or are you interested in the fact that we have...
.... more than 42 different cars in the classes Premium Class, Classic Class, Bonsai Racer...
.... complex driving dynamics including independent suspension, body deformation
... Original sounds of sports cars
... Vehicle tuning such as engine, brakes, tires and tuning of dampers, gear ratios and so on
... 24 exciting routes in 96 exciting variations
... realistic light and shadow calculation by day and night
... extensive audio backdrop with 3D sound
... Replay mode (wow, yes really)
... different race conditions like night, rain, fog, snow
... a career mode
... a race mode and/or a battle mode
...  packed into this game?
And, of course, many more features..... but you have to discover them for yourself. So chop, chop -- buy and play!",http://www.uniquegames.info/,,PC,"Action, Adventure, Simulation, Racing","Singleplayer, Multiplayer, Classic, Action-Adventure, Cult Classic, Combat Racing",Synetic,UniqueGames Publishing,2000
33264,sakura-fight-2,Sakura Fight 2,2000-01-01,,0.0,1,0,9,0,0,"<p>Sakura Fight 2 is an arcade-fighting game developed by D.K. Soft. It came out on 01-01-2000. It was published by D.K. Soft. The game is rated as ""Recommended"" on RAWG. <br>You can play Sakura Fight 2 on PC. </p>

<p></p>",,,PC,"Arcade, Fighting",,D.K. Soft,D.K. Soft,2000
541233,farethere-city,Farethere City,2000-11-28,,0.0,3,0,9,0,0,"Pigula, a boy full of curiosity, moves into a new home in peaceful Farethere City.
His dream is to open a general store to provide people the things they want.
He's told of a property up for sale that's ideal for his store, and begins to prepare as he gets used to town.",https://nantekotodesyoune.wixsite.com/minoniyoku,,PC,"Adventure, RPG, Indie",,,,2000
31101,karoo,Ka'roo,2000-01-01,,0.0,1,0,9,0,0,"<p>Ka'roo is an arcade game developed by Swing! Entert@inment Media. It came out on 01-01-2000. It was published by Swing! Entert@inment Media. Most rawgers rated the game as ""Exceptional"". <br>You can play Ka'roo on PC. </p>

<p></p>",,,PC,Arcade,,Swing! Entert@inment Media,Swing! Entert@inment Media,2000
32022,mahjongg-master-3,Mahjongg Master 3,2000-11-01,,0.0,0,0,9,0,0,"<p>Mahjongg Master 3 is a digital board game developed by Rene-Gilles ""Naoki Naga"" Deberdt. It came out on 01-11-2000. It was published by eGames. <br>Mahjongg Master 3 is available on PC. </p>

<p></p>",,,PC,Board Games,,"Rene-Gilles ""Naoki Naga"" Deberdt",eGames,2000
29635,millennium-digger,Millennium Digger,2000-09-08,,0.0,2,0,9,0,0,"<p>Millennium Digger is an arcade game developed by Alawar Entertainment. It was originally released in 2000. Alawar Entertainment published the game. Most rawgers rated the game as ""Exceptional"". <br>Millennium Digger is available on PC. </p>

<p></p>",,,PC,Arcade,,Alawar Entertainment,Alawar Entertainment,2000
31843,v-rally-2-expert-edition,V-Rally 2 Expert Edition,2000-01-01,,0.0,2,0,9,0,0,"<p>V-Rally 2 Expert Edition is a simulation, racing and arcade game developed by Eden Studios. It came out on 01-01-2000. It was published by Infogrames. Most rawgers rated the game as ""Exceptional"". <br>You can play V-Rally 2 Expert Edition on PC. </p>

<p></p>",,,PC,"Simulation, Racing, Arcade",,Eden Studios,Infogrames,2000
30400,agharta-the-hollow-earth,Agharta: The Hollow Earth,2000-01-01,,0.0,2,0,9,0,0,"<p>Agharta: The Hollow Earth is an action-adventure game developed by AniWare. It was originally released in 2000. IQ Media Nordic published the game. The game is rated as ""Exceptional"" on RAWG. <br>Agharta: The Hollow Earth is available on PC. </p>

<p></p>",,,PC,"Action, Adventure",,AniWare,IQ Media Nordic,2000
31453,game-39,Таинственный отель,2000-11-01,,0.0,0,0,9,0,0,"<p>Таинственный отель is an adventure-puzzle game developed by ShowGirls Soft. It was originally released in 2000. Медиа 2000 published the game. <br>Таинственный отель is available on PC. </p>

<p></p>",,,PC,"Adventure, Puzzle",,ShowGirls Soft,Медиа 2000,2000
31860,the-tainted,The Tainted,2000-06-01,,0.0,3,0,9,0,0,"You play as Jezebel, a mysterious girl who awakens in the woods, with little memory of her past. Unlike most of the humans of this world, she can use magic and communicate with intelligent creatures. In trying to live up to her motto of always doing what's necessary, she often finds herself in uncomfortable situations.
Along the way to exploring the land of Xanthia, you'll gain allies to help you face the many challenges that await. Do you have what it takes to stop the Taint?
Features:
Old school, 2D style RPG
Turn-based combat
Partial spell customization
Mature/immature humor
Mini-games
The Tainted was created using the RPG Maker MV engine and makes use of a lot of content created by the RPG Maker community. It attempts to tell a unique and funny story, as well as show off some of the talent found in this often overlooked community. Much of the humor is of a mature nature and is not intended for younger viewers. So, if you enjoy classic RPGs with turn-based combat and are also an adult that still thinks farts are funny....you might also enjoy The Tainted.",https://www.facebook.com/The-Tainted-102886545469345,,PC,"Action, RPG","Singleplayer, Full controller support, RPG, Story Rich, 2D, Fantasy, Funny, Exploration, Female Protagonist, Comedy, Pixel Graphics, Retro, Team-Based, Turn-Based Strategy, Magic, Dark Humor, PvE, Turn-Based Combat, Party-Based RPG, Протагонистка, Satire, Old School","Celestial Software, Chris D Herring","Chris D Herring, Twilyt",2000
54533,taz-express,Taz Express,2000-08-01,,0.0,1,0,9,0,0,"Taz Express is a video game for the Nintendo 64, that was released only in Europe in 2000.",,,Nintendo 64,Action,"Singleplayer, exclusive, true exclusive",Zed Two,"Infogrames, Infogrames Entertainment",2000
489290,action-man-operation-extreme,Action Man: Operation Extreme,2000-11-30,,0.0,2,0,9,0,0,"In Action Man you save the world from evil Doctor X. As a 3D platform adventure, Action Man features several different types of stages: run-and-gun levels in the third-person perspective and vehicular segments where you can hop in a car, boat, or an airplane to zip through the danger zone. Like all good spy-thrillers, look forward to plenty of plot twists to carry you through to the end game. Can you stop Dr. X?",,,PlayStation,Action,"Vehicular Combat, action shooter","Hasbro Interactive, Blitz Game Studios","Atari, Hasbro Interactive",2000
30737,breakout,Breakout,2000-09-01,,0.0,3,0,9,0,0,"Breakout is the low poly, atmospheric, First-Person platformer that will prove how good your reflexes really are.
Accept the challenge: run, jump, crouch and use special abilities to dodge the obstacles in order to complete each level, put your name on the top of the leader boards and, the most important thing, win awesome prizes.Key features:
A campaign mode with 70 levelsSpecial abilities like: Slow Motion, Grappling Hook, Jetpack and many moreAwesome prizes waiting for those who will finish the main challengeOnline leader boardsFor everyone: enjoyable by a wide variety of player skill",,,"PC, PlayStation","Action, Adventure, Simulation, Arcade, Casual, Indie","Singleplayer, Steam Achievements, Steam Cloud, First-Person, FPS, Steam Leaderboards, Action-Adventure, stats, Colorful, 3D, Roguelike, Roguelite, Dungeon Crawler, 1990's, Stylized, Bullet Hell, 1980s, Family Sharing, Action Roguelike, Artificial Intelligence, boomer shooter","Supersonic Software, FinalBit, Willomena","Hasbro Interactive, FinalBit, Willomena",2000
57638,nascar-rumble,NASCAR Rumble,2000-01-31,,0.0,3,0,9,0,0,"NASCAR Rumble is a racing video game created by Electronic Arts for the PlayStation. Players race through 18 different courses set in six different areas collecting powerups to aid them. The game was met with fairly positive reviews, and earned an 80% on GameRankings. The game is a departure from many NASCAR games, as it is an arcade racing featuring various tracks and Mario Kart-esque powerups. A non-NASCAR licensed sequel was made for the PlayStation 2, called Rumble Racing.",,,PlayStation,Racing,"Singleplayer, Multiplayer, exclusive, true exclusive","Electronic Arts, Electronic Arts Redwood Shores",Electronic Arts,2000
3392,doa2-hardcore,Dead or Alive 2: Hardcore,2000-01-01,,0.0,2,0,9,0,0,"The world has become chaotic and disoriented since the tragic murder of Fame Douglas, the sponsor of the legendary Dead or Alive I World Combat Championship. Now it's up to you to ensure that the world returns back to a state of peace. With 12 characters to choose from, your mission is to win the championship and save the world from the Tengu Disaster that will take place at the end of the century. Your ability to battle using various fighting techniques will determine your character's fate.",,,PlayStation 2,"Action, Fighting","online, hardcore",Team NINJA,Tecmo,2000
31826,chessmaster-8000,Chessmaster 8000,2000-01-01,,0.0,1,0,9,0,0,"<p>Chessmaster 8000 is a game developed by Mattel Interactive. It was originally released in 2000. It was published by Mattel Interactive. The game is rated as ""Skip"" on RAWG. <br>Chessmaster 8000 is available on PC. </p>

<p></p>",,,PC,,,Mattel Interactive,Mattel Interactive,2000
57862,tiger-woods-pga-tour-2001,Tiger Woods PGA Tour 2001,2000-11-06,,0.0,3,0,9,0,0,Tiger Woods PGA Tour 2001 (sometimes called Tiger Woods PGA Tour Golf for the PlayStation version) is a sports video game.,,,"PlayStation, PlayStation 2, PC",Sports,"Singleplayer, Multiplayer","Stormfront Studios, Headgate Studios",EA SPORTS,2000
52696,aztec-the-curse-in-the-heart-of-the-city-of-gold,Aztec: The Curse in the Heart of the City of Gold,2000-12-01,,0.0,1,0,9,0,0,Aztec: The Curse in the Heart of the City of Gold (also known as The Sacred Amulet) is an adventure game designed for PlayStation. It was developed by Cryo Interactive and published by France Telecom Multimedia on 1 June 2000.,,,"PlayStation, PC",Adventure,Singleplayer,Cryo Interactive,"Cryo Interactive, Telecom Multimedia",2000
32169,egypt-2-prophecy-of-heliopolis,Egypt 2: Prophecy of Heliopolis,2000-11-01,,0.0,2,0,9,0,0,"<p>Egypt 2: Prophecy of Heliopolis is an educational adventure game developed by Cryo Interactive Entertainment. It came out on 01-11-2000. Cryo Interactive Entertainment published the game. The game is rated as ""Exceptional"" on RAWG. <br>Egypt 2: Prophecy of Heliopolis is available on PC. </p>

<p></p>",,,PC,"Adventure, Educational",,Cryo Interactive Entertainment,Cryo Interactive Entertainment,2000
