id,slug,name,released,metacritic,rating,ratings_count,playtime,added,twitch_count,youtube_count,description,website,reddit_url,platforms,genres,tags,developers,publishers,year
3449,resident-evil,Resident Evil,1996-03-22,91.0,4.18,789,4,5413,139,1000000,"Resident Evil is a survival horror video game developed and released by Capcom originally for the PlayStation in 1996, and is the first game in the Resident Evil series. The game's plot follows Chris Redfield and Jill Valentine, members of an elite task force known as S.T.A.R.S., as they investigate the outskirts of Raccoon City following the disappearance of their team members. They soon become trapped in a mansion infested with zombies and other monsters. The player, having selected to play as Chris or Jill at the start of the game, must explore the mansion to uncover its secrets.",,,"SEGA Saturn, PC, PlayStation","Action, Shooter","gameplay feature: multiple endings, playstation platinum range releases, 1990s, games made into books, games made into comics, games made into movies, hudless games, live action cut-scenes, setting: 1990s, setting: future now past, theme: law enforcement, theme: zombies, video games turned into board / card games, white label releases, biohazard / resident evil series, boss fight books games","Capcom, GOG",Capcom,1996
31771,the-elder-scrolls-chapter-two-daggerfall,The Elder Scrolls II: Daggerfall,1996-08-30,,3.3,109,1,3363,161,185507,"The ancient golem Numidium, a powerful weapon once used by the great Tiber Septim to unify Tamriel, has been found in Iliac Bay. In the power struggle that follows, the King of Daggerfall is murdered and his spirit haunts the kingdom. The Emperor Uriel Septim VII sends his champion to the province of High Rock to put the king’s spirit to rest and ensure that the golem does not fall into the wrong hands.",https://elderscrolls.bethesda.net/en/daggerfall,https://www.reddit.com/r/Daggerfall/,PC,"Action, RPG","Singleplayer, Steam Cloud, RPG, Story Rich, Open World, First-Person, Partial Controller Support, Fantasy, Classic, Violent, Free to Play, Action RPG, role-playing, Sexual Content, Dungeon Crawler",Bethesda Softworks,Bethesda Softworks,1996
54491,quake,Quake,1996-06-22,94.0,4.25,474,1,3277,0,1000000,"###The roots
One of the classic representatives of the first-person shooter genre. Designed and released in 1996 by the authors of the groundbreaking game Doom - iD Software. This is the first game to start the still ongoing series. Unlike its famous predecessor, the game uses an engine capable of rendering full-fledged 3D: the game supports an earlier version of 3D acceleration through OpenGL. After moving to a new engine, the game needed a new control scheme: the movement is now possible in all three directions, including the vertical axis. This feature added to the game an additional difficulty: player have to expect the enemy attack from any direction. The game also has a full-fledged multiplayer, the previous version of which the Doom players liked.

###Key features
In a single player campaign, the player takes control of the main character named Ranger, who went to the portal in order to stop the unknown enemies, code-named Quake. The plot of the adventure consists of 32 separate levels. Six more maps are available in multiplayer for the battles between the players for deathmatch mayhem. Two mission packs were released for the game, which adds new enemies, new levels, new maps, new weapons and a new experience for players to the original game. Both packs were greatly received by both players and critics.",https://quake.bethesda.net/en,https://www.reddit.com/r/quake/,"Xbox One, macOS, Linux, Classic Macintosh, Xbox, Nintendo Switch, PlayStation 4, Nintendo 64, SEGA Saturn, Commodore / Amiga, PC, Xbox Series S/X, PlayStation 5","Action, Shooter","Singleplayer, Multiplayer, Steam Cloud, Atmospheric, Great Soundtrack, Co-op, cooperative, First-Person, Sci-fi, Horror, FPS, Gore, Classic, Retro, Zombies, Moddable, Fast-Paced, Competitive, 1990's, Lovecraftian, secrets, deathmatch, Ghosts, shotgun, intense, rocket-launcher, grenade-launcher, nailgun, ogres, arena-battle, armor, lan-party, invincibility, lan-game, invisibility","id Software, Midway Games, Lion Entertainment, Tectoy, Lobotomy Software, clickBOOM Entertainment","SEGA, id Software, GT Interactive Software, GT Interactive, MacSoft, Tec Toy, Midway Home Entertainment, Midway, GT Interactive Software Europe, PXL Computers, MacSoft Games",1996
5488,crash-bandicoot,Crash Bandicoot,1996-09-09,,4.14,775,20,2813,189,1000000,"Crash Bandicoot is the first installment in the 16 titles-long series. While the game set features various genres: races, beat'em'ups and platformers, the first part concentrates on platforming style. The game is developed by Naughty Dog who is currently famous for making Jax and Daxter, Uncharted and The Last of Us series. 
The game features self-titled bandicoot protagonist trying to get past the obstacles while crashing enemies by jumping and circling them and collecting fruits and masks that give him various bonuses. All levels emphasize running against or into the screen. 
Crash Bandicoot tells a story of a mutated bandicoot, trapped on Wumpa islands. He fights evil corporation сalled Doctor Neo Cortex which turns every living being into the beasts fighting against each other. The game features two ending — usual and true. With latter ending achieved by collecting all of the gems namely clearing the level without deaths and collecting every bonus there is to grab.",,,PlayStation,"Action, Platformer","playstation platinum range releases, playstation the best series, console generation exclusives: playstation, playstation greatest hits releases, crash bandicoot series, gameplay feature: game completion percentage, games that include a playable demo of another game",Naughty Dog,"Sony Computer Entertainment, Sony Interactive Entertainment",1996
17993,stargunner,Stargunner,1996-11-18,,2.02,91,1,1899,4,8424,"Stargunner has 34 blast-a-thon levels. Blast your way through the dark reaches of space, navigate the hostile alien world of Zile and explore the wreckage-ridden depths of the enemy’s darkened waters.Features
Into the Face of Danger: Fly through 34 action-packed levels as you take on the forces of Zile.
Top Gun: Destroy enemy ships to earn power-ups and credits.
It Pays to Slay: Spend credits on new weapons and engines - upgrade your ship.
Fight in Flight: 75 enemy craft and 33 bosses ensure there’s no shortage of things to shoot at.
Controller Support: Partial Xbox 360 Controller support.",https://3drealms.com/catalog/stargunner_45/,,"PC, macOS, Linux","Action, Shooter, Arcade","Singleplayer, Partial Controller Support, Free to Play, Shoot 'Em Up","3D Realms, Apogee Software",3D Realms,1996
22448,final-doom,Final DOOM,1996-05-31,,4.13,145,1,1874,115,1000000,"Final DOOM is a first-person shooter, a stand-alone expansion for the 1994 game DOOM II: Hell on Earth.  

###Gameplay 
The gameplay of Final DOOM is identical to previous games in the series. It consists of 32 levels (in PC version).
In each one, your goal is to find an exit from the level. It usually intends finding keys from multi-colored doors and fighting hordes on the demon. The player has access to different weapons such as a chainsaw, pistol, shotgun, and rocket launcher. There are many types of enemies in the game that vary in size, attacks, speed, amount of health from zombies and imps to huge cyberdemons and skeletons with rocket launchers on their shoulders. Aside from weapons, the player can use different weapons scattered throughout the map. Some of them replenish your health, ammo, and armor, and the other gives you temporary bonuses like increased damage, short-time invincibility acid resistance or invisibility. The levels are filled with secret rooms. Finding them is entirely optional but can significantly help by giving you new weapons early or providing with items and ammunition.  

###Final DOOM differences 
Final DOOM is essentially a collection of new maps divided into two packs: TNT: Evilution and The Plutonia Experiment. Different level designers outside ID Software created each pack. The game is noticeable for its hard difficulty that surpasses the level of two previous games.",https://slayersclub.bethesda.net/en,https://www.reddit.com/r/Doom/,"PlayStation, PC, Classic Macintosh","Action, Shooter","Singleplayer, Multiplayer, Atmospheric, Great Soundtrack, cooperative, First-Person, Sci-fi, Horror, FPS, Online Co-Op, Gore, Difficult, Classic, Retro, Zombies, Moddable, 1990's, Demons, hell","id Software, Williams Entertainment, TeamTNT, Casali brothers","id Software, GT Interactive Software, GT Interactive, SoftBank, Williams Entertainment, GT Interactive Software Europe",1996
20959,realms-of-the-haunting,Realms of the Haunting,1996-12-31,,2.59,66,1,1651,118,84690,"Realms of the Haunting is a game about a haunted house with a creepy supernatural atmosphere. The plot is told through a series of full motion videos which were relatively new at the time.

###Plot
The protagonist is Adam Randall, a young Englishman. His father died recently, and since then Adam is haunted by the nightmares about a cursed house. A mysterious priest gave him a box of magic stones and his father's letters. They reveal that the house from Adam's dreams was real. To investigate the mystery that led to his father's demise, Randall finds and visits the house. As soon as he enters it, someone locks the door behind his back. 

Adam has to walk through the house, reveal its dark secrets and deal with terrible creatures from other dimensions. Early at the game Rebecca Trevisard, a psychic, joins Randall as a companion. They learn that his father's soul is imprisoned within this walls, and there's much more at stake.

###Gameplay
Realms of the Haunting uses a first-person view. The gameplay alternates between sequences of arcade action and puzzle-solving. In action parts, Randall has to gun down the undead monsters. When solving puzzles, the player has to find and use the item that fits the task. The player can adjust the difficulty level, and at the easy difficulty, the items are chosen automatically. There are also many letters and other documents that reveal details of the plot and provide clues for puzzles.",http://kiss-ltd.co.uk/,,"PC, Linux, macOS","Action, Adventure","Singleplayer, First-Person, Horror, FPS, Classic, Retro, Point & Click, 1990's, FMV",Gremlin Interactive,"Kiss, Funbox Media, Blue Moon Red Owl",1996
54528,super-mario-64-1996,Super Mario 64,1996-06-23,94.0,4.4,725,12,1471,0,1000000,"Mario is super in a whole new way! Combining the finest 3-D graphics ever developed for a video game and an explosive sound track, Super Mario 64 becomes a new standard for video games. It's packed with bruising battles, daunting obstacle courses and underwater adventures. Retrieve the Power Stars from their hidden locations and confront your arch nemesis - Bowser, King of the Koopas!",,https://www.reddit.com/r/SuperMario64/,Nintendo 64,Platformer,Singleplayer,Nintendo,Nintendo,1996
22911,syndicate-wars,Syndicate Wars,1996-10-31,,2.81,57,1,1422,20,1000000,"“Remember, the meek shall inherit nothing.” - The Book of Cataclysm
Congratulations on becoming our newest EuroCorp Executive! You now hold the distinctive honor of being one of the few who will determine the shape of our Company. Your EX-ALFA3 clearance allows you to use the Marionette Remote Drone Operation Suite. Your squad of Agents will follow every order without fail or question, and you are free to eliminate or destroy any targets as you see fit. This will serve you well as those zealots of the Church of the New Epoch think they can compete against our Company. Your mission is to remove them completely. To that end, we have transferred 50,000 EuroCorp credits to your account. Failure to use your funds wisely or to eliminate the competition will require you to auto-euthanize. We feel confident that your skills and integrity will ensure that this state of affairs will never arise.
Sincerely,
The EuroCorp Board of Directors
Welcome to an urban hell of ultra-violent mayhem. Welcome to Syndicate Wars where you’ll take control of a squad of cybernetically enhanced Agents and wreak havoc on the enemy. Funnel money towards research that will allow you to upgrade your team and make them into more efficient killing machines. Use the environment to assassinate, destroy, and eliminate your targets all from a classic isometric perspective. If you need cannon fodder, why not set your Agents loose armed with Persuadertrons to control huge crowds, or even enemy agents, and get them to do the dirty work for you? So whether you’re keeping EuroCorp in the black or burning infidels for the New Epoch, Syndicate Wars will have you giddily carving a path to victory. Welcome to the merciless future of violent squad-based real-time tactics!Rob a bank with a nuclear grenade! Bring the house down--literally! The environment is fully destructible!
Play either side as EuroCorp Syndicate or Church of the New Epoch.
Futuristic weapons--the Persuadertron, Electron Mace, Satellite Rain, Nuclear Grenade--give you all kinds of nuking, electrocuting, propagandizing fun!",,,"PC, PlayStation","Action, Strategy","Singleplayer, Multiplayer",Bullfrog Productions,Electronic Arts,1996
14948,metal-slug,METAL SLUG,1996-04-19,,4.14,252,2,1274,129,1000000,"Metal Slug, is a run and gun video game developed and originally released by Nazca Corporation and later published by SNK. It was originally released in 1996 for the Neo Geo MVS arcade platform. The game is widely known for its sense of humor, fluid hand-drawn animation, and fast-paced two-player action. It is the first title in the Metal Slug series. It has been ported to the Neo Geo AES, Neo Geo CD, Sega Saturn, PlayStation, Virtual Console, PlayStation Network, iOS, Android and Neo Geo X, and to the Wii, PlayStation Portable, PlayStation 2, PlayStation 4 (as part of the Metal Slug Anthology) and Nintendo Switch.",https://www.facebook.com/SNK.METALSLUGWORLD/,,"PlayStation, Android, PlayStation 4, PlayStation 3, PlayStation 2, Neo Geo, Nintendo Switch, PC, iOS, Xbox One, Wii","Action, Arcade, Casual, Fighting","Singleplayer, Steam Achievements, Multiplayer, Full controller support, steam-trading-cards, Great Soundtrack, Co-op, cooperative, 2D, Funny, Steam Leaderboards, Classic, Local Co-Op, Pixel Graphics, Local Multiplayer, Retro, controller support, Side Scroller, Fast-Paced, overlay, Shoot 'Em Up, achievements, Cartoony, cloud saves, leaderboards","DotEmu, SNK, Nazca","SNK, D4 Enterprise, Nazca",1996
23114,war-wind,War Wind,1996-10-23,,2.18,28,1,1268,5,0,"The Ancient, alien world of Yavain teeters on the brink of anarchy as the winds of change threaten to blow civilisation asunder!
For centuries, four diverse races have tolerated a precarious balance of power. But the time has come for change. A new order is in the wind - AND IT WILL BE BORN OF BLOOD AND FIRE!
War Wind  allows you to view this epic struggle through the eyes of four unique races, each with its own strengths, weaknesses and distinctive A.I.
A real-time strategy masterwork,  War Wind features 28 read-to-play scenarios. A powerful Scenario Editor that allows you to place units and build new battles. And a story of such compelling depth you won't believe it's just a gameCarry your 8 favourite units from scenario to scenario
Advanced combat options, including stealth movement, bio mechanically enhanced units and monstrosities
Units can advance in rank through training, gaining power along the way
Achieve vicory through diverse means, such as combat, spell-casting and alliances
forces can gain prestige, attracting wandering heroes to aid in campaigns",,,PC,Strategy,"Singleplayer, Story Rich, Fantasy, Tactical, Retro, War, combat, Isometric, Building, RTS, Magic, Blood, 1990's, Base Building, Real Time Tactics, Old School, Wargame",DreamForge Intertainment,"GOG, SNEG",1996
17753,death-rally-1996,Death Rally (Classic),1996-09-06,,3.06,36,1,1122,0,70598,"Shoot your way through screaming bystanders, pick up more ammo and turbo from the side of the track, and floor the pedal while performing some shady deals for The Dealer. No trick is too dirty when you're preparing for The Final Confrontation. Only the hardest armor, the most powerful engine and the biggest guns will see you through the ultimate battle against The Adversary.
And when you feel you can't take it anymore, you can check out the underground market: Spiked bumpers, landmines, rocket fuel or sabotage can provide a way to create some nasty accidents for the competition.
Play alone or with friends, Death Rally supports network multiplayer for up to 4 players and serial or modem connection for two players.Features
Drive Crazy: Death and diversity with 19 different race tracks and 6 different cars.
Equipped to Kill: Each car is equipped with different weapons.
Pimp Your Ride: Upgradable engines, tires and armor.
Keep Your Friends Closer: Mutliplayer support for up to 4 players.
Car Nut: Over 20 megs of action-packed animation.
Controller Support: Partial Xbox 360 Controller support.",https://3drealms.com/catalog/death-rally_13/,,"PC, macOS","Racing, Arcade","Singleplayer, 2D, Partial Controller Support, Classic","Remedy Entertainment, Apogee Software","THQ Nordic, 3D Realms, GT Interactive Software",1996
23762,pokemon-red,"Pokémon Red, Blue, Yellow",1996-02-27,,4.39,516,33,1065,0,1000000,"With classic graphics and music, Pokémon Red and Pokémon
Blue Version stay true to the originals released nearly 20 years
ago. You'll feel like you're playing them just as they were, but now you
can trade and battle Pokémon using local wireless on the Nintendo 3DS
family of systems! Revisit these timeless games, or play them for the
first time!

Experience the original journey that started the Pokémon phenomenon
nearly 20 years ago, but now on the Nintendo 3DS family of systems as a
digital download! Relive the feeling of catching your very first Pokémon
from the original 150, complete with monochromatic pixel art and 4-bit
background music. You’ll take on the role of a Pokémon Trainer and
travel across the land searching for amazing creatures called Pokémon.
Catch, battle, and trade as you face Gym Leaders and try to stop Team
Rocket! If you want to catch the original 150 Pokémon, you’ll need to
trade wirelessly with your friends.",http://www.pokemon.com/us/pokemon-video-games/pokemon-red-version-and-pokemon-blue-version/,https://www.reddit.com/r/pokemon/,"Game Boy, Nintendo 3DS","Action, Adventure, RPG","Singleplayer, Multiplayer, role-playing",Game Freak,"Nintendo, Game Freak",1996
29593,diablo,Diablo,1996-12-31,94.0,4.4,521,1,1036,143,1000000,"Traveler, stay awhile and listen...

Darkness stirs beneath Tristram. An ancient evil sweeps across the land, plunging it into civil war and terrorizing the populace. A mad king, his missing son, and a mysterious archbishop are all pieces of the puzzle you need to hack through. You have journeyed to the source of this evil. The town of Tristram - now inhabited only by a handful of survivors, broken and twisted by the madness that has befallen them. A cathedral stands there, built over the ruins of an ancient monastery. Eerie lights and ungodly sounds are heard echoing through its abandoned halls, and that is where you shall venture.

Embark, if you dare, on a quest to destroy The Prime Evil…

    Experience the legendary action/RPG that influenced an entire genre.
    Storm Diablo's halls as either a Warrior, a Sorcerer or a Rogue - each with unique skills and abilities.
    Unite to destroy Diablo - up to 4 players can band together via Internet, or play head-to-head via LAN.
    Unprecedented replayability - over 200 different monsters inhabit Diablo's ever-changing labyrinth. Equip epic items to conquer fearsome bosses and their minions.
    A spine-chilling story - experience the horror of a world held in the grasp of The Lord of Terror.


Ahhh, fresh meat!

Travelers looking for the authentic Diablo experience can play the game as it was in 1996, with period-appropriate 20 FPS SVGA graphics, and the ability to matchmake through the classic version of Blizzard’s Battle.net® online-gaming service.
For those wanting something a bit more modern, Blizzard and GOG.COM have collaborated on an updated version of the game tuned for today’s gaming PCs, which includes out-of-the-box Windows 10 compatibility, a host of bug fixes and high-resolution support via aspect ratio-correct upscaling.

    The most voted game on the GOG.com wishlist, finally trapped in a DRM-free soulstone!
    Return to the beginning of this dark saga, now in digital format for the first time ever.
    Better value than Wirt's wares, guaranteed.",,,"PC, macOS, PlayStation","Action, RPG","Singleplayer, Multiplayer, cooperative, role-playing",Blizzard North,"Electronic Arts, Ubisoft Entertainment, Blizzard Entertainment",1996
28510,duke-nukem-3d,Duke Nukem 3D,1996-01-29,84.0,4.35,286,1,997,129,666165,"Xbox LIVE Multiplayer 2-8, HD (High Definition). Unlock the full version for 39 levels of mayhem!  Wreak havoc on your foes with weapons like Pipe Bombs, Shrink Ray, and Freezer.  Impress your friends on the leaderboards, earn achievements, and take advantage of the painless death system – rewind 10 seconds or 10 minutes, the choice is up to you.  All new User Clip recording, sharing and uploading have been added and best of all - online multiplayer with cooperative and DukeMatch for up to 8 players through Xbox LIVE!  What are you waiting for? This game requires the Xbox 360 hard drive or the 512MB Memory Unit for storage. There are no refunds for this item. For more information, see www.xbox.com/live/accounts.",,https://www.reddit.com/r/dukenukem/,"Genesis, SEGA Saturn, PlayStation, Xbox 360, PC, iOS, Android","Action, Shooter","Singleplayer, Multiplayer, cooperative, First-Person, FPS, Funny, Gore, Classic, Comedy, Violent, Retro, Mature, Aliens, Linear, 1990's, Dark Humor, 1990s","Gearbox Software, Nerve Software, 3D Realms, Saffire, Lion Entertainment, Lobotomy Software, Aardvark Software","SEGA, 3D Realms, GT Interactive Software, GT Interactive, Tec Toy, FormGen, King Records, MachineWorks Northwest",1996
21097,normality,Normality,1996-06-29,,2.17,41,4,959,32,20830,"A sinister force now controls the city of Neutropolis. A once-thriving city full of beauty and light, Neutropolis has been reduced to a a stagnant pit of apathy. As Kent Knutson, a shameless dreamer and one of Neutropolis' most awkward citizens, you have been imprisoned for a week and are now under home arrest for that most sinister of crimes: whistling in public. You must get out of your home and explore the vast city of Neutropolis and solve the riddle of a nation’s apathy. Point and click with the unique voodoo doll interface and be rewarded by motion capture sequences as you gather clues and solve puzzles. Chuckle at the bizarre plot and chew carpet while your brain wraps itself around puzzles that are greater than the sum of their parts. If you manage to understand the mystery that shrouds Neutropolis, you're only halfway there...
Why is the city so controlled? Why does the most successful company in town make furniture? Why can't penguins fly? Who is Brian Deluge? How can you solve the riddle of the mystery of the clue of the puzzle that shrouds Neutropolis?Features:Explore the incredibly detailed city of Neutropolis that is anything but a normal place
Amble freely through unique and surreal locations made with impressive attention to detail
Challenging puzzles with multiple and sometimes twisted and bizarre, solutions",http://www.funboxmedia.co.uk/,,"PC, macOS, Linux","Action, Adventure","Singleplayer, steam-trading-cards, Retro, Point & Click, 1990's",Gremlin Interactive,"Kiss, Funbox Media, Blue Moon Red Owl",1996
21312,hexen-deathkings-of-the-dark-citadel,HeXen: Deathkings of the Dark Citadel,1996-01-01,,3.49,49,1,920,0,2550,"Where HeXen Ends, the True Nightmare Begins. Deathkings of the Dark Citadel is the only official expansion of the original HeXen game. This add-on pack features 20 new single player levels from the original HeXen team as well as a host of new multiplayer options.
Deathkings of the Dark Citadel was the first true game expansion that Raven Software ever produced. In addition to providing three new hubs for the original HeXen, the Deathkings expansion was the first multiplayer game that allowed eight players to connect to a LAN simultaneously.",,https://www.reddit.com/r/HeXen/,"PC, Classic Macintosh, macOS","Action, Shooter","Singleplayer, Steam Cloud, FPS, Fantasy, Classic, dlc, add-on, expansion-pack","id Software, Raven Software",id Software,1996
