id,slug,name,released,metacritic,rating,ratings_count,playtime,added,twitch_count,youtube_count,description,website,reddit_url,platforms,genres,tags,developers,publishers,year
19301,counter-strike,Counter-Strike,2000-11-01,88.0,4.05,1600,3,9223,0,1000000,"Counter-Strike franchise started in back in 2000. Originated as a mod for Half-Life, the developers were signed by Valve Corporation thus beginning the franchise that exists to this very day. 

Having no particular plot or story at all, Counter-Strike was a competitive game mostly used as PvP. With new physics and a large amount of weaponry, you can choose between two fractions - Counter-Terrorists and Terrorists. Each team had their signature weapon (CTs had M16 while T had AK-47, for example), the main goal of every round was to kill the opposite team or fulfil a task.  In case there is a bomb plant - detonate or prevent, hostages - rescue or prevent from it or assassination. One player from the team is chosen as a VIP person that must be protected, and the goal of the opposite team is to kill this VIP. By winning every round, you received a good payment, by loosing - much lesser one. You can spend cash on buying equipment and weapon. Counter-Strike franchise is still loved to this day, and even such old shooters live to this day.",,,"macOS, PC, Linux, Xbox","Action, Shooter","Multiplayer, First-Person, FPS, Classic, Survival, Tactical, PvP, Team-Based, Military, Competitive, Valve Anti-Cheat enabled, 1990's, Assassin, 1980s, Ninja, Score Attack, e-sports","Valve Software, Turtle Rock Studios, Ritual Entertainment, Barking Dog Studios","Valve, Sierra On-Line, Microsoft Game Studios",2000
13913,deus-ex-game-of-the-year-edition,Deus Ex: Game of the Year Edition,2000-06-22,90.0,4.11,565,1,5880,0,1000000,"The year is 2052 and the world is a dangerous and chaotic place. Terrorists operate openly - killing thousands; drugs, disease and pollution kill even more. The world's economies are close to collapse and the gap between the insanely wealthy and the desperately poor grows ever wider. Worst of all, an ages old conspiracy bent on world domination has decided that the time is right to emerge from the shadows and take control.

Key Features:

Real role-playing from an immersive 3D, first-person perspective. The game includes action, character interaction and problem solving.
    
Realistic, recognizable locations. Many of the locations are built from actual blueprints of real places set in a near future scenario.
    
A game filled with people rather than monsters. This creates empathy with the game characters and enhances the realism of the game world.
    
Rich character development systems: Skills, augmentations, weapon and item selections and multiple solutions to problems ensure that no two players will end the game with similar characters.
    
Multiple solutions to problems and character development choices ensure a varied game experience. Talk, fight or use skills to get past obstacles as the game adapts itself to your style of play.
    
Strong storyline: Built on ""real"" conspiracy theories, current events and expected advancements in technology. If it's in the game, someone, somewhere believes",,https://www.reddit.com/r/Deusex/,"macOS, PlayStation 2, PlayStation 3, PC","Action, Shooter, RPG","Singleplayer, Multiplayer, Atmospheric, Great Soundtrack, RPG, Story Rich, First-Person, Sci-fi, FPS, Classic, Stealth, Action RPG, Moddable, Cyberpunk, Dystopian, Cult Classic, Immersive Sim, Conspiracy, Inventory Management",Ion Storm,Square Enix,2000
53341,jet-set-radio-2012,Jet Set Radio,2000-06-29,94.0,3.4,504,1,5295,0,1000000,"Jet Set Radio (2000) is an action game that allows players to dive into the atmosphere of teenager gangs of early 2000s Tokyo. The action is set in a 3D fictionalized Tokyo torn by teen gangs clash. Things clarify when Professor K, DJ of the Tokyo-to pirate radio station announces a gang war between Japanese rudies (teenagers, who skate and paint graffiti for self-expression). According to the main idea, teens skate and paint graffiti spots throughout the city and dodge police forces. The story is following a 17-year-old rudie Beat, who, being inspired by Professor K, organizes his own gang to burst into the conflict and to defeat rivals. The gameplay is about skating across the city (using only a few buttons) and tagging all possible graffiti spots. In the course of the game, players will face troubles caused by police riots and especially Capitan Onishima (the main antagonist), whose only aim is to pursue the rebellion of the youth. Jet Set Radio also features cel-shaded visuals in favor of 3D cartoon-like picture.",,https://www.reddit.com/r/JetSetRadio/,"iOS, Xbox 360, Android, Game Boy Advance, Dreamcast, PlayStation 3, PS Vita, PC","Action, Sports, Platformer","Singleplayer, Full controller support, Atmospheric, Great Soundtrack, Open World, Third Person, Classic, Female Protagonist, Controller, Retro, Anime, Colorful, Parkour, Music, Stylized, 3D Platformer, Cult Classic","SEGA, Blit Software, Smilebit, Blit",SEGA,2000
14606,ricochet,Ricochet,2000-11-01,,2.39,264,1,4515,11,1000000,"Ricochet is a multiplayer Half-Life mod developed by Valve.

Richochet is a deathmatch game that closely resembles platformers. The game field is made out of several floating platforms which the players can jump on by stepping on one of the arrows on the edge of the platform.

The objective is to push other players off the platforms using throwing discs - the only weapon present in the game. The player can't have more than 3 discs at the same time. The platforms are limited by a horizontal strip that can be used for ricocheting the discs. For pushing the player off with a direct hit, 1 point is scored. 2 for pushing the player off with a ricochet and 3 for double ricochet.

There are two firing modes: single disc shot and the beheading shot that uses all three discs at once. 

In comparison to other Half-Life mods, the number of deaths is not tracked by in-game statistics. Overall, this mod is much more primitive than the others. Only 2D targeting is present and the player movement comes down to jumping from platform to platform.",,,"macOS, Linux, PC","Action, Indie","Multiplayer, Full controller support, First-Person, 2D, Sci-fi, Horror, FPS, Classic, Split Screen, Controller, Local Multiplayer, Early Access, Retro, PvP, Space, Colorful, 3D, combat, Memes, Cyberpunk, Valve Anti-Cheat enabled, Bullet Hell, Minimalist, 2D Fighter, Remote Play Together, 2D Platformer, Conspiracy, 2D-платформер, Shared/Split Screen PvP, 2D-файтинг","Valve Software, Nathaniel Stauffer, Michael Stauffer","Valve, Nix Studio",2000
10049,hitman-codename-47,Hitman: Codename 47,2000-11-19,73.0,3.82,589,1,3951,103,379982,"The game that started the Hitman franchise. The protagonist is a talented yet nameless hitman, known only by his code number 47. He has no past, as he is a clone created by a mad scientist. In the beginning, 47 is being held in a mental hospital, before he escapes to become a killer for hire. His job is to eliminate high-ranking mafia bosses for large sums of money while attracting as little attention as possible. His missions may initially seem unrelated, but the plot eventually ties everything together.

Hitman has to use precise timing, unconventional tactics, and stealth skills to get to his targets and neutralize their bodyguards. He can attack from behind, use sniper's rifles, machine guns, or even improvised weapons, such as a halter. There are usually many ways to accomplish every murder. An important part of the gameplay is disguise: Hitman can attack people and steal their clothes to blend into any environment. Dead or unconscious bodies of Hitman's victims can be dragged away and hidden to avoid raising an alert. Money earned from previous missions can be used to buy additional killing equipment. Hitman may also lose a part of his reward if he kills civilians on a mission.",https://www.ioi.dk/hitman-codename-47/,https://www.reddit.com/r/HiTMAN/,PC,"Action, Shooter","Singleplayer, Atmospheric, Third Person, Difficult, Classic, Sandbox, Stealth, Third-Person Shooter, Assassin",IO Interactive,"Square Enix, Eidos Interactive",2000
21736,unreal-gold,Unreal Gold,2000-01-20,,3.43,327,1,3657,0,1000000,"Unreal Gold is a classic game which tells a story about the prison ship Vortex Rikers which crashes on the mysterious alien planet were cruel evil forces have enslaved a peaceful race. The player controls a man named Prisoner 849. After the crash, he is the only survivor left alive. He finds a gun and now has an objective to discover the secrets of this planet and get out from there. 
In Unreal Gold there are 47 different single-player missions which take place in levels that have rich and interesting designs, as well as 20 multiplayer levels and 5 different game types. At the time of game’s release, Unreal Gold had most intelligent enemies with unique personalities. Also, Unreal Gold offers over 13 various upgradeable weapons with many fire modes, includes all the enhancements and technical improvements and special graphical additions for the latest 3D video cards. Unreal Gold includes not only an original Unreal game but also its expansion called Return to Na Pali.
The game is well-known for its engine named after the game’s name, which newer versions are powering video games even today.",,,PC,"Action, Shooter","Singleplayer, Multiplayer, Atmospheric, Great Soundtrack, Co-op, cooperative, First-Person, Sci-fi, Horror, FPS, Classic, Female Protagonist, Nudity, Fast-Paced, 1990's",Epic Games,,2000
1488,metal-slug-3,METAL SLUG 3,2000-03-23,,3.96,360,2,2706,113,1000000,"METAL SLUG 3 is a game in the shoot 'em up genre, a sequel to the METAL SLUG 2/METAL SLUG X and overall a third installment in the series. Initially released for arcade platform, the game shares gameplay mechanics with its predecessors, where the player takes control of a squad of four soldiers and faces continuous waves of enemies throughout each level.
The game’s plot follows the previous events, where the main characters succeeded in overthrowing a maniac and bringing relative peace. This time, however, it is revealed that our heroes' nemesis is back for more, with new allies and new soldiers to try and stop the protagonists. As the levels progress, the player faces different enemies, each with unique patterns and abilities, and also finds new weapons and upgrades for his character of choice. Another feature of the series is its vehicles, including tanks, planes, helicopters and even a spaceship. Each of those can be used to the various extent and provide significant bonuses to character’s firepower, defense, or movement capabilities.
The game is made using pixel graphics, and even though it was initially released in 2000, the sceneries and the details are still as stunning. Each character’s looks are refined, explosions are made colorful and as realistic for a 2D game as possible, and the locations themselves would look like art.",https://www.facebook.com/SNK.METALSLUGWORLD/,,"Android, PlayStation 4, PlayStation 3, Neo Geo, Wii, PC, iOS, Xbox 360, Xbox One","Action, Arcade, Casual, Fighting","Singleplayer, Steam Achievements, Multiplayer, Full controller support, Steam Cloud, steam-trading-cards, Great Soundtrack, Co-op, cooperative, 2D, Online Co-Op, Difficult, Steam Leaderboards, Classic, Comedy, Local Co-Op, Pixel Graphics, Local Multiplayer, Retro, controller support, Side Scroller, overlay, Shoot 'Em Up, achievements, cloud saves, leaderboards","DotEmu, SNK","SNK, D4 Enterprise",2000
10241,thief-ii-the-metal-age,Thief II: The Metal Age,2000-02-29,87.0,4.11,175,1,2658,154,501510,"Thief II: The Metal Age is a first-person stealth game, the second installment in the series.

###Plot
The game’s narrative takes place a year after the first game. The main character, an elusive thief Garrett, is tasked with resolving a crisis brewing in the metropolitan City. Different factions fight for influence and schemes are put into action to undermine each other’s plans. As the story progresses, the protagonist finds more clues about the mysterious prophecy that tells about the end of humanity and risks his own life to prevent it from fulfilling.

###Gameplay
The game heavily emphasizes discreteness and stealth, as the guards of the City may often try to stop the main character. Visibility and sounds play a crucial role in completing different tasks, and utilizing the surroundings can help get rid of enemies without confrontation. Different gadgets can be used to mask the sounds, obtain enemy’s location, and snuff out the lights. However, the playable character can still use his weapons to get rid of pursuers, but on higher levels of difficulty, doing so ends up in defeat and the need to restart the mission.

###Visuals and features
As with its predecessor, Thief II employs a refined AI system, where enemies can notice sudden changes in the environment and react correspondingly. The lighting and shadowing have also been revamped, albeit keeping the same noir mood to the locations. The graphics of the game are awe-inspiring for its year of release, as each texture is highly detailed, and physics are made to be life-comparable realistic.",,,PC,"Action, Simulation","Singleplayer, Atmospheric, Story Rich, First-Person, Horror, FPS, Fantasy, Classic, Stealth, Dark, Dark Fantasy, Medieval, Steampunk, Cult Classic, Immersive Sim",Looking Glass Studios,Square Enix,2000
12279,tomb-raider-chronicles,Tomb Raider V: Chronicles,2000-11-17,,3.36,140,1,2606,0,950068,"Tomb Raider V: Chronicles is an action-adventure game, the fifth main installment in Tomb Raider series and sequel to 1999 game Tomb Raider: The Last Revelation. 

###Plot 
The story continues the plot of the Last Revelation. After the collapse of Great Pyramid of Giza, the game’s protagonist Lara Croft is presumed dead. Her three friends come together on her funeral and tell three stories about her recent adventures that did not appear in previous games. These three stories take the most of the game’s playtime. 

###Gameplay 
The gameplay shares many similarities with Last Revelation. The levels in the game incorporate platforming, puzzle solving and fighting enemies. Lara can use many different weapons in combat such as her iconic double pistols with infinite ammo, submachine guns, shotguns, harpoon guns. The new item to the series is grappling gun. It can fire grappling hook that clings on certain surfaces and produces a rope that can be used to swing across rooms and get over pits. 
Platforming sequences require Lara to use different acrobatic moves like somersaults, walking the tightrope, swinging on horizontal bars. Some levels take place underwater where a player must use weapons and items different from the other parts of the game.",,,"Dreamcast, Classic Macintosh, PlayStation, PC","Action, Shooter, Adventure","Singleplayer, Third Person, Classic, Female Protagonist, Action-Adventure, Lara Croft, Single player only",Core Design,"Square Enix, Aspyr, Eidos Interactive",2000
52943,final-fantasy-ix,Final Fantasy IX,2000-07-07,84.0,4.34,568,5,2315,0,1000000,"Final Fantasy IX (ファイナルファンタジーIX, Fainaru Fantajī Nain) is a 2000 role-playing video game developed and published by Square for the PlayStation video game console. It is the ninth title in the main Final Fantasy series and the last to debut on the original PlayStation. The game plot centers on the consequences of a war between nations in a medieval fantasy world called Gaia. Players follow bandit Zidane Tribal, who kidnaps Alexandrian princess Garnet Til Alexandros XVII as part of a gambit by the neighboring nation of Lindblum. He joins Garnet and a growing cast of characters on a quest to take down her mother, Queen Brahne of Alexandria, who started the war. The plot shifts when the player learns that Brahne is a pawn of a more menacing threat, Kuja, who shares a mysterious history with Zidane spanning two worlds.
The game was developed alongside Final Fantasy VIII. Envisioned by developers as a retrospective for the series, it departed from the futuristic settings of Final Fantasy VII and Final Fantasy VIII by returning to the medieval style of the first six installments. Consequently, it was influenced heavily by the original Final Fantasy game, and features allusions to the rest of the titles. Despite this approach, the game did introduce new features to the series, such as ""Active Time Event"" cutscenes, ""Mognet"", and unique equipment and skill systems.
Final Fantasy IX was released to critical acclaim. It is often cited by critics and fans as one of the best Final Fantasy titles, and holds the highest Metacritic score of the series. Final Fantasy IX was commercially successful, selling more than 5 million copies worldwide by March 2003 and 5.5 million copies by February 2016. It was re-released in 2010 as a PSOne Classic on the PlayStation Store; this version was compatible with PlayStation 3 and PlayStation Portable, and PlayStation Vita support arrived in 2012. In 2016, ports featuring minor gameplay and graphical enhancements were released for iOS, Android and Microsoft Windows followed by a port for PlayStation 4 in 2017.",,,"iOS, PlayStation 4, PlayStation, Android, Nintendo Switch, PC, Xbox One","Adventure, RPG","Singleplayer, Steam Achievements, Multiplayer, Steam Cloud, Atmospheric, steam-trading-cards, Great Soundtrack, RPG, Story Rich, Open World, Partial Controller Support, Fantasy, Funny, Exploration, Classic, Anime, role-playing, Turn-Based, Medieval, JRPG, Steampunk, Turn-Based Combat, Cult Classic, Party-Based RPG","Square Enix, Sony Interactive Entertainment, Square, GUILD STUDIO, Guld Studio, Silicon Studio Thailand","Electronic Arts, Square Enix, Square",2000
22512,diablo-2,Diablo II,2000-06-29,88.0,4.39,1144,0,2007,194,1000000,"Diablo II is an action role-playing hack and slash video game developed by Blizzard North and published by Blizzard Entertainment in 2000 for Microsoft Windows, Classic Mac OS, and Mac OS X. The game, with its dark fantasy and horror themes, was conceptualized and designed by David Brevik and Erich Schaefer, who with Max Schaefer acted as project leads on the game.",http://us.blizzard.com/games/d2/,,"PC, macOS","Action, RPG","Hack and Slash, exclusive, true exclusive",Blizzard North,Blizzard Entertainment,2000
21709,unreal-tournament-game-of-the-year-edition,Unreal Tournament: Game of the Year Edition,2000-10-25,92.0,4.32,222,1,1639,0,1000000,"Unreal Tournament: Game of the Year Edition is a competitive arena first-person shooter. It is the continuation of Unreal series and was developed by Epic Games.

###Gameplay
Although the game was marketed as a multiplayer game, singleplayer mode is also present in order to prepare the new players for the multiplayer battles. The player has to complete 45 matches and face the current Tournament champion.

###Game modes
Five game modes are present in the game. 

Deathmatch, where the player with the highest kill count wins.

Team Deathmatch, which is the same Deathmatch but with the teams of 2 or 4 competing with each other.

In Last Man Standing, the players have a certain amount of lives. The player that loses all his lives is eliminated from the round.

In Domination, two teams fight over three markers. Upon capturing a marker, the team is given points for holding it. The team with the highest score wins.

Capture the Flag is played on balanced and symmetric maps. Two teams spawn on their bases on which the team's flag is stationed. The objective of the mode is to steal the opponent's flag and carry it to your own base. The team that steals three flags first, wins. 

###Weapons and gadgets
There are ten types of weapons present in the game. Every weapon has an alternate fire mode. Apart from weapons, the players can use the Translocator in order to quickly teleport from one point to another. This gadget can also be used to inflict more damage to your enemies.",https://www.epicgames.com/unrealtournament/en-US/,https://www.reddit.com/r/unrealtournament/,PC,"Action, Shooter, Massively Multiplayer","Singleplayer, Multiplayer, Great Soundtrack, Co-op, cooperative, First-Person, Sci-fi, FPS, Gore, Classic, Moddable, Fast-Paced, Competitive, 1990's, Arena Shooter",Epic Games,,2000
22900,daikatana,John Romero's Daikatana,2000-05-23,,2.45,72,1,1605,123,3956,"Daikatana is a first-person shooter directed by id Software’s co-founder John Romero.  

###Plot and setting 
The game is divided into four episodes each of which takes place in a different location: 25th century Japan, Norway in early Medieval, ancient Greece and San Francisco in 2030. The story revolves around Daikatana, a mysterious sword crafted in medieval Japan that lets its wielder travel through the time. The plot follows Hiro Miyamoto, famed swordmaster from Japan of the future. He finds out that the current ruler of the world used Daikatana to alter the history and conquer the world by controlling the cure from a fatal disease that struck humanity in 2030. The hero now must go back in time to fix the story and take Daikatana from the hands of evil.  

###Gameplay 
The game consists of 24 levels. The gameplay shares many similarities with other first-person shooters in that era.
You have to complete a series of levels killing hordes of enemies and solving puzzles. In each of four episodes, you get new sets of weapons and new monsters to fight with. One of the most notable gameplay mechanics of Daikatana is that on the most level you have two sidekicks. The help you in battles, can wield different weapons and their health meter. If they die in a battle, the game is over. The player can issue seven commands to your companions such as attack, stay, get, come, back off, yes, no. 

###Game versions 
The game got its Game Boy Color version the same year. It had drastically different gameplay more reminiscent of dungeon crawler and was only released in Europe.",,,"Nintendo 64, PC","Action, Shooter","Singleplayer, Multiplayer, cooperative","Ion Storm, Prolific Publishing","Square Enix, Eidos Interactive, Sold Out, Acer, Sold Out Sales, Kotobuki Systems, Kotobuki System Co.",2000
22685,heroes-of-might-and-magic-3-complete,Heroes of Might and Magic 3: Complete,2000-03-31,,4.5,670,1,1459,0,1000000,"Includes Heroes of Might & Magic III and its expansions: Armageddon's Blade and The Shadow of Death
Murder, treachery, resurrection, savage battles and ultimately-freedom!
When Erathia's King Gryphonheart is murdered by traitors he is resurrected as an undead warlord who leads a ruthless invasion of his former Kingdom. Little resistance is met until his daughter Catherine, Queen of Enroth, returns to her homeland commanding an army of elite Enrothian warriors. Meanwhile the Necromancers raise large hordes of undead and advance towards the Erathian capitol. Queen Catherine receives the aid of her father's survived generals and embarks on a crusade to reclaim her lost land.
You control the greatest heroes and fiercest creatures in a conflict of epic proportions, as Cathereine fights to restore her family's rightful reign, uncover her father's killers and free him from the dark prison of his undead body!
This is a must have for every Might and Magic series fan! Insanely addictive gameplay that will make you want to play “just one more turn” over and over again
Great multiplayer, especially when playing in hot seat mode on one PC",,,PC,Strategy,"Singleplayer, Multiplayer, cloud saves",New World Computing,Ubisoft Entertainment,2000
