id,slug,name,released,metacritic,rating,ratings_count,playtime,added,twitch_count,youtube_count,description,website,reddit_url,platforms,genres,tags,developers,publishers,year
32099,speedball-2-brutal-deluxe,Speedball 2: Brutal Deluxe,1990-01-01,64.0,0.0,5,0,24,0,0,"<p>Speedball 2: Brutal Deluxe is an action, sports and arcade game developed by The Bitmap Brothers. It was originally released in 1990. It was published by Akella. Speedball 2: Brutal Deluxe has a Metascore of 64, based on professional reviews. The game is rated as ""Exceptional"" on RAWG. <br>Speedball 2: Brutal Deluxe is available on Commodore / Amiga, SEGA Master System, Atari ST and Game Boy. <br>It was produced by Antoine Voisin (DS version), '''C64''': Micheal Merren and Michael Merren. David Leitch and Michael Merren directed the game. David Whittaker, Martin Walker, Martin Walker (Game Boy) and Matt Furniss scored the game. <br></p>",http://www.bitmap-brothers.co.uk/our-games/past/speedball2.htm,,"Commodore / Amiga, SEGA Master System, Atari ST, Game Boy, Game Boy Advance, Xbox 360, Genesis, PC","Action, Sports, Arcade","Singleplayer, Multiplayer, exclusive",The Bitmap Brothers,"Akella, Empire Interactive, Image Works, Tower Studios, Arena Entertainment, SOFEL",1990
30578,altered-destiny,Altered Destiny,1990-09-30,,0.0,1,1,24,0,0,"Put away the reality you've known: you won't be needing it on this trip.One minute you're just a guy eating nacho-flavored popcorn. The next you're sucked through a TV into a fantastic alien world filled with exotic landscapes and lifeforms. Welcome to the strange destiny of P. J. Barrett.
Follow P.J. through a marvelous realm of acid pools and frags, quirls and fluboxes, floaters and wraiths. There's a deep mystery here that only he – with your help – can solve.
Encounter dozens of alien lifeforms on your journey to save the universe.
Unravel multiple layers of intriguing puzzles and solutions.
Immerse yourself in a hauntingly beautiful soundtrack with more than 25 songs.
Explore over 90 screens filled with vibrant colors and surprising animation.
Choose from point-and-click or arrow-key navigation at your choice of game speed.
Interact with the world through a text parser that recognizes full sentences and more than 1,500 words.",,,PC,Adventure,"Singleplayer, Sci-fi, Fantasy, Classic, Retro, Space, Point & Click, Colorful, Aliens, Surreal, 1990's, 1980s, Psychedelic",Accolade,"Ziggurat, Ziggurat Interactive",1990
54160,yo-noid,Yo! Noid,1990-03-16,,4.12,8,0,23,0,0,"Yo! Noid, known in Japan as Kamen no Ninja Hanamaru (仮面の忍者 花丸, Kamen no ninja Hanamaru, lit. ""Masked Ninja Hanamaru""), is a 2D action platform game developed by Now Production and published by Capcom for the Nintendo Entertainment System. The game was first released in Japan on March 16, 1990 and was localized in the United States to promote the Noid, the mascot of Domino's Pizza in the late 1980s. The game is also released as part of Nintendo's PlayChoice-10 series and featured in the Japanese TV show GameCenter CX.",,,NES,,Singleplayer,Now Production,Capcom,1990
54089,tecmo-bowl-1990,Tecmo Bowl (1990),1990-11-13,,0.0,5,0,22,0,0,"Tecmo Bowl (Japanese: テクモボウル, Hepburn: Tekumo Bōru) is an American football arcade game developed and released by Tecmo in 1987. The game was successful in its original arcade format, and as a 1989 port for the Nintendo Entertainment System. The NES version is the first console game to have featured real NFL players, via a license from the NFLPA. Although LJN's NFL is the first NES game to have featured NFL team names, it was not as successful as Tecmo Bowl. Because of this, and combined with the scarcity of the arcade version, the NES version eclipsed its arcade counterpart in popularity. The NES version was ported to mobile phones in 2004—and then to the North American Virtual Console: March 12, 2007 for the Wii, September 12, 2013 for the Nintendo 3DS, and on September 10, 2015 for the Wii U. The game was also included on the NES Classic Edition, which launched in 2016. The arcade version for the Wii Virtual Console was released in North America on August 3, 2009 and in Japan on September 29, 2009. The game is notorious for how much better Los Angeles Raiders running back Bo Jackson is than the rest of the players in the game, as he can make it through the defense almost every time.",,,"Wii, Game Boy, Nintendo 3DS, Wii U, NES",,"Singleplayer, Multiplayer, 2 players, Arcade: 1-4 players","Sculptured Software, Tecmo",Tecmo,1990
14998,eswat-city-under-siege,ESWAT: City Under Siege,1990-07-14,,3.29,7,0,22,0,0,"The largest and most powerful terrorist group in the world, known as E.Y.E., is looking to take total control of Earth!
Join the government controlled group of troopers, ESWAT™ (Enhanced Special Weapons And Tactics), and eliminate the terrorists!",http://www.sega.com,,"Genesis, PC",Action,"Singleplayer, Partial Controller Support, Retro",SEGA,SEGA,1990
55502,jrr-tolkiens-the-lord-of-the-rings-vol-i,"J.R.R. Tolkien's The Lord of the Rings, Vol. I",1990-01-02,,0.0,4,0,21,0,0,"J.R.R. Tolkien's The Lord of the Rings, Vol. I is a role-playing video game published by Interplay Productions. It is an adaptation of The Fellowship of the Ring by J. R. R. Tolkien, being the first volume in The Lord of the Rings.
The game was released in 1990 for DOS, in 1991 for the Amiga and PC-98, and in 1992 for the FM Towns. It was followed by J.R.R. Tolkien's The Lord of the Rings, Vol. II: The Two Towers. It was originally designed for the Commodore 64, but the production team switched to the newer platforms.",,,"PC, SNES, Commodore / Amiga",RPG,"Singleplayer, Multiplayer, RPG, Fantasy, Turn-Based, Top-Down, licensed, role-playing-game, open-ended, lotr, experience-points, tolkien, lord-of-the-rings, j.r.r. tolkien, exp, frodo, lord-of-the-ring, xp, misfortune, sauron, isildur, middle earth, frodo-baggins","Interplay Entertainment, Silicon & Synapse","Electronic Arts, Interplay Productions, StarCraft",1990
53878,jackie-chans-action-kung-fu,Jackie Chan's Action Kung Fu,1990-12-14,,3.83,6,0,21,0,0,"Jackie Chan's Action Kung Fu (ジャッキー・チェン, Jakkī Chen, Jackie Chan) is an action platform video game developed by Now Production and published by Hudson Soft. It was first released for the Nintendo Entertainment System in 1990 and for the TurboGrafx-16 in 1991.",,,"PC, NES",Platformer,Singleplayer,Now Production,HUDSON SOFT,1990
53856,gun-nac,Gun-Nac,1990-10-05,,0.0,5,0,21,0,0,"Gun-Nac (ガンナック, Gan-Nakku) is a 1990 scrolling shooter video game developed by Compile and published by Tonkin House for the Nintendo Entertainment System. The game was released in Japan on October 5, 1990 and in North America in September 1991.",,,NES,,Singleplayer,Compile,"ASCII, Tonkin House",1990
57108,musha-1990,MUSHA (1990),1990-12-21,,0.0,4,0,21,0,0,"MUSHA is a vertically scrolling shoot 'em up video game developed by Compile and released on the Sega Genesis in 1990. An entry in Compile's shooter series, Aleste, MUSHA places the player in the role of a flying mecha pilot who must destroy a large super intelligent computer threatening planet Earth. Development lasted less than one year. Originally the game had a working title of ""Aleste 2"" and featured a style similar to the first game, but it was redirected to feature a Japanese aesthetic and a speed metal soundtrack.
Initial reception for MUSHA was mixed. Critics found themselves overwhelmed by the sheer amount of shoot 'em ups on the Sega Genesis and felt the title was unremarkable. Journalists generally agreed the game had great graphics and enjoyable gameplay, but felt it was unoriginal and not very challenging. The game was re-released on the Wii Virtual Console in Japan in 2008, and the West in 2009. In retrospective reviews for its re-release, MUSHA garnered much higher praise, being cited for its challenging gameplay, strong soundtrack, and graphics considered ahead of its time. It remains among the most highly regarded shoot 'em ups on the Genesis and is considered among the best of the 16-bit era. Original MUSHA cartridges have become rare and command high prices in the collector market.",,,"Genesis, Wii, Nintendo Switch","Action, Shooter, Arcade",Singleplayer,Compile,"Toaplan, Seismic",1990
53926,mad-max-1990,Mad Max (1990),1990-07-01,,0.0,5,0,21,0,0,Mad Max is a post-apocalyptic action game developed and published by Mindscape for the Nintendo Entertainment System in 1990. The game is based on the 1981 Australian film Mad Max 2.,,,NES,Action,Singleplayer,Mindscape,MINDSCAPE,1990
54093,tecmo-world-cup-soccer,Tecmo World Cup Soccer,1990-12-07,,3.62,8,0,21,0,0,"Tecmo World Cup Soccer is a video game for the Nintendo Entertainment System. Released in 1990 by Tecmo, as its name suggests it is a soccer game focusing on the World Cup.
Tecmo World Cup Soccer is not to be confused with Nintendo World Cup of the same year, nor Tecmo Cup Soccer Game released in September 1992, is a port of Tehkan World Cup adapted to the NES hardware. Although the two games appear virtually identical, Tecmo World Cup Soccer lacks some of the speed and fluidity of its arcade progenitor. While the gameplay is ostensibly unchanged, the lack of support for analog control in the NES version renders it a digital-control-only game that requires almost completely different tactics.",,,NES,Sports,"Singleplayer, Two-player",Tecmo,Tecmo,1990
22707,wing-commander-12,Wing Commander 1+2,1990-09-25,,0.0,2,0,21,0,0,"You may be the hottest pilot in the fleet, but this will cool your jets! In Wing Commander you blast your way through the Vega Campaign. You’d better be as good as your reputation because the stakes are too high to play it safe. Just when you think that the action can’t get any more intense, or the opposition any stiffer, you’ll plunge into Wing Commander II. Disgraced and unjustly court-martialed, you have to prove yourself once again and earn the respect of the Confederation High Command. Of course, there is also the little matter of preventing the destruction of the Terran home-worlds.This bundle includes the following expansions: Wing Commander: The Secret Missions, Wing Commander: The Secret Missions 2: Crusade, Wing Commander II: Special Operations 1, Wing Commander II: Special Operations 2.
The classic of classics, grandfather for a new genre, and an example that was followed by all future space sims
One of the best dynamic soundtracks ever to appear in a video game
The branching storyline's shape is based on your successes or failures; you will never have to replay a failed mission",,,"PC, macOS","Action, Shooter",Singleplayer,Origin Systems,Electronic Arts,1990
54058,solstice-1990,Solstice (1990),1990-07-20,,0.0,4,0,20,0,0,Solstice is a puzzle-oriented video game for the Nintendo Entertainment System created by Software Creations and influenced by Ultimate Play the Game's Knight Lore and Pentagram. Its theme music was scored by composer Tim Follin.,,,NES,Puzzle,Singleplayer,Software Creations,"Sony Computer Entertainment, Nintendo, Sony Interactive Entertainment, CSG Imagesoft",1990
493450,timequest-2,Timequest,1990-12-31,,0.0,0,1,20,0,0,"Extensive damage to 3000 years of history reported on four continents – Report for duty immediately.
The unthinkable has happened – a renegade from the Temporal Corps has traveled back in time and altered critical events in history. Only you can prevent this madman from shattering the timestream and destroying current civilization.
Your mission will take you to four continents and across three thousand years – from Stonehenge, the Circus Maximus and the Hanging Gardens of Babylon; to the Aztec Temple of the Sun, the Great Wall of China and the Great Pyramid of Cheops. You will face mystery, intrigue, danger and death as you untangle his masterful web of deceit.
The villain's targets include Julius Caesar, Attila the Hun, Charlemagne, Harun al-Rashid, Genghis Khan, Montezuma, Napoleon Bonaparte and many others. Your orders are to repair the timestream, track this criminal down, and bring him to justice.
Timequest is a classic graphical text-based adventure game of breathtaking scope and astonishing depth. Travel to 80 locations to see the effects of your actions unfold over 3 millennia. A treat for science-fiction fans and adventure enthusiasts alike, Timequest includes time-travel puzzles played through the innovative Legend Entertainment interface for text adventures",https://www.ziggurat.games/,,PC,Adventure,"Singleplayer, Sci-fi, Retro, Point & Click, Mystery, history, death, Text-Based, sun, repair",Legend Entertainment,"Ziggurat, Ziggurat Interactive",1990
23044,forgotten-realms-the-archives-collection-one,Forgotten Realms - The Archives - Collection One,1990-12-31,,0.0,4,0,20,0,0,"The Forgotten Realms world of Dungeons & Dragons has been home to many a hero and imagination since its publication, producing adventures and stories to be retold and enjoyed for years to come. The Forgotten Realms Archive - Collection One allows you to journey through one such set of adventures: the Eye of the Beholder trilogy, a set of first-person, real-time role-playing games.
Eye of the Beholder
A new evil is plaguing the city of Waterdeep, stalking the streets and preying on its citizens. Though initially thought to come from afar, this great evil, known only as Xanathar, instead resides within Waterdeep and, if not stopped, threatens to overwhelm the city. The Lords of Waterdeep believe that the evil lurks in the sewers below and have commissioned a party of adventurers to investigate and foil this nefarious plot. Granted full rights of marque and ownership of any treasure, artifacts or valuables you find on your quest, you must venture into the chasms, discover the nature of this evil and destroy it by any means necessary.

Eye of the Beholder II: The Legend of Darkmoon
Following your quest in the sewers beneath, you and your party are recovering with Waterdeep’s finest healers, when a letter arrives from Khelben Blackstaff, mystic advisor to the Lords of Waterdeep. Trouble is brewing in the Northern and Western regions, and he has tasked you with exploring the land and investigating these incidents. Although nothing has been confirmed, renowned but troublesome archaeologist, Wently Kelso believes the disturbances are related to an evil uprising and the presence of a powerful ancient artefact. These troubles could, of course, simply be the work of unruly bandits, but since Kelso’s previous findings in the sewers of Waterdeep proved true,  one would be wise not to easily dismiss his opinion on the matter. Therefore, you should exercise greater care and vigilance as you begin your next adventure.

Eye of the Beholder III: Assault on Myth Drannor
Having rid the sewers of Waterdeep and the dreaded Temple Darkmoon of the evil forces within, you and your companions are surely deserving of a strong drink, good food and a warm fire. And so, your first port of call is to the nearest tavern, where you slop ale all over yourself and engage in jovial antics as you regale your adventures to your captivated listeners and admirers. However, in the midst of your retelling, the tavern door is thrust open by a hooded figure, whose eyes scan the crowd before locking on you and your party. Approaching you, he quickly introduces himself and explains his reasons for disturbing the festivities; his master wishes you to free the ruined city of Myth Drannor from the clutches of a Lich and restore it to its former glory. Looks like your adventures aren’t over just yet…
With an original story set in the Forgotten Realms universe, the Eye of the Beholder trilogy is based on the Advanced Dungeon & Dragons 2nd Edition’s game rules. Bringing the immersion, wonder and epicness of a D&D campaign to the PC, the Eye of the Beholder is a genre-defining and beloved series for RPG and Dungeons & Dragons fans alike.Assemble your party across various races and classes - from human to dwarf, cleric to thief
Use weapons, magic and resolve to ensure your survival as you complete your quests
Transfer your party across all three titles to keep your band of adventurers together to the very end
Explore the various dungeons, ruins and secrets that Waterdeep Sewers, Temple Darkmoon and Myth Drannor have to offer
Fight a wide array of monsters and restore peace to the Forgotten Realms",,,"Linux, PC, macOS",RPG,"Singleplayer, role-playing","Strategic Simulations, Westwood Associates",GOG,1990
257179,cross-fire-1990,Cross Fire (1990),1990-11-02,,3.29,7,0,20,0,0,"CrossFire is a side-scrolling run-and-gun somewhat reminiscent of Contra series, although played at a slower pace. All that is known about the plot is that you are Eric the soldier and you single-handedly fight evil all over the world, from Vietnam to Colombia. You start with your fists and grenades, but soon obtain a sub-machine gun which can be upgraded to spread shot and even to rocket launcher. The upgrades are usually located in breakable crates. Unlike most Contra games, Eric doesn't die in a single hit, but has a lifebar which is partially replenished or extended every time he picks up a weapon upgrade or a medal.",,,NES,Action,"fight, gun, evil, rocket",Sanritsu Denki,Kyugo,1990
54316,simearth,SimEarth,1990-01-01,,0.0,3,0,19,0,0,"SimEarth is a life simulation video game, the second designed by Will Wright, in which the player controls the development of a planet. The game was published in 1990 by Maxis. Versions were made for the Apple Macintosh, Commodore Amiga, IBM PC, SNES, Sega Mega-CD and TurboGrafx-16. It was also subsequently re-released on the Wii Virtual Console.",,https://www.reddit.com/r/SimEarth/,"PC, Wii, Classic Macintosh, SNES, SEGA CD, Commodore / Amiga",Simulation,Singleplayer,"Maxis, GAME ARTS, Tomcat System","SEGA, Maxis, Fujisankei Communications International",1990
56826,super-monaco-gp,Super Monaco GP,1990-08-09,,4.0,7,0,19,0,0,"Super Monaco GP (スーパーモナコGP) is a Formula One racing simulation video game released by Sega, originally as a Sega X Board arcade game in 1989, followed by ports for multiple video game consoles and home computers in the early 1990s. It is the sequel to the 1979 arcade game Monaco GP.
The arcade game consists mostly of one race: the Grand Prix of Monaco (though represented by a totally different track, albeit with the same features of the real-life Circuit de Monaco). The player simply chooses a transmission type, qualifies, and race. The player must qualify in under 45 seconds in the shortened track in order to actually race. If he fails, the game ends (though, in the home versions, even if the player fails to qualify, he still starts off the race at the last position). When in the race itself, there is also a position limit, which starts off on 20th (15th in the home versions) and decreases as the player bypasses checkpoints along the track, ultimately stopping on 3rd. If the player falls behind the indicated position and does not manage to recover fast enough, a game over happens.
The game was one of the first games to include a rear-view mirror, along with Winning Run. The Sega Genesis/Mega Drive version of Super Monaco GP adds a World Championship mode. In the World Championship mode, the goal is to win a season of races, and then go on to defend the title. The circuits are modeled on the ones used in the 1989 Formula One season, with background scenery similar to the real-world circuit venues, though without the wealth of details the Arcade version had. This Mega Drive/Genesis version was also released in arcades for the Sega Mega-Tech system board in 1990.",,,"SEGA Master System, Game Gear, Atari ST, Commodore / Amiga, Genesis",Racing,Singleplayer,SEGA,"SEGA, U.S. Gold",1990
54295,powermonger-1990,Powermonger (1990),1990-01-01,,0.0,2,0,19,0,0,"Powermonger (or Power Monger) is a real-time strategy game developed by Bullfrog in 1990, derived from the Populous engine but presented using a 3-dimensional game map.",,,"SEGA CD, Atari ST, Classic Macintosh, Commodore / Amiga, SNES, PC, Genesis",,"Singleplayer, Two-player, modem, null modem",Bullfrog Productions,Electronic Arts,1990
55396,crack-down-1990,Crack Down,1990-12-20,,0.0,5,0,19,0,0,"Crack Down (クラックダウン) is a run and gun arcade game originally released by Sega in 1989, and ported to the Sega Mega Drive/Genesis in 1990. It was also ported and released to a number of home computer platforms by U.S. Gold.
The Mega Drive version of Crack Down was re-released on the Wii Virtual Console in Japan on August 7, 2007 and in PAL regions on September 7, 2007. It released also on Steam on June 1, 2010.",,,"Atari ST, Commodore / Amiga, Genesis","Action, Shooter","Singleplayer, Multiplayer, cooperative",SEGA,"SEGA, U.S. Gold",1990
53756,code-name-viper,Code Name: Viper,1990-02-23,,0.0,4,0,19,0,0,"Code Name: Viper, originally released as Ningen Heiki Dead Fox (人間兵器デッドフォックス, Ningen Heiki Deddo Fokkusu, lit. ""Human Weapon Dead Fox""), is a side-scrolling action game programmed by Arc System Works and released by Capcom in 1990 for the Nintendo Entertainment System. The player takes control of a special forces operative who must combat a drug syndicate in South America.",,,NES,"Action, Shooter",Singleplayer,"Capcom, Arc System Works",Capcom,1990
33351,gunboat,Gunboat,1990-01-01,,0.0,0,0,19,0,0,"Deadly combat at full-throttle
Gunboat: an agile arsenal that can turn 29 knots in the swat of a mosquito. Eight tons of firepower crammed into a 30 ft. hull. For decades, the U.S. Navy has deployed the river patrol boat (PBR) for a most hostile and claustrophobic type of war: riverine combat. Now you’ve been drafted.
The Colombian drug cartel. Loyal troops of a deposed Panamanian dictator. Renegade Viet Cong. They’re on the river — waiting — around any river bend. Bullets rip through the thick jungle air as you maneuver your Gunboat through over 20 missions in hell. They swear the river will run red with your blood. But you’ve got other orders.
Enter 3 sweltering combat zones: Vietnam, Colombia, and Panama
Operate a U.S. Navy River Patrol Boat (PBR) in over 20 missions. Three different maps, identifying target destinations and key sites on the river.
Step into the abyss known as “Riverine Operations.” Your M60 smolders, cocked for yet another round. Spotlights and radar are fully functional. Soldiers, bridges, mines, docks, sampans, APC’s and canyons are depicted in deadly detail.
Get a first-person perspective from 4 battle stations. Fire salvos from the bow, stern and mid-section of the boat – or take the helm as pilot. All four men are cross-trained in each other’s tasks — redundancy becomes crucial if one or two crew members are wounded or dead.
Open fire with authentic gunboat weaponry. Twin .50 cal. M2HB machine guns, .30 cal. M60D general purpose machine guns, Mini-TAT rapid-fire gatling gun, mortars and grenade launchers.",,,PC,"Action, Simulation","Singleplayer, Classic, War, combat, Military, Naval, Vehicular Combat, Naval Combat",Accolade,"Ziggurat, Ziggurat Interactive, Accolade",1990
30785,shadow-knights,Shadow Knights,1990-01-01,,0.0,4,0,19,0,0,"Engage in Fierce Ninja Combat!

You are the Shadow Knight, a ninja on a mission of justice. Use your skills in magic & martial arts to battle the thugs, attack dogs, & skeleton warriors that block your path as you explore vast Oriental landscapes & elaborately designed temples. Victory shall be yours, Grasshopper!",,,PC,"Action, Arcade, Platformer","Magic, Swords, Boss battle, health, health-bar, graveyard, healing, boss-battles, ninjas, sorcery, weeping willows, shogun, mana-bar, weeping-willows","id Software, Softdisk Publishing, Softdisk","Softdisk Publishing, Froggman Software",1990
34512,tank-wars,Tank Wars,1990-01-01,,0.0,3,0,19,0,0,"One-on-One Artillery Game
Play against CPU
16 new weapons
total 48 weapons
Select for your artillery angle, power, and then fire the shot. But take care of the wind!
How to play Tank Battle:
The game is turn-based, where each player controls his own artillery tank on a 2D battlefield. By rotating the tank's turret, selecting the correct force and weapon your goal is to damage your enemies until they run out of health and die. However beware, as the weapons may be used in many ways to create many interesting scenarios and only your planning and skill will be able to grant you victory.
At the end of each round the players may purchase items with money earned from the performance in the game.
mode;
Single player
Hot seat
and practice",,,"PC, Android","Strategy, Arcade","battle, skill, fire, tank, run","Kenneth Morse, arifcengiz",Kenneth Morse,1990
53712,battle-tank,Battle Tank,1990-09-01,,3.67,9,0,19,0,0,"Battletank is an action video game released by Absolute Entertainment in September 1990 for the Nintendo Entertainment System. The game is similar to the Atari game Battlezone, and supports one player. It was considered to be a poorly designed game, as it was intended to become a space flight game for the Commodore 64 during its development.",,,NES,Simulation,Singleplayer,Imagineering,Absolute Entertainment,1990
