id,slug,name,released,metacritic,rating,ratings_count,playtime,added,twitch_count,youtube_count,description,website,reddit_url,platforms,genres,tags,developers,publishers,year
22853,worlds-of-ultima-the-savage-empire,Worlds of Ultima: The Savage Empire,1990-12-29,,1.99,140,1,2143,20,4211,"You, the Avatar, have been transported by your Moonstone to the primitive and savage world of Eodon. There, you must work towards uniting the native tribes to face a common threat: a race of gigantic ants known as the Myrmidex. You won’t be alone, however, as you will be assisted by Professor Rafkin, ace reporter Jimmy Malone, and the exotic jungle princess Aiela. Take control of strange and powerful shamanistic magics and confront a varied bestiary that includes vicious dinosaurs and even mad high priests.
Worlds of Ultima 1: Savage Empire was built using a modified Ultima VI engine; it’s familiar to long-time fans but it’s also a great starting point for people who are new to the world of Ultima. Featuring a text-based conversation system along with turn-based combat, Worlds of Ultima 1: Savage Empire should find a permanent space on your hard drive.Journey to a fierce jungle where savage dinosaurs, stone-age tribes, and mad scientists make their home!
A highly interactive world where you can harvest plants, gather minerals, and craft items from gathered materials.
An old-school RPG in the tried-and-true Ultima tradition.",,,"PC, macOS","Adventure, RPG","Singleplayer, role-playing",Origin Systems,Electronic Arts,1990
24899,super-mario-world,Super Mario World,1990-11-21,92.0,4.37,763,6,1505,162,1000000,"Mario's off on his biggest adventure ever, and this time he's brought along a friend. Yoshi the dinosaur teams up with Mario to battle Bowser, who has kidnapped Princess Toadstool once again. Guide Mario and Yoshi through nine peril-filled worlds to the final showdown in Bowser's castle. Use Mario's new powers and Yoshi's voracious monster-gobbling appetite as you explore 96 levels filled with dangerous new monsters and traps. Climb mountains and cross rivers, and descend into subterranean depths. Destroy the seven Koopa castles and find keys to gain entrance to hidden levels. Discover more warps and thrilling bonus worlds than ever before!",,,SNES,"Arcade, Platformer","Singleplayer, Multiplayer",Nintendo,Nintendo,1990
29391,eye-of-the-beholder,Eye of the Beholder,1990-01-01,,3.21,57,1,1167,123,200343,"Step into war-torn enemy territory in this immersive VR game experience based on the Oscar-shortlisted documentary MY ENEMY, MY BROTHER (2015). EYE OF THE BEHOLDER is a 20 beta minute experience that subverts the war-game genre as players must choose to combat or collaborate with others.
As a documentarian I am inspired by real life situations and stories and in 2014, I was lucky enough to meet two men whose story changed my life and that of many others. Zahed and Najah are former enemy soldiers who have become blood brothers for life. Zahed was an Iranian child soldier during the Iran-Iraq War when he found Najah, an enemy soldier, injured in a bunker. Zahed made a split-second decision in the heat of the battlefield and instead of shooting Najah, he risked his own life to save him. I was deeply inspired by Zahed's ability to recognize the humanity in his enemy. His act of bravery has had lasting ramifications in both their lives and those of their families.
I documented their story in a film, MY ENEMY, MY BROTHER, which resonated strongly with audiences across the world. It landed on the Oscar shortlist, was nominated for an Emmy award, and premiered as a NYTimes OpDoc in 2015. The film evolved into a feature documentary, which premiered at Hot Docs Documentary Film Festival in 2017. The strong international response to the films, as well as feedback in the Q and A sessions, led us to explore the film’s core themes further. We wanted to bring the remarkable empathy that Najah and Zahed felt for one another into a unique space, where audiences would be able to step into their shoes and make choices for themselves, that could make them rethink their decisions in real life. We developed what is now the EYE OF THE BEHOLDER VR immersive experience.
The EYE OF THE BEHOLDER VR subverts the war-game genre to explore how we judge one another as friend or foe. EYE OF THE BEHOLDER is set in a conflict zone, but in essence each decision reflects the kind of snap judgement made in school yards, street corners and board rooms across the globe. Do I trust this person? Are they friendly or a threat? Should I collaborate with this person or fight them?
As the player faces each challenge in the bunker and decides whether or not to collaborate with the other soldiers, their decisions affect how the other soldier responds to them, and ultimately determines who makes it out alive. As the player discovers in the end, their decisions also impact the welfare of nearby communities.",,,"PC, SEGA CD, Game Boy Advance, Atari Lynx, SNES, Commodore / Amiga","Adventure, RPG, Casual, Indie","Singleplayer, First-Person, Choices Matter, Cinematic, VR, Multiple Endings, Visual Novel, Choose Your Own Adventure, Education, Character Action Game, Experimental, Tracked Controller Support, VR Supported, Documentary","Westwood Studios, Strategic Simulations, Westwood Associates, Reptoid Games","SEGA, Capcom, Strategic Simulations, Infogrames Entertainment, Pony Canyon, Fathom Film Group",1990
16122,loom,LOOM,1990-01-01,,4.06,66,1,795,117,813437,"Long after the passing of the Second Shadow, when dragons ruled the twilight sky and the stars were bright and numerous, came the Age of the Great Guilds.
Blacksmiths. Shepherds. Clerics. Each dedicated to the absolute control of secret knowledge.
Another such Guild was the Weavers. Over the centuries, their craft transcended the limits of physical cloth, until they wove the very fabric of reality itself. Now, a strange power has swept the Weavers into oblivion, leaving behind one Weaver boy to unravel the mystery. Help young Bobbin rescue his Guild...and you just might save the universe from an unspeakable catastrophe.
An Extraordinary adventure with an interface of magic…
Stunning, high-resolution, 3D landscapes.
Sophisticated score and musical effects.
Detailed animation and special effects.
Elegant point 'n' click control of characters, objects and magic spells.
No burdensome typing, mapping, or inventory management.
An easy and engaging game for beginners and veterans alike.",http://www.lucasarts.com/,,"Atari ST, Classic Macintosh, PC, Commodore / Amiga, Linux, macOS",Adventure,"Singleplayer, Steam Cloud, Atmospheric, Third Person, Fantasy, Classic, Pixel Graphics, Point & Click, Short, Music, 1990's","LucasArts Entertainment, Lucasfilm, Realtime Associates","Disney Interactive, LucasArts Entertainment, Lucasfilm Games, NEC",1990
15576,wizardry-6-bane-of-the-cosmic-forge,Wizardry 6: Bane of the Cosmic Forge,1990-12-31,,2.74,22,1,707,0,4383,"FULL-COLOR ANIMATED graphics
DIGITIZED sound (NO add-on cards required)
HARD DISK supported
11 Races, 14 Professions (with rankings!)
Weaponry, Physical and Academia Skills
Six Spellbooks, 462 Combinations
Non-Player Characters
An arsenal of over 400 researched items
Varied Fighting Modes
Primary and Secondary Attack
Continuous Journey
Unlimited Backups
Save Game
Ten years ago, WIZARDRY set the standards in Fantasy Role-Playing (FRP). Now after two million copies have been sold and dozens of awards have been won, Bane of the Cosmic Forge raises and redefines those standards. This new WIZARDRY, the truest simulation ever of Fantasy Role Playing, will push your computer, your mind, and your sense of adventure to their very limits. Only through the power of the latest computer technology could the full dimensions of this new genre in FRP be possible.
This is FRP the way you wanted it to be.
Prepare yourself. Take with you six companions - choose wisely, for having chosen, your fate is in their hands. Enter the ancient castle to retrieve the Cosmic Forge, a magical pen whose writings caused the river of time itself to change course. You will find treasure, armor, and magic items to advance your quest; meet wizened and cryptic dwellers who hold secrets that must be unearthed; and solve the riddles and puzzles that abound.
But beware- you and your party will encounter countless dangers, hazards, and creatures of dazzling form to block your way. Only through your magic and skills, ever growing as you progress, can they be vanquished.
And the story, so rich in mythology and legend, weaves a web of intrigue so complex that only you, with patience and travail can unravel.
Let the computer roll the dice, consult the charts and apply the rules. From the 400 items of armor and weaponry researched for authenticity to the realistic combat structure, incorporating Primary and Secondary attack, this reproduction of true FRP within the computer environment will make all other attempts obsolete.
The adventure is as real as the pleasure.",http://www.nightdivestudios.com/games/wizardry-6/?utm_source=steampowered.com&amp;utm_medium=product&amp;utm_campaign=website%20-%20wizardry%206,,"PC, macOS, Linux","Adventure, RPG","Singleplayer, RPG, First-Person, Fantasy, Classic, Turn-Based, Dungeon Crawler, Turn-Based Combat, CRPG, Party-Based RPG, Grid-Based Movement",Sir-Tech,"Nightdive Studios, Gamepot, ASCII",1990
19193,sengoku,SENGOKU Anthology,1990-12-31,70.0,2.14,7,2,409,19,847270,"Sengoku is a deep character driven strategy game set in 16th century Japan. Play as a Japanese nobleman and unite the land of the Rising Sun under your iron fist. Use your military might, your smooth talking tongue, and your guile to increase your power. Watch your enemies fall like cherry blossoms in the early dawn of spring. Doublecross your enemies in an honorable and auspicious manner. Always make sure you have competent heir, if you should die before your destiny has been reached.
Key features						Play as a Feudal Japanese Lord and manage your relations with family, friends, and enemies
Rise in influence and power inside your clan and then move on to claim the ultimate prize, the control of Japan
Conquer and grow while rewarding your most valued retainers as you make a bid to become Shogun
Detailed historical map of Japan, divided into over 350 different provinces, during the Warring States era
Manage your relations with three different religious factions, the Shinto, the Christians and the Buddhists
Employ the aid of powerful Ninja clans when your Samurai armies are not enough",http://www.sengokugame.com,,"PC, Wii, Xbox One, PlayStation 4, Nintendo Switch, PlayStation 2","RPG, Strategy, Simulation","Singleplayer, Multiplayer, steam-trading-cards, RPG, Historical, Medieval, Real-Time with Pause, Grand Strategy","Paradox Development Studio, Code Mystics","Paradox Interactive, SNK, D4 Enterprise Co.",1990
29839,the-secret-of-monkey-island,The Secret of Monkey Island,1990-10-01,,4.32,187,0,379,149,246212,"From Wikipedia:
The Secret of Monkey Island is a 1990 point-and-click graphic adventure game developed and published by Lucasfilm Games. It takes place in a fantastic version of the Caribbean during the age of piracy. The player assumes the role of Guybrush Threepwood, a young man who dreams of becoming a pirate and explores fictional islands while solving puzzles.
The game was conceived in 1988 by Lucasfilm employee Ron Gilbert, who designed it with Tim Schafer and Dave Grossman. Gilbert's frustrations with contemporary adventure titles led him to make the player character's death almost impossible, which meant that gameplay focused the game on exploration. The atmosphere was based on that of the Pirates of the Caribbean theme park ride. The Secret of Monkey Island was the fifth game built with the SCUMM engine, which was heavily modified to include a more user-friendly interface.",,,"macOS, PC, Atari ST, Classic Macintosh, SEGA CD, Commodore / Amiga",Adventure,"Singleplayer, Comedy, Point & Click, Dark Humor","LucasArts Entertainment, Lucasfilm","LucasArts Entertainment, Lucasfilm Games",1990
53747,chip-n-dale-rescue-rangers,Chip 'n Dale Rescue Rangers,1990-06-08,,4.24,193,0,360,0,222336,"The rescue rangers are tiny heroes. Consisting of two chipmunks, two mice and a fly... these heroes may be small but there's no case too big for them to take on. This game starts out simply enough, with a mission to rescue a small kitten, but soon escalates into a wider plot that pits the rescue rangers against their arch-nemesis, the feline kingpin, Fat Cat.",,,NES,"Adventure, Platformer","Singleplayer, Multiplayer, cooperative",Capcom,Capcom,1990
17884,pharaohs-tomb,Pharaoh's Tomb,1990-12-14,,1.89,9,1,312,5,72139,"Nevada will be forced to overcome the seemingly impossible. Monsters, mummies and bats are just some enemies you will have to defeat, as well as environmental hazards such as traps, pits, and falling spikes.
Run, jump and spear your way through the Pharaoh's Tomb in adventure as timeless as the Pharaoh himself.Features
Intrepid Explorer: 20 exciting, hazard-filled levels to explore.
High-Score Hero: A high-score table allows your to track your treasure-hunting skills.
Treasure Hunter: Find bonus items to increase your wealth.
Blast from the FAST: Utilizes the FAST (Fluid Animation Software Technology) system for flicker-free movement.
Controller Support: Partial Xbox 360 Controller support.",https://3drealms.com/catalog/pharaohs-tomb_46/,,"macOS, PC","Action, Platformer","Singleplayer, Partial Controller Support, Retro",3D Realms,"3D Realms, Apogee Software, Apogee",1990
27168,dr-mario,Dr. Mario,1990-07-27,,3.88,125,0,286,137,1000000,"Feeling under the weather? Well, Dr. Mario has the cure for you! Help
him fight bodies of nasty viruses with multi-colored vitamins,
eliminating those germs faster than they can multiply. Rotate the
vitamins as they drop, and gain a higher score by aligning multiples of
the same color. Clear all of the viruses to move on to the next round.
But watch out as the vitamins start dropping at a faster rate! Not
enough of a challenge? Try competing against a buddy, and prove that
you're just what the doctor prescribed!
This classic game is part of the Virtual Console service, which brings you great games created for consoles such as NES™, Super NES™ and Game Boy™ Advance. We hope you'll enjoy the new features (including off-TV play) that have been added to this title. See more Virtual Console games for Wii U.",,,"Nintendo 3DS, Wii U, Game Boy, Game Boy Advance, NES, SNES",Puzzle,"Singleplayer, Multiplayer, puzzles",Nintendo,Nintendo,1990
59125,teenage-mutant-ninja-turtles-ii-the-arcade-game,Teenage Mutant Ninja Turtles II: The Arcade Game,1990-11-30,,4.27,91,0,217,0,574298,"April O'Neil, the reporter friend of the Teenage Mutant Ninja Turtles, is kidnapped by the villainous Shredder and his two goons, Bebop and Rocksteady. The four ninja turtles: Raphael, Michelangelo, Donatello and Leonardo fight their way through hordes of Foot Soldiers in order to rescue April. They battle familiar foes such as the mad scientist Baxter Stockman, General Traag from Dimension X and the evil alien brain Krang, up to the final showdown with Shredder himself.

Teenage Mutant Ninja Turtles is an arcade game made by Konami during the height of the cartoon series' popularity. Depending on the version of the game, up to two, three or four players can take part in the action. The game plays like a simplified Double Dragon. While most of the standard Foot Soldier enemies are easily dispatched, some attack with knives or ray guns and are thus more dangerous. At the end of each level, players encounter a boss (or in certain cases two bosses working in tandem, such as Bebop and Rocksteady).

The NES version of the game, renamed Teenage Mutant Ninja Turtles II: The Arcade Game in the West, features additional content not present in other versions of the game: two new levels (Snowy Central Park and The Dojo), new bosses (including Tora, Shogun and Baxter Stockman as a fly), additional music tracks as well as more variations of Foot Soldiers.",,,"Xbox 360, Atari ST, NES, Commodore / Amiga","Action, Arcade","Music, battle, Cartoon, alien, guns, brain, fly, NES",Konami Digital Entertainment,Konami,1990
53940,mega-man-3-1990,Mega Man 3 (1990),1990-09-28,,3.97,91,0,208,0,220497,"Mega Man 3, known as Rockman 3: Dr. Wily no Saigo!? (ロックマン3 Dr.ワイリーの最期!?, ""Rockman 3: The End of Dr. Wily!?"") in Japan and Mega Man III in game, is an action-platform video game developed and published by Capcom for the Nintendo Entertainment System. It is the third game of the original Mega Man series and was originally released in Japan on September 28, 1990. The game localized in North America later in 1990 and in European regions in 1992. Taking place after the events of Mega Man 2, the plot follows the titular hero as he helps his creator, Dr. Light, and a former villain, Dr. Wily, collect parts for a peace-keeping robot by defeating several Robot Masters that have gone haywire.
A platform-action game, Mega Man 3 follows the same format set forth by its two predecessors. The player, as Mega Man, must complete a series of stages in any order. Defeating a stage's boss will earn the player its special weapon, which can be selected and used at will throughout the rest of the game. Mega Man 3 introduces new gameplay elements such as Mega Man's canine sidekick Rush and the ability to slide along the ground. Unlike with the first two installments of the series, artist and designer Keiji Inafune has considered the creation of Mega Man 3 to be very stressful due to time constraints and his own increased responsibilities during its development.
Following the success of Mega Man 2 released two years earlier, Mega Man 3 has sold 1.17 million copies and has been positively received in critical reviews. Its presentation and gameplay has been especially praised, although many sources found the game to be too difficult. Like other titles in the series, Mega Man 3 has been re-released several times on other gaming platforms, on mobile phones, and as part of various Mega Man franchise compilations.",,,"iOS, Wii, Nintendo 3DS, PSP, PlayStation 3, Android, Wii U, PlayStation, NES",Action,Singleplayer,Capcom,"Capcom, Nintendo",1990
58534,metal-gear-2-solid-snake,Metal Gear 2: Solid Snake,1990-07-20,,4.0,73,0,185,122,1000000,"The game takes place in 1999, when oil stocks are beginning to run out and the world is facing a global fuel crisis. When a brilliant Czech biologist discovers a microorganism that converts crude oil into wholesome fuel, there is hope of resolving the crisis. Dr Kio Marv is, however, abducted under mysterious circumstances, and the responsibility for the whole case is taken over by the Asian regime called Zanzibar Land, which thanks to the discovery of the Czech scientist and access to nuclear weapons wants to gain power over the world. The last hope of humanity turns out to be Solid Snake - a man who alone solved the problem of a similar rank in the first part of the series Metal Gear.",,,"PlayStation 3, PlayStation 2, Xbox 360, Wii, PC","Action, Adventure","metal, snake",Konami Digital Entertainment,Konami,1990
24918,f-zero,F-Zero,1990-11-21,,4.04,55,15,168,112,0,"The future of racing is here! F-ZERO, an intergalaxtic Grand Prix, uses machines that weigh more than a ton, reach dash speeds of over 500km/h and hover a mere twelve inches off the ground! Choose from the heroic Captain Falcon, or the suave, Dr. Stuart. Need more choices? Then try the sly alien, Pico or the not-so-honest Samurai Goroh, and race for intergalactic fame and fabulous fortune in the F-ZERO Grand Prix.",,,SNES,"Racing, Arcade","console, race, cars, speed, NES, racer",Nintendo,Nintendo,1990
19076,silent-service-2,Silent Service 2,1990-11-06,,0.0,0,1,134,9,169558,"The all-new Silent Service II A State Of The Art Simulation Of Submarines In World War II.
The original Silent Service was released in 1985. It won "" Simulation of the Year"" honours in six nations and was voted ""Best Adventure Game for the Home Computer"" by the Academy of Adventure Gaming Arts and Design in 1986.
Now Silent Service II updates the classic with latest advances in sound, graphics and game design, including new targets and scenarios.
Game Features:
Outstanding graphics and digitized photographs depict enemy ships with uncanny realism.
The new campaign option tracks your career with promotions and commendations.
State-of-the-art sounds and original music recreate an atmosphere beneath the waves so true to life, you'll be coming up for air!",http://www.retroism.com,,"Linux, macOS, PC",Simulation,"Singleplayer, Classic, Retro, Naval, submarine",MicroProse Software,"Nightdive Studios, Retroism",1990
54051,smash-tv,Smash TV,1990-04-01,,3.68,19,0,124,0,1000000,"Smash TV is a 1990 arcade game created by Eugene Jarvis and Mark Turmell for Williams. It is a dual-stick shooter in the same vein as its predecessor, Robotron: 2084 (also produced by Jarvis). As in the previous game, players battle waves of enemies by using guns. The plot of Smash TV revolves around a futuristic game show in which players compete for various prizes as well as their lives.
The Super NES, Genesis, Master System, and Game Gear versions were titled Super Smash TV.
The 1992 Williams arcade game Total Carnage shares many elements with Smash TV, and was also programmed by Turmell, but isn't a sequel.",,,"SEGA Master System, Game Gear, Atari ST, Xbox 360, SNES, NES, Commodore / Amiga, Genesis",Action,"Singleplayer, Co-op, cooperative","WMS Industries, Williams","WMS Industries, Williams",1990
55545,michael-jacksons-moonwalker,Michael Jackson's Moonwalker,1990-08-24,,3.89,43,0,102,0,0,"Michael Jackson's Moonwalker is the name of several video games based on the 1988 Michael Jackson film Moonwalker. U.S. Gold published various games for home computers, released in 1989, whilst Sega developed two similarly themed beat 'em up video games in 1990; one released for arcades and another released for the Mega Drive/Genesis and Master System. Each of the games' stories loosely follow the story of the film, in which Michael Jackson must rescue kidnapped children from the evil Mr. Big, and incorporate synthesized versions of some of the musician's songs.",,,"Commodore / Amiga, Atari ST, PC, SEGA Master System, Genesis","Shooter, Platformer","Singleplayer, cooperative","SEGA, Keypunch Software, Emerald Software","SEGA, U.S. Gold",1990
32115,secret-of-the-silver-blades,Secret of the Silver Blades,1990-01-01,,1.83,6,51,101,8,0,"<p>Secret of the Silver Blades is a RPG game developed by Strategic Simulations. It was originally released in 1990. Strategic Simulations published the game. The game is rated as ""Skip"" on RAWG. <br>You can play Secret of the Silver Blades on Commodore / Amiga, Classic Macintosh and PC. You can purchase the game on GOG. <br>It was produced by Glen Cureton, Nicholas Beliaeff and Rick E. White. It was directed by Graeme Bayless, Nicholas Beliaeff and Victor Penman. It was scored by John Halbleib. <br></p>",,,"Commodore / Amiga, Classic Macintosh, PC",RPG,Singleplayer,Strategic Simulations,"Strategic Simulations, WizardWorks, WizardWorks Software",1990
53974,ninja-gaiden-ii-the-dark-sword-of-chaos,Ninja Gaiden II: The Dark Sword of Chaos (1990),1990-04-06,,4.07,27,0,99,0,0,"A year after the events of the original Ninja Gaiden, a new villain named Ashtar receives word of Jaquio's defeat. Ashtar uses this opportunity to hatch a new plan to plunge the world into darkness. The ninja, Ryu Hayabusa, hits the trail to destroy all manner of vile creatures entering the world while fighting his way to destroy Ashtar, his Dark Sword of Chaos, and whatever else is behind the evil.

Ninja Gaiden II: The Dark Sword of Chaos is a fast paced, side scrolling action game in the tradition of the original Ninja Gaiden game. Ryu is a ninja who can run, jump, and slash with his ninja sword. He can also attach to vertical walls and climb up and down, which is an ability missing in the previous game. Powerups are hidden everywhere throughout the levels. These powerups include fireballs and ninja stars as before; a unique new powerup is the ninja shadow. Ryu can collect up to 2 ninja shadows that follow his every movement and use the same weapons at the same time that Ryu strikes.

Ninja Gaiden II tells its story through liberal use of cinematic scenes interspersed between the action levels. Different levels feature a variety of environmental interaction; e.g., one level has Ryu on a high mountain where snow is falling fast and the wind is blowing hard. The shifting direction of the snowfall indicates how the wind is blowing and Ryu has to fight against the breeze. In a night level, much of the environment is dark and is illuminated only sporadically by flashes of lightning.",,,"Commodore / Amiga, NES, Wii, Nintendo 3DS, Wii U","Action, Arcade, Fighting, Platformer",Singleplayer,"Koei Tecmo, Tecmo",Nintendo,1990
308056,final-fantasy-iii-1990,Final Fantasy III (1990),1990-04-27,,3.57,35,0,94,0,0,"Final Fantasy III is a role-playing video game developed and published by Square in 1990 for the Family Computer as the third installment in the Final Fantasy series and the last main series game for the console. It is the first numbered Final Fantasy game to feature the job-change system. The story revolves around four orphaned youths drawn to a crystal of light. The crystal grants them some of its power, and instructs them to go forth and restore balance to the world. Not knowing what to make of the crystal's pronouncements, but nonetheless recognizing the importance of its words, the four inform their adoptive families of their mission and set out to explore and bring back balance to the world.",,,NES,RPG,"Fantasy, Story, balance, square, words",Square,Square,1990
