id,slug,name,released,metacritic,rating,ratings_count,playtime,added,twitch_count,youtube_count,description,website,reddit_url,platforms,genres,tags,developers,publishers,year
58003,x-men-vs-street-fighter,X-Men vs. Street Fighter,1996-09-09,,4.1,29,0,73,0,0,"X-Men vs. Street Fighter (Japanese: エックスメン VS. ストリートファイター, Hepburn: Ekkusu Men bāsasu Sutorīto Faitā) is a crossover fighting video game developed and published by Capcom. It is Capcom's third fighting game to feature Marvel Comics characters, following X-Men: Children of the Atom and Marvel Super Heroes, and the first installment in the Marvel vs. Capcom series. As the title suggests, the game includes characters from Marvel's X-Men franchise and the cast from Capcom's Street Fighter series. Originally released as a coin-operated arcade game in 1996, it was eventually ported to the Sega Saturn in 1997 and the PlayStation in 1998.
X-Men vs. Street Fighter features gameplay similar to Street Fighter, but incorporates dual-character selection and tag team-based combat. Each player selects two characters to compete in a one-on-one battle, attempting to defeat the opposing team. The players are given the ability to switch between their characters at any point during the match. The game also incorporates numerous elements from X-Men: Children of the Atom and Marvel Super Heroes.
The game was released to generally positive reviews, with critics praising its gameplay and sprite animation quality. While the Sega Saturn port received praise for maintaining the experience of the original arcade version, the PlayStation port was met with mixed to negative critical reception for removing several features, such as tag team battles. The changes were done in response to the technical limitations of the PlayStation. A sequel to the game, Marvel Super Heroes vs. Street Fighter, was released in 1997.",,,"PC, PlayStation, SEGA Saturn",Fighting,"Singleplayer, Multiplayer",Capcom,"Capcom, Virgin Interactive, PAL",1996
29972,destruction-derby-2,Destruction Derby 2,1996-01-01,,3.76,29,4,73,57,0,"<p>Destruction Derby 2 is an action-racing game developed by Ubisoft Reflections, Reflections and Reflections Interactive. It was originally released in 1996. It was published by Psygnosis. Most rawgers rated the game as ""Recommended"". <br>You can play Destruction Derby 2 on PlayStation and PC. </p>

<p></p>",,,"PlayStation, PC","Action, Racing","Singleplayer, Multiplayer","Ubisoft Reflections, Reflections, Reflections Interactive","Psygnosis, SCE Studio Liverpool",1996
22833,time-commando,Time Commando,1996-07-31,80.0,3.78,18,1,71,0,0,"A deadly virus has invaded a top secret military super computer. Its catastrophic time-warping effects now threaten to overtake the computer systems of the world. If you cannot restore its memory in time, the growing virus will cause the world's collapse. You must journey through the corridors of history to stop this technological demon. But vicious warriors await with lethal purpose. Instinct will be your only ally. All-out combat, your only choice.
Time Commando will take you on a journey in time and space that you will never forget. With plenty of weapon types, stylized visuals, and diversified gameplay it should keep you entertained for many hours. This title is very unique and it should be a part of every serious game collection.9 Worlds to explore, each in a different time and place: prehistoric, Roman, feudal Japan, Medieval, Conquistador, the Wild West, and the modern wars.
Impressive arsenal of weapons, from Katanas through rifles and spells to a technologically advanced combat yo-yo.
Entertaining and challenging puzzle-solving elements, stylized visuals, and an original story.",,,"SEGA Saturn, Classic Macintosh, macOS, PC, PlayStation","Action, Adventure","Singleplayer, Sci-fi, War, Side Scroller, Historical, combat, Futuristic, Medieval, Beat 'em up, 1990's, World War II, 2.5D, Ninja, Swordplay, Western, Pirates, Martial Arts, World War I, Rome","Adeline Software International, Acclaim Studios","Activision Blizzard, Virtual Studios, [2.21]",1996
13869,ignition,Ignition,1996-12-31,,4.16,19,1,70,29,0,"In an exotic range of vehicles and around some of the harshest circuits ever devised, you've got to ram, nudge, barge and otherwise cheat your way to victory. If you spot a sneaky shortcut, then use it - if your opponent's hugging the cliff edge then give him a nudge and a salute as you cruise into the lead and he cruises into a deep gorge.
Out on these panoramic race circuits, you'll get to drive the weirdest range of vehicles. Speed merchants can try the Bug for size, style victims can hop in the Redneck and those with a taste for the bizarre can drive the bright yellow school bus through the opposition.
Once you've beaten the computer controlled cars, grab a mate and test the multiplayer mode. You won't need no stinking modem to play head to head in this game, though, because Ignition features a unique split-screen mode for up close and personal racing.
IGNITION - it takes skill to drive like a nutter!
Seven unique race tracks from the Lost Ruins to Cape Thor
11 unusual vehicles from monster trucks to jungle jeeps
Funky smooth-scrolling overhead race view
Two player split-screen mode",http://www.interplay.com,,"PC, macOS, Linux","Action, Sports, Racing","Singleplayer, Multiplayer, Split Screen",Unique Development Studios,Interplay Productions,1996
52926,fifa-97,FIFA 97,1996-01-01,,4.08,36,0,68,0,0,"FIFA 97 (also known as FIFA Soccer 97) is a video game developed by EA Canada and published by Electronic Arts based on the game of football (soccer). It was released for the PC on June 24, 1996 and versions for PlayStation, SNES, Mega Drive and Sega Saturn followed.
FIFA 97 is the fourth game in the FIFA series and the second to use the Virtual Stadium engine. Unlike the first game to use the engine, FIFA 97 features polygonal players as opposed to the 2D sprites used in FIFA Soccer '96. The engine however received complaints for being sluggish in the PC and PlayStation versions.
David Ginola (then a Newcastle United player) was pictured on the cover of the game in the European market. He also was used for motion capture for the polygonal models in the game. Bebeto (the Brazilian striker) was featured on the cover for the Americas and Asia-Pacific markets.",,,"PC, SEGA Saturn, PlayStation, Game Boy, SNES, Genesis",Sports,"Singleplayer, Multiplayer, Multiplayer online","Electronic Arts Canada, Rage Software, Tiertex Design Studios, Perfect Entertainment, Extended Play Productions, XYZ Productions","Electronic Arts, EA SPORTS, Black Pearl Software",1996
22243,spycraft-the-great-game,Spycraft: The Great Game,1996-02-28,,0.0,1,1,68,0,0,"In Spycraft: The Great Game, you take on the role of a CIA operative who must attempt to unravel an assassination plot that could topple the fragile peace established by the Cold War.  Blending fact and fiction to create a contemporary story tied to real-world events, the game thrusts you into a dangerous world of intrigue where you must make significant moral choices and face the consequences of your actions.  As you begin your investigation, you’ll discover that a Russian presidential candidate has been assassinated and the CIA has received a tip that the life of the US president could be in serious jeopardy.
Spycraft: The Great Game is one of the first interactive entertainment titles to blend 35mm film, digital video footage, still photographs and actual stock footage from the CIA with intricate 3-D puzzles based on real-life covert tactics and operations.  Are you ready to make the first move in the ""great game""?
William Colby (a former CIA director) and Oleg Kalugin (former Major General of the KGB) reveal secrets from the ""great game"" of espionage.
Master the tools of a CIA operative, surveil double agents, and intercept radio transmissions to infiltrate a web of rogue spies.
Actual CIA footage along with Hollywood actors portray the intrigue and skulduggery.",https://www.activision.com/,,PC,"Adventure, Simulation","Singleplayer, FMV",Activision,Activision Blizzard,1996
4173,fighting-vipers,Fighting Vipers,1996-01-01,,3.5,10,2,67,34,0,"Fight with flair in the return of Fighting Vipers, the classic arcade game from AM2 that was later playable on the Sega Saturn.  Choose one of nine zany characters--including Grace the roller blader and Raxel the metal guitarist-- and break your opponent's costume-based armor to maximize damage.  Take advantage of all-new online modes to battle friends across the world.
Features include:
Arcade perfect with all-new online modes
All 9 original characters, each with their own unique costume and hobby
Enclosed arenas, enabling special wall attacks
Online versus mode for head-to-head matches
Online Room match mode for up to 6 players
1-2 players
431KB minimum save size
HDTV screen resolution: 720p, 1080i
DUALSHOCK®3
Network Players 2-6
Software subject to license (us.playstation.com/softwarelicense). Online features require an account and are subject to terms of service and applicable privacy policy (playstationnetwork.com/terms-of-service & playstationnetwork.com/privacy-policy).
© SEGA. All rights reserved. SEGA, the SEGA logo and Fighting Vipers are either registered trademarks or trademarks of SEGA Corporation.",http://www.sega.com/games/fighting-vipers/,,"SEGA Saturn, Xbox 360, PlayStation 3","Arcade, Fighting","online, battle, fight, match, room, versus, metal",SEGA,SEGA,1996
22659,vr-soccer-96,VR Soccer '96,1996-03-30,,0.0,4,0,67,0,0,"I'm sure you remember this game. It was the first soccer game that made you smell the grass and feel on your leg after every foul. You were playing from virtually any perspective with smooth and fast camera action that got you in the game. Its interactive technology didn't look better, but it played better. You do remember, don't you?
Choose from 44 international teams and select the position you want to play. Try head to head or alternating play modes for one or two players and even more multiplayer fun?
Feel the soccer once again.
The first football game to utilize 3D graphics; also known as Actua Soccer
Create your own team and customize it to suit your preferences
Play with up to 15 of your friends!",http://www.interplay.com,,"PC, macOS",Sports,"Singleplayer, Multiplayer, Co-op",Gremlin Interactive,Interplay Productions,1996
22240,zork-nemesis-the-forbidden-lands,Zork Nemesis: The Forbidden Lands,1996-02-28,,0.0,1,1,66,0,0,"In a desolate corner of the Underground Empire, an evil demon torments the Land.  Evil rules the Forbidden Lands.  Here, the souls of the Empire’s Great Alchemists lie in perpetual hell…at the hands of the Nemesis.  Now the forces of the Underground beckon you to uncover the mystery behind the Nemesis’ curse…Travel through five mind-bending worlds to discover the ancient secret of Alchemy that will free the trapped souls from evil’s grip….Before the Nemesis imprisons you with the others…For eternity.  Do you dare enter the Forbidden Lands?
Five highly detailed worlds entice you with over 65 innovative puzzles
Spectacular production value - Hollywood actors, dramatic live-action video, hypnotic ambient music and dazzling special effects
Directed by live action director, Joe Napolitano of X-Files and Murder One fame",https://www.activision.com/,,PC,Adventure,"Singleplayer, Violent, Point & Click, Nudity","Zombie Studios, Zombie",Activision Blizzard,1996
320395,maui-mallard-in-cold-shadow,Maui Mallard in Cold Shadow,1996-09-29,,4.22,9,1,63,0,0,"""When he morphs into a Ninja, You'd better Duck.
• Play as Maui. Play as the Ninja. Play as Maui. Play as the Ninja. Try not to get dizzy.
• Find the missing Shabuhm Shabuhm idol before your island paradise goes kaboom, kaboom.
• 40 hours of intense gameplay, so pack plenty of attitude. And your bug gun.
• Come beak to beak with Muddrakes, Rotting Pirates, Duck Zombies, Amazon Warriors, and a bunch of fowl-tempered hangers on.
• Laugh in the face of danger across 23 stages from the top of a volcano, the bottom of the sea, the Realm of the Dead, and the Ninja Training Grounds. Then get the heck out.
• Live every level like it's your last. 'Cuz it may be.""",,,"SNES, Genesis, Game Boy, PC",Action,Singleplayer,Disney Interactive Studios,Disney Interactive,1996
55266,disneys-pocahontas,Disney's Pocahontas,1996-01-01,,4.23,26,0,59,0,0,"Disney's Pocahontas is a platform game based on the film of the same name. The Sega Genesis/Mega Drive version was developed by Funcom on contract with Disney and was released on January 1, 1996. It was followed by a later version for the Game Boy developed by Tiertex Design Studios and released on June 10, 1996, nearly a year after the film's premiere. A Super Nintendo Entertainment System version of the game was under development around the same time as the Mega Drive/Genesis version, but was canceled due to development being too far behind to coincide with the Mega Drive/Genesis release.",,,"Game Boy, Genesis",,Singleplayer,"Funcom, Tiertex Design Studios, Tiertex","SEGA, Disney Interactive",1996
30513,alien-trilogy,Alien Trilogy,1996-02-29,,3.73,22,0,57,0,0,"<p>Alien Trilogy is an action-shooter game developed by Acclaim Cheltenham, Sculptured Software and Probe Entertainment. It came out on 29-02-1996. It was published by Acclaim Entertainment. The game is rated as ""Recommended"" on RAWG. <br>Alien Trilogy is available on SEGA Saturn, PC and PlayStation. </p>

<p></p>",https://www.youtube.com/watch?v=d_U4DuI-R-Y,,"SEGA Saturn, PC, PlayStation","Action, Shooter",Singleplayer,"Acclaim Cheltenham, Sculptured Software, Probe Entertainment","Acclaim Entertainment, Acclaim Entertainment/Fox Interactive",1996
22888,screamer-2,Screamer 2,1996-01-01,,3.83,6,1,56,0,0,"Howl like a banshee down twisting, turning tracks from icy Scandinavian glacial death traps to treacherous mountain courses and blazing Egyptian desert spinouts. Realistic car physics mean you feel every inch of the road, every ounce of centrifugal force, and every bug dumb enough to get in your way.
Don't bother to buckle up. When you're flying behind the wheel of your customized super-fast high performance car, whiplash is the least of your worries. Don't feel ashamed if you let loose with a scream every once in awhile...
Six winding, wildly dangerous tracks with varying levels of difficulty, terrain, driving conditions and configurations.
Power to customize up to 20 high performance race cars means you can check yourself before you wreck yourself.
Incredible physics for real-time jumping, turning, spinning, and twisting.",http://www.interplay.com,,"PC, macOS","Action, Simulation, Sports, Racing","Singleplayer, Multiplayer",Graffiti,Interplay Productions,1996
59287,star-ocean,Star Ocean,1996-07-19,,2.86,6,0,53,0,0,"Star Ocean was only released in Japan. The game was later remade for a western release for the PSP, under the title Star Ocean: First Departure.",,,SNES,,"japan, ocean",Tri-Ace,Enix,1996
26889,the-king-of-fighters-96,The King of Fighters '96,1996-07-30,,3.82,17,0,53,0,0,"Originally released in 1996, this is the third installment in The King
of Fighters game series. The series features an SNK all-star lineup,
with characters from games like Fatal Fury, Ikari Warriors, Psycho
Soldier and Art of Fighting competing with each other for the title of
the world’s strongest fighter.

This installment adds some major systematic changes compared with
previous titles. It features small, medium and big jumps, as well as
forward and backward flip emergency escapes. It also adds the extra
element of guarding in midair. Being able to review commands makes moves
easier to execute, and projectiles have been toned down. This title got
rid of the idea of projectile spamming as an effective approach, and it
marked a major turning point in the series.
This classic game is part of the Virtual Console service, which brings you great games created for consoles such as NES™, Super NES™ and Game Boy™ Advance. See more Virtual Console games for Wii.",,,"Wii, Nintendo Switch, Xbox One, SEGA Saturn, Neo Geo, PS Vita, PlayStation 4, Game Boy, PlayStation, PlayStation 3, PSP",Fighting,"Multiplayer, 2 players",SNK,"SNK, D4 Enterprise",1996
23040,archimedean-dynasty,Archimedean Dynasty,1996-10-31,,0.0,3,1,52,0,0,"The all consuming darkness has you battle-scarred submarine in a vice-like grip. As you navigate your sub through enemy waters, the only thing that protects you from a cold and premature death is six inches of solid steel. As if life itself, 5,700 metres below the ocean surface wasn’t difficult enough, the threat of impending conflict is about to challenge your very existence…
In the distance, a glimmer of light pierces the darkness and shock waves begin to roll your craft. An unknown object descends upon you. Systems indicate Torpedo! You act immediately to avoid destruction and lock your sights on the incoming torpedo. You release a Ripper missile and begin your descent, but you must go faster. DIVE! DIVE! DIVE!
The predecessor to the AquaNox series, Archimedean Dynasty is a submarine-simulation set in a post-apocalyptic world on the ocean floor. Assuming the role of mercenary, Emerald “Dead Eye” Flint, you must navigate the dangers that lurk below, including corrupt conglomerates, fanatical cults and cut-throat pirates. With a rich and atmospheric open-world, compelling narrative and dialogue interaction, and a deep customisation and combat system that rewards tactical thinking, Archimedean Dynasty is a submersive experience for nautical adventurers that like to talk the talk and sail the sail.  Over 60 deadly mission to get your heart racing!
Command 4 different ships and equip them from an impressive arsenal of over 30 lethal weapon systems!
Advanced AI puts your tactical fighting skills to the ultimate test when you engage in combat against extremely intelligent and cunning enemies!
Underwater motion simulation with drifting and currents to make you feel like you’re actually at the helm!
Stimulating storyline lets you interact with over 100 characters",,,PC,"RPG, Simulation",Singleplayer,Massive Development,Ubisoft Entertainment,1996
52801,civilization-ii,Civilization II,1996-02-29,,4.36,21,0,50,0,0,"Sid Meier's Civilization II is a turn-based strategy video game in the Civilization series, developed and published by MicroProse. It was released in 1996 for the PC and later ported to the PlayStation by Activision.",,,PlayStation,,"Singleplayer, Multiplayer",MicroProse Software,"Activision Blizzard, MicroProse",1996
29781,command-conquer-the-covert-operations,Command & Conquer: The Covert Operations,1996-04-22,,3.73,15,0,49,0,0,"<p>Command & Conquer: The Covert Operations is a strategy game developed by Westwood Studios. It came out on 22-04-1996. It was published by Virgin Interactive Entertainment. The game is rated as ""Recommended"" on RAWG. <br>You can play Command & Conquer: The Covert Operations on PC. </p>

<p></p>",,,PC,Strategy,,Westwood Studios,Virgin Interactive Entertainment,1996
14866,vectorman-2,Vectorman 2,1996-11-15,,4.33,24,0,48,0,0,"A routine sludge barge excursion is cut short when a mysterious missile critically damages VectorMan’s ship.
Vectorman escapes destruction and freefalls back to earth, landing on the outskirts of a seemingly abandoned research facility. As he begins to investigate the source of the missile, VectorMan discovers a mutant strain of insects that have begun to flourish in the research facility. Worse yet, the insects display destructive tendencies towards the planet and seem to be run by an unseen intelligence. VectorMan’s mission is clear: defeat the mutant insects and once again save the Earth from impending disaster.",,,"Genesis, PC",Platformer,Singleplayer,,SEGA,1996
520344,powerslave,Powerslave,1996-10-31,,3.0,7,1,48,0,0,"Destination: The ancient Egyptian city of Karnak. Alien forces possessing horrifying powers have sealed off the once thriving community from all outside contact. As a covert operations specialist, you have been trained for all forms of contingencies. Nothing can prepare you, however, for the nightmare you are about to enter...
Features:

First-person viewpoint action.
20+ levels of nonstop gameplay through an ancient Egyptian city and the tomb of the Pharaoh Ramses.
Real time fully 3D rendered gameplay allows you to move between floors within a single level
Cross bridges and swim through underwater grottoes.
With just a machete to start, search for 7 other weapons including hand grenades, a flame thrower, an M-60 machine gun, and a magical cobra staff.
Dynamic lighting creates stunning visual effects.",,,"PC, macOS, Linux","Action, Shooter, Adventure","Singleplayer, First-Person, FPS, Gore, Violent, Retro, 1990's, city, weapons, alien, gun, machine",Lobotomy Software,Throwback Entertainment,1996
22904,sensible-world-of-soccer-9697,Sensible World of Soccer 96/97,1996-01-01,,3.5,6,6,47,0,0,"Sensible World of Soccer 96-97 edition is the best and last installment of the most popular soccer series. It’s bursting with every feature you could ever want in a football manager sim. Sensible World of Soccer is brimming with 26,000+ real-life players, each one with carefully researched statistics and abilities, 144 competitions, from the local tournament all the way to the European Cup Final. Full career records and the unique scouting feature allows you to track and observe a player’s progress and evaluate their contribution to your team. If management is not your style then dive into the action and play for your team. Be prepared to lose quite a few nights’ sleep as you take your team from being a bunch of nobodies to all-time champions, in this 1990s favorite soccer game! Or ""football"", as we call it in Europe.Choose between being a player, a coach, or a player-coach for any one of the 1,500 Club and National teams.
Features more than 26,000 real-life-players with accurate personal statistics!
Manage one or more teams throughout a 20 season career and take your team all the way to the European Cup Final.",,,"Commodore / Amiga, Linux, PC, macOS","Simulation, Sports",Singleplayer,Sensible Software,Codemasters,1996
29902,ace-ventura,Ace Ventura,1996-01-01,,4.25,16,0,47,0,0,"<p>Ace Ventura is an adventure game developed by 7th Level. It came out on 01-01-1996. It was published by 7th Level. Most rawgers rated the game as ""Exceptional"". <br>Ace Ventura is available on PC. </p>

<p></p>",,,PC,Adventure,,7th Level,7th Level,1996
57187,spot-goes-to-hollywood,Spot Goes To Hollywood,1996-11-30,,3.75,20,0,45,0,0,"Spot Goes to Hollywood is a platform video game developed by Eurocom and published by Acclaim Entertainment in North America and Virgin Interactive Entertainment in Europe for the Mega Drive/Genesis as the sequel to Cool Spot. A Sega Saturn and PlayStation version was later released, and featured FMV clips and different levels but similar gameplay to the original version. Sega 32X and SNES versions were also in development but got canceled before release. It utilizes an isometric graphics system to provide a pseudo-3D playing experience. The player controls Spot, once the mascot for the 7 Up soft drink, as he travels to various places trying to free his friends.",,,"PlayStation, SEGA Saturn, Genesis",Platformer,Singleplayer,"Eurocom, Burst Studios","Virgin Interactive, Acclaim Entertainment, Virgin Interactive Entertainment, JP/EU, '''PlayStation/Saturn'''",1996
22836,world-rally-fever-born-on-the-road,World Rally Fever: Born on the Road,1996-05-04,,0.0,2,1,45,0,0,"World Rally Fever is exactly what the title says it is: a fast paced, crazy action racing game that features circuits themed to evoke different famous places around the world, rendered in stylish anime-style graphics and paired with a sleek soundtrack. There are eight characters to choose from, each with unique characteristics that affect the handling of their vehicle. Fair play is something you have to forget and put to one side, because once that race starts there are no rules but one: win. You are not defenseless in this tough competition. There are weapons and power-ups you can use to do more than simply eke out a win: they allow you to win in style, with as many explosive collisions as possible.
World Rally Fever won the hearts of many gamers for its unique gameplay and distinctive visuals. Once you start playing you may find it feels like you were born to ride the road--and find it hard to stop! Controls are responsive, the music is catchy, and the general immersion factor is huge. So if you were looking for a crazy racing game with a twist, then World Rally Fever is for you!Fun arcade racing game with cartoon-style graphics and fast-paced action.
Vast variety of circuits across the world; large selection of characters and upgrades.
Stylish soundtrack that covers various music genres including pop, jazz, metal, and rock - something for everyone.",,,PC,"Racing, Arcade",Singleplayer,Team17 Digital,Team17 Digital,1996
