id,slug,name,released,metacritic,rating,ratings_count,playtime,added,twitch_count,youtube_count,description,website,reddit_url,platforms,genres,tags,developers,publishers,year
449209,shivers-ii-harvest-of-souls,Shivers II: Harvest of Souls,1996-12-31,,0.0,0,0,11,0,0,"Unmask the evil of an ancient curse.
In Shivers II: Harvest of Souls, your mission is to find out what happened to your friends who were all members of a rock band and mysteriously disappeared in a town called Cyclone.
Look fear in the eye
Vision 360™'s panoramic views aid your search by smoothly scanning in all directions.
Choose your path wisely
Surprisingly different endings - and puzzles that change for each game - deliver the ultimate replayability.
Listen with care
Original soundtrack music, rock videos, and directionally specific sound-effect are all integral to the mystery - and its solution.",,,PC,,"Mystery, Music, puzzles, friends, Soundtrack, ancient, sound, rock",Sierra,"Activision Blizzard, Activision Value Publishing",1996
33685,polanie,Polanie,1996-09-01,,0.0,2,0,11,0,0,"<p>Polanie is a strategy game developed by MDF. It came out on 01-09-1996. MDF published the game. The game is rated as ""Meh"" on RAWG. <br>Polanie is available on PC. </p>

<p></p>",,,PC,Strategy,,MDF,MDF,1996
30575,nascar-racing-2,NASCAR Racing 2,1996-01-01,,0.0,1,0,11,0,0,"<p>NASCAR Racing 2 is a sports-racing game developed by Papyrus Racing Games. It was originally released in 1996. It was published by Sierra On-Line. Most rawgers rated the game as ""Exceptional"". <br>NASCAR Racing 2 is available on PC. </p>

<p></p>",,,PC,"Sports, Racing",,Papyrus Racing Games,Sierra On-Line,1996
29971,amber-journeys-beyond,Amber: Journeys Beyond,1996-02-12,,0.0,0,0,11,0,0,"<p>Amber: Journeys Beyond is an adventure game developed by Hue Forest Entertainment. It came out on 12-02-1996. Graphsim Entertainment published the game. <br>Amber: Journeys Beyond is available on PC. </p>

<p></p>",,,PC,Adventure,,Hue Forest Entertainment,Graphsim Entertainment,1996
32119,wizardry-gold,Wizardry Gold,1996-01-01,,0.0,3,0,10,0,0,"<p>Wizardry Gold is a RPG game developed by Sir-Tech Software. It came out on 01-01-1996. It was published by Sir-Tech Software. Most rawgers rated the game as ""Exceptional"". <br>You can play Wizardry Gold on PC. </p>

<p></p>",,,PC,RPG,,Sir-Tech Software,Sir-Tech Software,1996
30563,captain-quazar,Captain Quazar,1996-01-01,,0.0,3,0,10,0,0,"<p>Captain Quazar is an arcade game developed by Studio 3DO. It came out on 01-01-1996. 3DO Company, The published the game. Most rawgers rated the game as ""Recommended"". <br>Captain Quazar is available on PC and 3DO. </p>

<p></p>",,,"PC, 3DO",Arcade,,Studio 3DO,"3DO Company, The",1996
30890,bud-tucker-in-double-trouble,Bud Tucker in Double Trouble,1996-01-01,,0.0,2,0,10,0,0,"<p>Bud Tucker in Double Trouble is an adventure game developed by Unknown. It was originally released in 1996. It was published by Unknown. The game is rated as ""Exceptional"" on RAWG. <br>You can play Bud Tucker in Double Trouble on PC. </p>

<p></p>",,,PC,Adventure,,Unknown,Unknown,1996
29599,swiv-3d,SWIV 3D,1996-01-01,,0.0,2,0,10,0,0,"<p>SWIV 3D is an arcade game developed by Sales Curve Interactive. It came out on 01-01-1996. Sales Curve Interactive published the game. The game is rated as ""Exceptional"" on RAWG. <br>SWIV 3D is available on PC. </p>

<p></p>",,,PC,Arcade,,Sales Curve Interactive,Sales Curve Interactive,1996
32376,raiden-2,Raiden 2,1996-01-01,,0.0,3,0,10,0,0,"<p>Raiden 2 is an arcade game developed by NuFX. It came out on 01-01-1996. Kinesoft published the game. The game is rated as ""Recommended"" on RAWG. <br>You can play Raiden 2 on PC. </p>

<p></p>",,,PC,Arcade,,NuFX,Kinesoft,1996
24090,sonic-blast,Sonic Blast,1996-11-14,,0.0,5,0,10,0,0,"In this fully rendered Game Gear classic, Dr. Eggman (AKA Dr. Robotnik)
has stolen the Chaos Emeralds and it's up to Sonic the Hedgehog and
Knuckles the Echidna to stop him. Guide Sonic and Knuckles through
mazelike Zones and defeat Dr. Eggman's mechanical menaces to show him
that there’s nothing a determined Hedgehog or Echidna can't overcome.
Play as Sonic or Knuckles as you race through 14 levels in search of
hidden Power-ups. Use Sonic's new Double Jump to access hard-to-reach
areas. Take advantage of Knuckles' climbing skills to gain extra points.
Look out for Big Rings to enter Bonus Stages where there are extra lives
and Chaos Emeralds to be found.",,,"SEGA Master System, Game Gear, Nintendo 3DS",Platformer,"race, sonic, climbing",Aspect Co.,SEGA,1996
57731,robo-pit,Robo Pit,1996-01-01,,0.0,1,0,10,0,0,"Robo Pit (ロボピット) is a robot fighting game released in 1996 for PlayStation and Sega Saturn. The game was developed by Altron and published by Kokopeli Digital Studios outside Japan. A sequel, Robo Pit 2, was released in Japan on PlayStation in 1997. It was also released in Europe and North America in 2003.
The object of Robo Pit is to build a robot and then fight to the top in arenas that are square in shape. There are many different types of arenas, some with bosses, and the time of day can vary.
There are various types of weapons which include axe, lips, sword, missile and claws. The robots different body parts have different stats that affect its performance. Although all body parts are available from the start, the only way to unlock more weapons is to fight more robot enemies.",,,"PlayStation, SEGA Saturn",Fighting,"Singleplayer, Multiplayer",Altron,"THQ, Altron",1996
34123,private-investigator,Private Investigator,1996-01-01,,0.0,3,0,10,0,0,"<p>Private Investigator is an adventure-arcade game developed by Image Line. It came out on 01-01-1996. It was published by Image Line. The game is rated as ""Exceptional"" on RAWG. <br>You can play Private Investigator on PC. </p>

<p></p>",,,PC,"Adventure, Arcade",,Image Line,Image Line,1996
32728,max-mechanized-assault-and-exploration,M.A.X.: Mechanized Assault and Exploration,1996-01-01,,0.0,4,0,10,0,0,"<p>M.A.X.: Mechanized Assault and Exploration is a strategy game developed by Interplay Entertainment. It came out on 01-01-1996. Interplay Productions published the game. Most rawgers rated the game as ""Exceptional"". <br>M.A.X.: Mechanized Assault and Exploration is available on PC. </p>

<p></p>",,,PC,Strategy,,Interplay Entertainment,Interplay Productions,1996
29858,hyperblade,Hyperblade,1996-01-01,,0.0,2,0,10,0,0,"IN DEVELOPMENTHYPERBLADE is a solo-deved passion project that has been put into early access to get feedback from players and gauge interest. Please do not expect many hours of content at this stage of development.
About the Game
HYPERBLADE is a gameplay-driven action game where you can only move by dashing.
Use your momentum to kick off walls and cut down your enemies.
Abilities like time manipulation and bullet deflection allow for limitless improvisational play.
Early AccessHYPERBLADE has entered early access to get feedback and improve the game. The final version will expand on the story/lore, and have more levels and gameplay elements.Design Pillars Gameplay first - HYPERBLADE prioritizes gameplay over story. No long unskippable cutscenes to interrupt the flow of gameplay.
Tough but fair - Players should feel challenged, but should never feel that they died unfairly.
A sense of mastery - A player's skill should improve over time. The satisfaction of mastering a mechanic can be extremely satisfying.",https://kava-soft.com/,,PC,"Action, Adventure, RPG, Sports, Racing, Arcade, Indie","Singleplayer, Multiplayer, RPG, Story Rich, 2D, Third Person, Sci-fi, Difficult, Split Screen, Action-Adventure, Pixel Graphics, Local Multiplayer, Third-Person Shooter, Early Access, PvP, Hack and Slash, Character Customization, 3D, combat, Futuristic, Fast-Paced, Cyberpunk, Top-Down, Online PvP, Linear, Blood, Top-Down Shooter, Souls-like, Ninja, Remote Play Together, nature, Character Action Game, Flight, Spectacle fighter, Bullet Time, Time Manipulation, Shared/Split Screen PvP, Martial Arts, esports, 3D Fighter, 3D-файтинг","Wizbang, Drop Games, Kavasoft, tiny planet games","Activision Blizzard, Drop Games, Kavasoft, tiny planet games",1996
34913,buccaneer,Buccaneer,1996-12-31,,0.0,3,0,10,0,0,"Buccaneer, a classic game from the 90s, thrusts you into a 17th-century Caribbean adventure, offering intense high-seas combat and strategic resource management.
Dive into thrilling ship-to-ship battles or lead daring crew boardings. Choose the 'cut-to-the-chase' combat-only option or immerse yourself in the buccaneer world through detailed campaigns. Survive and thrive by upgrading ships, managing content crews, and conquering 21 Caribbean territories.
Plunder ports, negotiate, and live to tell your tale! Embark on 6 unique storylines, navigate your buccaneer career, and aim for amnesty or a wealthy retirement. Conquer the seas in this immersive pirate saga!",,,PC,"Action, Adventure, Strategy, Simulation","Singleplayer, Action-Adventure, Retro, Historical, combat, 1990's, Cartoony, Economy, Family Sharing, Trading, Pirates, Old School, Naval, Sailing, Флот, Naval Combat","SSI, Divide By Zero Software","SNEG, SSI",1996
22673,star-control-3,Star Control 3,1996-08-30,89.0,0.0,2,0,10,0,0,"Deep in space, somewhere in the Kessari Quadrant, you stumble across a catastrophic realization - the universe is on the brink of destruction. Now you must race to save thousands of worlds and billions of lives from total annihilation. An epic adventure of intergalactic strategy and diplomacy begins.
Star Control 3 is the last installment of the series. Taking a slightly different track that diverged from the Star Control 2 formula, it got excellent reviews though some of the hardcore Star Control fans weren't entirely thrilled by the innovations. Journalists, new fans of the series, and hardcore fans alike all agreed on one thing, though: this game's story is great.
So whether you're an old fan of the series, someone who was put off by a friend's dislike of the game, or someone who's never played the Star Control games at all, here's your chance: pick up the excellent final game in the Star Control series and make up your mind for yourself!Fascinating story rich with unexpected plot twists, interesting characters, and memorable moments
Great diplomacy system that equips the player with many interesting options to solve problems
Each race has its own unique behavior, goals, and motives",https://www.star-control.com/sc3/,https://www.reddit.com/r/starcontrol/,"PC, macOS","Adventure, Strategy",Singleplayer,Legend Entertainment,Stardock,1996
31415,gender-wars,Gender Wars,1996-01-01,,0.0,1,0,10,0,0,"<p>Gender Wars is an action-strategy game developed by 8th Day, The. It came out on 01-01-1996. It was published by Sales Curve Interactive. Most rawgers rated the game as ""Exceptional"". <br>You can play Gender Wars on PC. <br>It was produced by Fergus McNeill, Jane Cavanagh and Steven Bishop. Rob Henderson directed the game. <br></p>",,,PC,"Action, Strategy",,"8th Day, The",Sales Curve Interactive,1996
369025,saturn-bomberman,Saturn Bomberman,1996-07-19,,0.0,2,0,10,0,0,"<p>Saturn Bomberman is an action game. It was originally released in 1996. Most rawgers rated the game as ""Exceptional"". <br>You can play Saturn Bomberman on SEGA Saturn. <br>Hiroshi Igari produced the game. Kazunori Yasui and Shigeki Fujiwara directed the game. Jun Chikuma scored the game. <br></p>",,,SEGA Saturn,Action,"exclusive, true exclusive",,,1996
32351,sex-2,Sex 2,1996-03-01,,0.0,1,0,10,0,0,"<p>Sex 2 is an adventure game developed by Aypio. It came out on 01-03-1996. Aypio published the game. Most rawgers rated the game as ""Exceptional"". <br>Sex 2 is available on PC. </p>

<p></p>",,,PC,Adventure,"eroge, adult-game, sex-game",Aypio,Aypio,1996
52857,tecmos-deception-invitation-to-darkness,Tecmo's Deception: Invitation to Darkness (1996),1996-07-25,,0.0,3,0,10,0,0,"Tecmo's Deception: Invitation to Darkness, usually referred to simply as Deception, is a video game released by Tecmo in 1996 for the original PlayStation. Deception was released as Kokumeikan (刻命館) in Japan, and as Devil's Deception in Europe. The game is the first in the Deception series. It was a critical success, with reviewers particularly praising the originality of the game's concept.",,,PlayStation,RPG,"Singleplayer, death, castle, invaders","Sony Interactive Entertainment, Tecmo",Tecmo,1996
56829,superman-the-game,Superman: The Mysterious Mr. Mist,1996-09-10,,0.0,0,0,10,0,0,"Superman Springs to Life on CD-ROM

A mysterious creature rises from the depths of the Earth to capture a new queen for his people, and he's got his eye on Lois Lane. His evil powers allow him to transform into any human shape, causing total confusion. Will Superman save Lois from the clutches of the Mysterious Mr. Mist?",,,"Classic Macintosh, PC",Adventure,Singleplayer,,,1996
29359,wwf-in-your-house,WWF in Your House,1996-01-01,,0.0,5,0,10,0,0,"<p>WWF in Your House is a sports, arcade and fighting game developed by Sculptured Software and Acclaim Entertainment. It came out on 01-01-1996. It was published by Acclaim Entertainment. Most rawgers rated the game as ""Skip"". <br>WWF in Your House is available on SEGA Saturn, PlayStation and PC. </p>

<p></p>",,,"SEGA Saturn, PlayStation, PC","Sports, Arcade, Fighting","Singleplayer, Multiplayer","Sculptured Software, Acclaim Entertainment",Acclaim Entertainment,1996
251483,popolocrois-monogatari,PoPoLoCrois Monogatari,1996-07-12,,0.0,3,0,10,0,0,"PoPoLoCrois Monogatari (ポポロクロイス物語) is a RPG video game published by SCEI released on July 12th, 1996 for the Sony PlayStation.",,,PlayStation,RPG,,SCEI,"Sony Computer Entertainment, SCEI",1996
30621,exile-2-crystal-souls,Exile 2: Crystal Souls,1996-01-01,,0.0,3,0,10,0,0,"<p>Exile 2: Crystal Souls is a RPG game developed by Spiderweb Software. It was originally released in 1996. It was published by Spiderweb Software. Most rawgers rated the game as ""Skip"". <br>Exile 2: Crystal Souls is available on PC. </p>

<p></p>",,,PC,RPG,,Spiderweb Software,Spiderweb Software,1996
52740,blast-chamber,Blast Chamber,1996-09-30,,0.0,1,0,10,0,0,"Blast Chamber is a 1996 video game released on PC (demo only), Sony PlayStation and Sega Saturn. It has been called the first non-sports four-player game for the PlayStation and Saturn.",,,"PlayStation, SEGA Saturn, PC",Action,Players: 1-4,Attention to Detail,Activision Blizzard,1996
31719,ripper,Ripper,1996-01-01,,0.0,2,0,10,0,0,"<p>Ripper is an adventure-puzzle game developed by Take 2 Interactive. It was originally released in 1996. It was published by Take 2 Interactive. The game is rated as ""Recommended"" on RAWG. <br>Ripper is available on PC. <br>Phil Parmet directed the game. <br></p>",,,PC,"Adventure, Puzzle",,Take 2 Interactive,Take 2 Interactive,1996
31197,rise-2-resurrection,Rise 2: Resurrection,1996-01-01,,0.0,1,0,10,0,0,"<p>Rise 2: Resurrection is an arcade-fighting game developed by Mirage and Mirage Media. It was originally released in 1996. It was published by Acclaim Entertainment. Most rawgers rated the game as ""Meh"". <br>You can play Rise 2: Resurrection on PlayStation, SEGA Saturn and PC. <br>Brian May and Tom Grimshaw scored the game. <br></p>",,,"PlayStation, SEGA Saturn, PC","Arcade, Fighting",,"Mirage, Mirage Media",Acclaim Entertainment,1996
29419,clandestiny,Clandestiny,1996-01-01,,0.0,1,0,10,0,0,"Witty, cynical, and heir to a legacy of cowardice, Andrew MacPhiles makes for an unlikely hero. Convinced to leave his modern New York apartment by his fearless girlfriend, Paula, he fearfully answers a mysterious summons to claim his ancestral home. And so he returns to the muddy stretch of land where stands the Castle MacPhiles, refuge to the most cowardly clan ever to stumble its way into Scottish history. There, he must fulfill an ancient prophecy, and defeat a deadly curse that has plagued his family for generations.... Join Andrew and Paula through quivering encounters with the castle's odd inhabitants, and intriguing exploration of its eerie rooms and hidden passageways. Solve ""wee"" rascally riddles and perplexing puzzles to learn how a legacy of dimwitted cowardice led the clan to near extinction. Unravel the story piece-by-piece, unveiling Andrew's destiny, and ultimately unleashing an electrifying confrontation with the real Beast Within. From the creators of The 7th Guest and The 11th Hour comes this clever composite of stunning 3D graphics and lively animation. Three levels of difficulty pose a challenge to novices and experienced gamers alike. And the enchanting story by renowned author Jahnna N. Malcolm makes the journey worth the taking. Clandestiny is an experience that will come back to haunt you... if you've got the courage to take it.",,,"macOS, PC","Adventure, Puzzle",,Trilobyte,"Electronic Arts, GRL Games",1996
29982,nhl-hockey-97,NHL Hockey '97,1996-08-01,,0.0,2,0,10,0,0,"<p>NHL Hockey '97 is a sports game developed by Electronic Arts Canada. It was originally released in 1996. It was published by Electronic Arts. Most rawgers rated the game as ""Recommended"". <br>You can play NHL Hockey '97 on PC. </p>

<p></p>",,,PC,Sports,,Electronic Arts Canada,Electronic Arts,1996
55845,madden-nfl-97-2,Madden NFL 97,1996-08-15,,0.0,2,0,9,0,0,"Madden NFL 97 is the first Madden NFL football game to be created in the 32-bit gaming era. It was originally created for the PlayStation and Sega Saturn, but other versions were also released, including the 16-bit Super NES and Genesis.
This was the first edition of Madden to implement the use of a salary cap when customizing team rosters. It also featured the new Baltimore Ravens, the expansion franchise that absorbed the roster of the Cleveland Browns for the 1996 season. The game also adds a team of real free agents (as opposed to the blank slate used in Madden 96) which can be traded and added to other teams' rosters (led by recently semi-retired quarterback Randall Cunningham), and could be played by using a cheat code.
Madden 97 was the number one selling game on the PlayStation including all games released in 1996.",,,"PlayStation, Game Boy, SNES, Genesis",Sports,"Singleplayer, Multiplayer",Electronic Arts Tiburon,EA SPORTS,1996
53027,imadoki-no-vampire-bloody-bride,Imadoki no Vampire: Bloody Bride,1996-12-27,,0.0,1,0,9,0,0,"Imadoki no Vampire: Bloody Bride (いまどきのバンパイアBLOODY BRIDE, Today's Vampire: Bloody Bride), is a PlayStation game published by Atlus Co. Ltd. Japan. Released in 1996 in Japan, it was never officially translated into English.
Bloody Bride in essence is a dating simulation. You play as a young vampire who has reached (vampire) adulthood. He is sent to earth to suck the blood of a girl with a 'platinum aura'. However the girl has to willingly allow him to suck her blood. The character is given three years to complete his mission.",,,PlayStation,RPG,"Singleplayer, exclusive, true exclusive","Opus, Jorudan, Avit",Atlus,1996
57628,motor-toon-grand-prix-2,Motor Toon Grand Prix 2,1996-05-24,,0.0,2,0,9,0,0,"Motor Toon Grand Prix 2 is a racing video game released in 1996. It was developed by a development group within SCE that later formed Polyphony Digital. It was released in the US as Motor Toon Grand Prix, since its predecessor never left Japan, although the European version kept the Japanese title for unknown reasons. In 2002, the game was re-released in Europe in a Twin Pack with Gran Turismo, Kazunori Yamauchi's following game. In 2010, the game was re-released on PlayStation Network.
The game is compatible with Namco's neGcon analogue controller.",,,"PlayStation, PSP",Racing,"Singleplayer, Multiplayer","Sony Interactive Entertainment, Polys Entertainment",Sony Computer Entertainment,1996
57865,tobal-no-1,Tobal No. 1,1996-08-02,,0.0,4,0,9,0,0,"Tobal No. 1 (トバル ナンバーワン, Tobaru Nanbā Wan) is a fighting video game for the PlayStation developed by DreamFactory and published by Square in 1996. The game was DreamFactory's first release, as well as Square's first release on the CD-based console.
Tobal No. 1 marks Square's first incursion into the fighting game genre, although an adventure-like quest mode is part of the game. The game's mechanics were designed with the aid of fighter game designer Seiichi Ishii, while all the characters were designed by Akira Toriyama of Dragon Ball fame. The sequel, Tobal 2, was never released in North America and Europe.
Packaged with both the North American and Japanese version of the game was a sampler disc featuring a pre-release demo of Final Fantasy VII and video previews of Final Fantasy Tactics, Bushido Blade, and SaGa Frontier.",,,PlayStation,Fighting,"Singleplayer, Multiplayer, exclusive, true exclusive",DreamFactory,"Sony Computer Entertainment, Square",1996
31086,h2o,H2O,1996-01-01,,0.0,2,0,9,0,0,"「水・水蒸気・氷」に変化してミッションを完成するゲームです。
「水」は柔らかくて細い地形を通ります。
「水蒸気」は上空に飛んで、大きい障害物を避けます。
「氷」は氷の上に漂い、さまざまな障害物を突き倒すことができます。

モードチェンジ！
様々な困難を克服しよう！！

※課金は購入時のみ。アプリ内課金・広告表示は一切ありません。",http://senken.jp,,"PC, iOS","Action, Arcade, Family",,"Webfoot Technologies, SENKEN, INC.,","Webfoot Technologies, SENKEN",1996
34008,scorcher,Scorcher,1996-01-01,,0.0,1,0,9,0,0,"Scorcher is the all-new blazing-fast infinite racer from Radiangames, creator of Inferno 2 and Super Crossfighter.  Pilot your Scorcher through treacherous twists and turns as your ship steadily increases in speed until you're in the zone and your reflexes take over to keep you alive as long as possible.
GIANT SANDWORMS
Unlock Behemoth mode and take control of 6 colossal sandworms!  Devour as many sandsharks as possible in 2 minutes.  The more sandsharks you devour in a row, the more will spawn!
BLAZING VISUALS
Scorcher features multiple endless canyons, 3 unique ships to unlock, and the smoothest racing controls to ever grace a touchscreen.  Combined with beautiful 60 FPS graphics, spectacular particle effects, 12 local and online leaderboards, and a pulse-pounding soundtrack, Scorcher is a must-have infinite racing game.",,,"PC, iOS","Racing, Arcade, Casual","online, Soundtrack, ship, speed, Endless, racer, ships, infinite","Radiangames, Scavenger","GT Interactive Software, Luke Schneider",1996
33341,indiana-jones-and-his-desktop-adventures,Indiana Jones and His Desktop Adventures,1996-01-01,,0.0,2,0,9,0,0,"<p>Indiana Jones and His Desktop Adventures is an arcade game developed by LucasArts Entertainment. It was originally released in 1996. LucasArts Entertainment published the game. Most rawgers rated the game as ""Exceptional"". <br>Indiana Jones and His Desktop Adventures is available on PC. <br>Hal Barwood directed the game. It was scored by Clint Bajakian. <br></p>",,,PC,Arcade,,LucasArts Entertainment,LucasArts Entertainment,1996
30385,fire-fight,Fire Fight,1996-01-01,,0.0,1,0,9,0,0,"<p>Fire Fight is an arcade game developed by Epic MegaGames and Chaos Works. It was originally released in 1996. Electronic Arts published the game. Most rawgers rated the game as ""Recommended"". <br>You can play Fire Fight on PC. </p>

<p></p>",,,PC,Arcade,,"Epic MegaGames, Chaos Works",Electronic Arts,1996
5045,hardcore-4x4,TNN Motorsports Hardcore 4x4,1996-11-30,,0.0,4,0,9,0,0,"You'll need tough studs and big bolts... Get bent over six radical terrains. White-knuckle driving and extreme weather conditions. Rampage your rig with actual four wheel independent suspension and real vehicle motion. Gut-wrenching multiple views with hard-rocking, adrenaline-pumping music. Max out your truck, crunch the fenders and kiss your competition, but don't drive it into the ground.",,,"SEGA Saturn, PlayStation",Racing,"Singleplayer, Multiplayer, Controller, Management, console, interactive, memory, snow, hardcore",Gremlin Interactive,ASC Games,1996
53007,heavens-gate,Heaven's Gate,1996-01-01,,0.0,1,0,9,0,0,"Heaven's Gate (ヘブンズゲート) is a 1996 3D fighting arcade game developed by Racdym (now known as Racjin) and published by Atlus. It is both Atlus and Racdym's first attempt in the 3D fighting game market.
While in development, the game was known as ""Ultimate Domain"", and was intended to run on the Sega Model 2 hardware.
The game was ported to the PlayStation by Atlus, being released on December 13, 1996 in Japan. In October 1997, JVC Digital Studios published it in Europe under the title Yusha: Heaven's Gate.",,,PlayStation,Fighting,"Singleplayer, Multiplayer","Racjin, Racdym",Atlus,1996
29644,andretti-racing,Andretti Racing,1996-10-04,,0.0,0,0,9,0,0,"<p>Andretti Racing is a simulation, sports and racing game developed by Stormfront Studios and High Score Productions. It came out on 04-10-1996. It was published by Electronic Arts. <br>You can play Andretti Racing on PC, PlayStation and SEGA Saturn. </p>

<p></p>",,,"PC, PlayStation, SEGA Saturn","Simulation, Sports, Racing",,"Stormfront Studios, High Score Productions","Electronic Arts, EA SPORTS",1996
552938,adibou-2,Adibou 2,1996-01-01,,0.0,0,0,9,0,0,"<p>Adibou 2 is an educational game developed by Coktel Vision. It came out on 01-01-1996. It was published by Sierra Entertainment. <br>You can play Adibou 2 on PC. </p>

<p></p>",,,PC,"Educational, Family",,Coktel Vision,Sierra Entertainment,1996
