id,slug,name,released,metacritic,rating,ratings_count,playtime,added,twitch_count,youtube_count,description,website,reddit_url,platforms,genres,tags,developers,publishers,year
33301,hardwood-hearts,Hardwood Hearts,2000-01-01,,0.0,4,0,45,0,0,"Join the GREATEST HEARTS COMMUNITY in the world and play with thousands of online players or just play solo.
Hardwood Hearts breathes new life into your favorite card game with excellent graphics. Enjoy calming Hearts playing environments with ocean waves breaking in the distance.
Play with players from around the world or with family and friends.
Check out where you stand with the online leader board. Enjoy achievement challenges that take the experience from just a single game of hearts to even more fun.
Hardwood Hearts is customizable with new backgrounds, cards, player avatars and tables that can be added to the game via paid downloadable content.
Hearts game variations included in Hardwood Hearts:
• Partnership (traditional)
• Individual (singles)
• Spot Hearts
• Timed games
____________________
Hardwood Games Subscriptions are optional and available at a rate of 1 month for $4.99, 3 months for $14.99 or 1 year for $29.99. Payment will be charged to your iTunes account at confirmation of purchase.  Subscriptions will auto-renew unless turned off at least 24 hours before the end of the current period.  Your iTunes account will be charged for renewal within 24 hours prior to the end of the current period.  Your subscriptions can be managed from your iTunes account settings.  Cancellation of subscriptions is not allowed. Our privacy policy may be viewed at http://www.hardwoodgames.com/about/privacy/ Our terms of service may be viewed at http://www.hardwoodgames.com/about/terms/",http://www.silvercrk.com/hearts,,"PC, Xbox 360, Android, iOS",Card,"online, friends, waves",Silver Creek Entertainment,Silver Creek Entertainment,2000
29570,majesty-the-fantasy-kingdom-sim-2000,Majesty: The Fantasy Kingdom Sim (2000),2000-03-01,,4.18,17,0,45,0,0,"<p>Majesty: The Fantasy Kingdom Sim (2000) is a strategy game developed by Cyberlore Studios. It came out on 01-03-2000. Hasbro Interactive published the game. The game is rated as ""Exceptional"" on RAWG. <br>You can play Majesty: The Fantasy Kingdom Sim (2000) on PC. </p>

<p></p>",http://www.cyberlore.com/majesty/,,PC,Strategy,,Cyberlore Studios,Hasbro Interactive,2000
29562,cleopatra,Cleopatra,2000-07-01,77.0,4.42,19,0,45,0,0,"<p>Cleopatra is a strategy game developed by Impressions Games and BreakAway Games. It was originally released in 2000. It was published by Sierra On-Line. Cleopatra has a Metascore of 77, based on professional reviews. Most rawgers rated the game as ""Exceptional"". <br>Cleopatra is available on PC. <br>It was scored by Keith Zizza. <br></p>",,,PC,Strategy,,"Impressions Games, BreakAway Games",Sierra On-Line,2000
32073,moorhuhn-2,Moorhuhn 2,2000-10-01,,3.5,12,0,44,0,0,"<p>Moorhuhn 2 is an arcade game developed by Phenomedia. It came out on 01-10-2000. Cumputerchannel published the game. The game is rated as ""Recommended"" on RAWG. <br>You can play Moorhuhn 2 on PC, Game Boy Color and PlayStation. </p>

<p></p>",,,"PC, Game Boy Color, PlayStation",Arcade,,Phenomedia,Cumputerchannel,2000
33561,hardwood-spades,Hardwood Spades,2000-01-01,,0.0,3,0,44,0,0,"Join the GREATEST SPADES COMMUNITY in the world to play with thousands of online players or just play spades Solo.
#1 Independent Game Festival for Best Visual Arts!
Hardwood Spades Free breathes new life into your favorite spades card game with excellent graphics and soothing environments.   If you're new to Spades, don't worry you can find how to play tutorials. If you are familiar with Bridge, spades is much less complicated and easy to play but is similar.  Hardwood Spades has the strategy aspects of a Texas Hold’em Poker game but with partners which really adds some new and fun gameplay. And it has luck elements of Slot games all with quality artwork and pleasant background sounds and background that take on a mini vacation.
*****  ""Great game I'm a big spades player an this game is awesome!"" -Phenomenal W
Play online spades with players from across the internet or with family and friends.  You can even post your winnings to Facebook for all your friends to see.
Spades game variations included in Hardwood Spades Free offline and Multiplayer live spades modes:
* Partnership Spades (traditional)
* Partnership   - Suicide
* Partnership   - Mirrors
* Individual  Spades
* Individual  -Mirror
* Individual-Cutthroat
* Individual -Cutthroat Mirror
Online Multiplayer Spades social games are free.
Also check out our other Hardwood online card and boardgames:
Hardwood Euchre - Jacks are Trump in this trick taking game.
Hardwood Hearts - A great trick taking game where the goal is to take the least amount of points.
Hardwood Backgammon - Who can move their men to safety 1st?
& Video Poker Duel -  Play competitive video poker just like you'd find in a casino.
If you also like some solitude, all of our games can be played as single player.   But for the ultimate single player experience, check out our game Hardwood Solitaire IV also available here on the AppStore
* Want new features? Have some suggestions? Found an issue? Email your feedback to support@silvercrk.com
____________________
Hardwood Games Subscriptions are optional and available at a rate of 1 month for $4.99, 3 months for $14.99 or 1 year for $29.99. Payment will be charged to your iTunes account at confirmation of purchase.  Subscriptions will auto-renew unless turned off at least 24 hours before the end of the current period.  Your iTunes account will be charged for renewal within 24 hours prior to the end of the current period.  Your subscriptions can be managed from your iTunes account settings.  Cancellation of subscriptions is not allowed. Our privacy policy may be viewed at http://www.hardwoodgames.com/about/privacy/ Our terms of service may be viewed at http://www.hardwoodgames.com/about/terms/",http://www.silvercrk.com/spades,,"PC, Xbox One, Xbox 360, Android, iOS",Card,"Multiplayer, online, friends, fun, Solo, duel, casino, trump",Silver Creek Entertainment,Silver Creek Entertainment,2000
54715,power-stone-2,Power Stone 2,2000-08-23,87.0,4.38,13,0,44,0,0,"Power Stone 2(パワーストーン 2) is a multiplayer fighting game that built on the innovative gameplay introduced by its predecessor, Power Stone. Power Stone 2 allows up to four players to choose from multiple characters and utilize items such as tables, chairs, and rocks in battle.
Power Stone 2 originated as an arcade game, like many others on the Dreamcast. The Dreamcast served as a testing ground for successful arcade games. Power Stone 2 included some differences from the original, including new character voices, the removal of the existing combo system and a new, horizontal status bar.",,,Dreamcast,Fighting,"Singleplayer, Multiplayer, Online multiplayer",Capcom,Capcom,2000
31635,gunman-chronicles,Gunman Chronicles,2000-11-20,65.0,4.33,17,0,43,0,0,"An intensely addictive action experience powered by the Half-Life engine!

Trouble is brewing in this sleepy western spiral of the galaxy. ItÂ’s been five years since the infestation of the alien Xenomes started - five years since The General, leader of the Gunmen, fell in battle leaving you to take command. Now, a mysterious presence has tinkered with the DNA of these Xenomes, making them bigger and stronger than before, and the scourge is spreading once again. As leader of the Gunman, the only law in this area of the galaxy, you must set things right. Find the source of this hostile invasion, and clear these alien scum from the rim or the galaxy!

Gunman Chronicles combines a wild-west sensibility with high-tech styling to create a thrilling and visually unique first-person action experience - powered by the Half-Life engine! All of the amazing effects and frighteningly realistic AI that made Half-Life the undisputed king of first-person action have been brought to Gunman Chronicles, a tale of revenge and redemption on the rim of the galaxy.",,,PC,"Action, Shooter","Singleplayer, Multiplayer, Violent, Space, Aliens, Steampunk, Tanks, Dinosaurs, guns, violence, health, lasers, laser-guns, vehicles, half-life, raygun, healing, cowboys, ammo, space-cowboy, half-life-mod","Valve Software, Rewolf Software","Sierra On-Line, Sierra Entertainment, Sierra Online",2000
331813,dragon-quest-7,Dragon Quest 7,2000-08-26,,3.75,8,0,43,0,0,"<p>Dragon Quest 7 is a RPG game developed by ArtePiazza, Enix and Heartbeat. It came out on 26-08-2000. Square Enix published the game. The game is rated as ""Recommended"" on RAWG. <br>Dragon Quest 7 is available on PlayStation, Android, Nintendo 3DS and iOS. <br>It was produced by Taichi Inuzuka. It was directed by Manabu Yamana. It was scored by Koichi Sugiyama. <br></p>",,,"PlayStation, Android, Nintendo 3DS, iOS",RPG,,"ArtePiazza, Enix, Heartbeat","Square Enix, Enix",2000
22968,screamer-4x4,Screamer 4x4,2000-12-03,,4.29,7,1,43,0,0,"Tired of being a Sunday driver? Had enough of the same old rigid road course? Want to get rough and dirty? Climb into your rugged 4x4, get off the tarmac and head into the wild! You’ll face steep slopes, sudden drops and dangerous natural obstacles as you navigate through inhospitable terrain at high speeds in order to beat the clock.
To become a champion you’ll need to battle against the elements in some of the harshest racing conditions you’ve ever faced. Everything from mud to mountains is accurately recreated in this exciting off road racer. Ground-breaking all-terrain physics modeling and realistic 4WD vehicle handling keep the thrills coming as you trek across a wide range of various terrains and elevations. Take on your opponents and tackle the brutal hinterland in either Free Drive, Championship, Trophy and Pathfinder mode, or leave your friends in the dust in the LAN multiplayer mode. For the ultimate driving experience, you’ll need to go where there are no roads...Ten officially licensed off road, four-wheel-drive vehicles to take into the wilderness.
60 exciting courses spread over six different terrain types with varying weather conditions and times of day.
Highly detailed and realistic driving physics so that you feel every crevice, slope and boulder.",,,PC,"Simulation, Racing","Singleplayer, Multiplayer",Channel 42 Software Developer,Mastertronic,2000
54482,pokemon-puzzle-league-2000,Pokémon Puzzle League (2000),2000-09-25,,3.9,20,0,43,0,0,"Pokémon Puzzle League is a puzzle game for the Nintendo 64 console. It is based on Nintendo's Puzzle League puzzle games, but with Pokémon likenesses. It was only available in North America starting in 2000, and in Europe in 2001, making it the first Pokémon game produced for North America. It is one of several Pokémon games to be based on the Pokémon anime, and features Ash Ketchum and other characters featured from the anime. The game was released on the Virtual Console on May 5, 2008, in the North America region, and on May 30, 2008, in the European region.",,,"Wii, Nintendo 64",Puzzle,Singleplayer,Nintendo,Nintendo,2000
52726,blade,Blade (2000),2000-11-20,51.0,3.69,13,0,43,0,0,"Make way through various vampire-infested locations. Ventures through warehouses, sewers, museums, city streets, and nightclubs dispatching numerous types of enemies ranging from familiars (humans that do a vampire's bidding), vampires, zombies, monsters, killer dogs, and other creatures of the night. 

Blade  has his trademark sword, can also use fists as well as a variety of firearms including pistols, shotguns, and machine pistols. Each firearm has three different types of ammunition: standard, explosive, and silver, each with its own effect on different enemies. Blade is also equipped with a ""multi-launcher""  to kill vampires with silver glaives and UV grenades. 

Blade is a video game based on the 1998 film adaptation of the Blade character that starred Wesley Snipes.  Upon release, critics were mixed to negative in reviews; they were critical of the graphics, camera, controls, voice acting, and that it ""failed to capture the spirit"" of the movie.",,,"PlayStation, Game Boy Color",Action,"Singleplayer, exclusive","HAL Laboratory, HammerHead, GBC","Activision Blizzard, Activision Value Publishing, Marvel Comics",2000
22719,fa-18e-super-hornet,F/A-18E Super Hornet,2000-02-28,,0.0,1,0,42,0,0,"Includes The Albanian Campaign
Your orders have arrived and your mission is clear: utilize the F/A-18E Super Hornet’s full air-to-air and air-to-ground attack capabilities to seek out and destroy enemy targets on an unlimited number of flight sorties. Grab the flight stick and take control of your 3-D aircraft with unbelievably accurate weapon systems, 20 detailed training missions, 40 combat missions in two war-zones in changing weather conditions.
From the makers of the award winning Apache Longbow comes the U.S. Navy's newest multi-role strike fighter. The Navy's best pilots have proven this sleek and efficient machine's worth over real battlefields. Now it's your turn... Indulge yourself and test your skills inside the Super Hornet's fully interactive cockpit. Key guide and complete pilot notes included!
A complex and realistic flight model
A wide variety of missions, from air superiority to Wild Weasel
A vast world and challenging AI opponentsThe Albanian Campaign Mission PackFLY THE BALKAN CONFLICT FOR REAL!
Serbian Forces have invaded the state of Montenegro, it's one-time ally in the Federal Republic of Yugoslavia. Serbia's invading armies have imposed a state of martial law throughout the country and peace in this once safe haven for Kosovo Albanian refugees is shattered.
Stationed on the USS Ronald Reagan aircraft carrier in the Adriatic, you represent the spearhead of NATO's armed response. Fly the Balkan conflict for real across over 20 true-life war situations in a whole new warzone, or fly head-to-head in network play for up to 24 users.
Hunt down targets. Distinguish enemies from civilians. Use your weapons surgically.",https://www.interplay.com,,PC,"Action, Simulation","Singleplayer, Multiplayer, Steam Cloud, Tactical, War, Realistic, combat, Military, Flight","Digital Integration, Digital Theory, Digital Intergration",Interplay Productions,2000
53501,road-rash-jailbreak,Road Rash: Jailbreak,2000-02-01,78.0,4.0,26,0,42,0,0,Road Rash: Jailbreak is a racing video game developed by EA Redwood Shores for the PlayStation version and Magic Pockets for the Game Boy Advance version and published by Electronic Arts for PlayStation in 2000 and Game Boy Advance and in 2003. It is the sixth and final game in the Road Rash series,,,"PlayStation, Game Boy Advance",Racing,"Singleplayer, Multiplayer, exclusive, Combat Racing","Electronic Arts, Electronic Arts Redwood Shores, Magic Pockets",Electronic Arts,2000
30610,outbreaker,Outbreaker,2000-12-01,,4.35,13,0,40,0,0,"<p>Outbreaker is an arcade game developed by BWM Games. It came out on 01-12-2000. It was published by Modern Games. Most rawgers rated the game as ""Exceptional"". <br>Outbreaker is available on PC. </p>

<p></p>",,,PC,Arcade,,BWM Games,Modern Games,2000
32146,tiggers-honey-hunt,Disney's Tigger's Honey Hunt,2000-01-01,,4.0,12,0,40,0,0,"<p>Disney's Tigger's Honey Hunt is an adventure-arcade game developed by Disney Interactive, Doki Denki and DokiDenki Studio. It came out on 01-01-2000. It was published by Disney Interactive. The game is rated as ""Recommended"" on RAWG. <br>You can play Disney's Tigger's Honey Hunt on PC, PlayStation and Nintendo 64. </p>

<p></p>",,,"PC, PlayStation, Nintendo 64","Adventure, Arcade","Singleplayer, Multiplayer, exclusive","Disney Interactive, Doki Denki, DokiDenki Studio","Ubisoft Entertainment, Disney Interactive, NewKidCo",2000
22813,heroes-chronicles-all-chapters,Heroes Chronicles: All chapters,2000-01-01,,4.07,14,0,40,0,0,"Eight titles featuring the gameplay you know and love from Heroes of Might and Magic III. Eight chapters that tell the story of Tarnum, a barbarian hero and liberator of his kinsmen. After generations of oppression, Tarnum discovers his people's true history and leads an army of Stronghold troops against their tyrannical masters. Marching from the arid roughlands of his homeland and the muggy swamps of the lowlands, he follows and even surpasses the deeds of his legendary ancestor, who defeated the spellcasting oppressors long ago.
This great pack of all eight Heroes Chronicles chapters will allow you to spend hours adventuring on the continent of Antagarich.
""Heroes Chronicles: All chapters"" includes ""Warlords of the Wastelands"", ""Conquest of the Underworld"", ""Masters of the Elements"", ""Clash of the Dragons"", ""The Final Chapters"", ""The World Tree"", ""The Fiery Moon"", ""Revolt of the Beastmasters"", and ""The Sword of Frost"".Spinoff of the classic Heroes of Might and Magic series - 8 games, each a chapter of the immortal hero's story
Different atmosphere in each campaign - from arid, deserted wastelands to beautiful and lush forests
A fun, extensive, and addictive turn-based strategy experience that will keep you hooked up for many hours",,,PC,Strategy,Singleplayer,New World Computing,Ubisoft Entertainment,2000
52783,capcom-vs-snk-millennium-fight-2000,Capcom vs. SNK: Millennium Fight 2000 Pro,2000-08-13,,4.43,14,0,40,0,0,"Capcom vs. SNK: Millennium Fight 2000 (カプコン バーサス エス・エヌ・ケイ ミレニアムファイト 2000, Kapukon Bāsasu Es-Enu-Kei Mireniamu Faito Nisen), also known as simply Capcom vs. SNK in international releases, is a 2000 head-to-head fighting game produced by Capcom originally released as a coin-operated arcade game for Sega's NAOMI hardware and later ported to the Dreamcast. It is the second game in the SNK vs. Capcom series and the first game in the series to be released for the arcades.
The sequel Capcom vs. SNK 2 featuring tweaked gameplay and more characters was released the following year.",,,"PlayStation, Dreamcast",Fighting,2 players,"Capcom, Capcom Production Studio 1","Capcom, Virgin Interactive, PAL",2000
30265,the-typing-of-the-dead,The Typing of the Dead,2000-01-01,,4.56,9,0,40,0,0,"<p>The Typing of the Dead is an educational action-arcade game developed by SEGA, Smilebit and Wow Entertainment. It was originally released in 2000. It was published by SEGA. The game is rated as ""Exceptional"" on RAWG. <br>You can play The Typing of the Dead on Dreamcast and PC. <br>It was produced by Rikiya Nakagawa and Shun Arai. Masamitsu Shiino directed the game. Tetsuya Kawauchi scored the game. <br></p>",,,"Dreamcast, PC","Action, Arcade, Educational","Singleplayer, Multiplayer","SEGA, Smilebit, Wow Entertainment",SEGA,2000
3592,mega-man-x5,Mega Man X5,2000-11-30,,3.8,10,21,40,0,0,"Mega Man X and Zero have to race against time to stop a Maverick Reploid attack on Earth! Can they put a stop to the Maverick menace?
This title is compatible with the PSP™, PS Vita, and PS3® systems.
Software subject to license (us.playstation.com/softwarelicense).  Online activity subject to Terms of Services and User Agreement (www.sonyenteretainmentnetwork.com/terms-of-service). One time license fee entitles play on up to 2 PlayStation® 3 systems and 3 portable PlayStation® systems activated by this account.
©CAPCOM CO., LTD 2001
©CAPCOM U.S.A., INC 2001 ALL RIGHTS RESERVED
CAPCOM and the CAPCOM LOGO are registered trademarks of CAPCOM CO., LTD
MEGA MAN and MEGA MAN X5 are trademarks of CAPCOM CO., LTD",,,"PlayStation, PC","Action, Arcade","online, race","Capcom, Sony Interactive Entertainment",Capcom,2000
30912,army-men-world-war,Army Men: World War,2000-02-28,,0.0,3,1,39,0,0,"<p>Army Men: World War is a strategy game developed by The 3DO Company. It was originally released in 2000. 2K Games published the game. Most rawgers rated the game as ""Recommended"". <br>Army Men: World War is available on PC and PlayStation. You can purchase the game on GOG. </p>

<p></p>",,,"PC, PlayStation",Strategy,,The 3DO Company,"2K Games, The 3DO Company",2000
29692,mechwarrior-4-vengeance,MechWarrior 4: Vengeance,2000-11-01,,3.92,13,30,39,0,0,"<p>MechWarrior 4: Vengeance is a simulation game developed by Microsoft. It was originally released in 2000. Microsoft Studios published the game. The game is rated as ""Recommended"" on RAWG. <br>MechWarrior 4: Vengeance is available on PC. <br>T. J. Wagner produced the game. Duane Decker scored the game. <br></p>",,,PC,Simulation,"exclusive, true exclusive",Microsoft,Microsoft Studios,2000
32448,dracula-resurrection,Dracula: Resurrection,2000-02-06,67.0,3.38,8,0,38,0,0,"You're a young man and Dracula has done his deed to your girl. Now, you must travel to Transylvania. Once there, you'll have to scour the countryside and find a way into the castle. Once there, now you must find and defeat the evil one himself. But, before you can do that, you must face his three friends and three demons.",,,"PC, macOS, PlayStation",Adventure,Singleplayer,"Canal+ Multimedia, Visual Impact, DreamCatcher Interactive","Microids, Canal+ Multimedia",2000
52893,duke-nukem-land-of-the-babes,Duke Nukem: Land of the Babes,2000-09-19,37.0,3.9,10,0,38,0,0,"Using a time portal device, the UBR tracked down Duke and made his choice very simple, help them now or there would be no chicks in the future. Being the chivalrous hero that he is, Duke promptly signed up to help the babes. With a huge new arsenal of destructive weapons and a legion of sinister enemies, DUKE NUKEM - LAND OF THE BABES is heart-pounding Duke action at its most savage. The king has arrived and it's time to kick some ass.

Duke Nukem: Land of the Babes is a third-person shooter video game in the Duke Nukem series of video games. This game is a direct sequel to the 1998 title Duke Nukem: Time to Kill.",http://legacy.3drealms.com/babes/,https://www.reddit.com/r/dukenukem/,PlayStation,"Action, Shooter","Singleplayer, Multiplayer, Violent, Space, exclusive, Aliens, true exclusive, Robots, hero, guns, violence, mutants, laser-guns, flamethrower, earth, vulgarity, bazooka","3D Realms, n-Space","Take Two Interactive, Infogrames, Take 2 Interactive Software, Take 2 Interactive",2000
31201,gold-glory-the-road-to-el-dorado,Gold & Glory: The Road to El Dorado,2000-12-19,,3.86,14,0,38,0,0,"Based on the DreamWorks animated feature, this action-adventure follows the trek of two Spanish con men, Tulio and Miguel, from their Old World homes to the legendary city of El Dorado.",,,"PC, PlayStation","Adventure, Puzzle","Point & Click, Single player only",Revolution Software,Ubisoft Entertainment,2000
52709,batman-beyond-return-of-the-joker,Batman Beyond: Return of the Joker,2000-11-20,24.0,3.58,12,0,37,0,0,"Batman Beyond: Return of the Joker (known as Batman of the Future: Return of the Joker in Europe) is a scrolling beat 'em up video game, released by Ubisoft for PlayStation and Nintendo 64. The game was released to coincide with the film of the same name, and is largely based on the original TV series.",,,"Nintendo 64, PlayStation","Action, Adventure",Singleplayer,KEMCO,Ubisoft Entertainment,2000
22705,battle-isle-the-andosia-war,Battle Isle: The Andosia War,2000-11-23,70.0,0.0,1,0,37,0,0,"“Our troops were swept away, General, and then the sect stopped its advance right before the gates to Hallwa. We have an ultimatum from the leader of the sect. She is demanding a kind of duel, sir, and will accept only you as her opponent.”
The year is 345 N.A. on the planet Chromos, a civilization that once boasted a flourishing society ruled by the Council of the Wise. Power struggles, corruption, war – that is the reality on Chromos now and, with the Andosia War, the Battle Isle saga continues with new features to the series by bridging the gap between turn based and real time combat.
NVIDIA compatibility notice: Under Windows XP (32-bit), Battle Isle: The Andosia War requires graphic card drivers version 285.58 or older.The last, and arguably the best, installment of the famous Battle Isle series
A unique combination of real-time and turn-based strategy elements
Two sides to align yourself with, each with its own campaign",,,PC,Strategy,Singleplayer,Cauldron,Ubisoft Entertainment,2000
31901,blair-witch-project-episode-1-rustin-parr,Blair Witch Project: Episode 1 - Rustin Parr,2000-09-01,,3.8,10,0,36,0,0,"<p>Blair Witch Project: Episode 1 - Rustin Parr is an action-adventure game developed by Terminal Reality. It was originally released in 2000. It was published by Gathering of Developers. Most rawgers rated the game as ""Recommended"". <br>You can play Blair Witch Project: Episode 1 - Rustin Parr on PC. </p>

<p></p>",,,PC,"Action, Adventure",,Terminal Reality,Gathering of Developers,2000
