id,slug,name,released,metacritic,rating,ratings_count,playtime,added,twitch_count,youtube_count,description,website,reddit_url,platforms,genres,tags,developers,publishers,year
5500,hot-shots-golf-2,Hot Shots Golf 2,1999-07-29,,3.86,7,0,15,0,0,"GOLF FOR THE PEOPLE.
Hot Shots Golf's award-winning gameplay returns.
- 13 golfers who'd probably under-tip the valet
- 7 glorious courses
- All new Tournament Mode
- Equipment upgrades for the true fanatic
- Unrivaled 3D graphics
""THE BEST GOLF GAME EVER MADE JUST GOT BETTER."" --PS Extreme",,,"PlayStation 5, PlayStation 4, PlayStation","Simulation, Sports","Singleplayer, Multiplayer, Controller, exclusive, console, memory, Golf, versus","Sony Interactive Entertainment, Clap Hanz","Sony Computer Entertainment, Sony Interactive Entertainment",1999
52824,countdown-vampires,Countdown Vampires,1999-12-22,41.0,0.0,4,0,15,0,0,Countdown Vampires (カウントダウンヴァンパイアーズ) is a survival horror game for the PlayStation developed by K2 LLC and published by Bandai. It distinguished itself from many of the horror games of its time by featuring vampires as the evil element rather than zombies.,,,PlayStation,"Action, Adventure","Singleplayer, exclusive, true exclusive",K2,Bandai,1999
54572,wwf-wrestlemania-2000,WWF WrestleMania 2000,1999-01-01,,3.57,7,0,15,0,0,"WWF WrestleMania 2000 is a professional wrestling video game originally released in 1999 on the Nintendo 64 (N64) console. It was based on the World Wrestling Federation's (WWF) annual pay-per-view, WrestleMania. Despite the fact that this game is based upon Wrestlemania 2000, the game was released five months prior (and four months prior on the Game Boy Color), to the actual PPV itself, therefore resulting in using the stage design from the previous event, WrestleMania XV, instead. Released at the height of the WWF's Attitude Era, WrestleMania 2000 was the first WWF game released by THQ. The wrestling company ended its long relationship with Acclaim Entertainment after witnessing the video game success of its competitor, World Championship Wrestling (WCW), on behalf of THQ. WrestleMania 2000 shares its game engine with the Japan-only release Virtual Pro Wrestling 2: Ōdō Keishō.
The game would be succeeded by WWF No Mercy in 2000.",,,"Nintendo 64, Game Boy Color",Fighting,"Singleplayer, Multiplayer","NATSUME, Aki, Asmik Ace Entertainment","THQ, Asmik Ace Entertainment",1999
30493,championship-manager-season-9900,Championship Manager Season 99/00,1999-01-01,,0.0,1,0,15,0,0,"<p>Championship Manager Season 99/00 is a strategy-sports game. It came out on 01-01-1999. Eidos Interactive published the game. Most rawgers rated the game as ""Recommended"". <br>You can play Championship Manager Season 99/00 on PC. </p>

<p></p>",,,PC,"Strategy, Sports",,,Eidos Interactive,1999
54737,sega-bass-fishing-1999,Sega Bass Fishing (1999),1999-04-01,,0.0,3,0,15,0,0,"Sega Bass Fishing, also known as Get Bass, is an arcade fishing video game developed in 1997 by Sega for the Sega Model 3 hardware. The game has since been ported to the Dreamcast, Microsoft Windows, Xbox 360, PlayStation 3 and Wii.",,,"Wii, Xbox 360, Dreamcast, PC, PlayStation 3",,Singleplayer,"SEGA, The Sims Studio, AM1",SEGA,1999
52704,barbie-super-sports,Barbie Super Sports,1999-12-30,,0.0,3,0,15,0,0,"Barbie: Super Sports is a sports video game for kids for PlayStation and Microsoft Windows developed by Runecraft and published by Mattel Media. You can choose 1 from 4 different characters to be: Barbie, Teresa, Christie and Kira. Two sports are available: snowboarding and roller skating.",,,"PlayStation, PC",Sports,"Singleplayer, Multiplayer",RuneCraft,"SCEE, The Learning Company, Mattel Media",1999
54668,kanon,Kanon,1999-06-04,,0.0,1,0,15,0,0,"Kanon (カノン) is a Japanese adult visual novel developed by Key released on June 4, 1999 for Windows PCs. Key later released versions of Kanon without the erotic content, and the game was ported to the Dreamcast, PlayStation 2 and PlayStation Portable. The story follows the life of Yuichi Aizawa, a high school student who returns to a city he last visited seven years prior, and he has little recollection of the events from back then. He meets several girls and slowly regains his lost memories. The gameplay in Kanon follows a branching plot line which offers pre-determined scenarios with courses of interaction, and focuses on the appeal of the five female main characters by the player character. The game once ranked as the second best-selling PC game sold in Japan, and charted in the national top 50 several more times afterwards. Kanon has sold over 300,000 units across several platforms.
Following the game's release, Kanon made several transitions into other media. Two manga series were serialized in Dengeki Daioh and Dragon Age Pure. Comic anthologies, light novels and art books were also published, as were audio dramas and several music albums. Toei Animation produced a 13-episode anime television series in 2002 and an original video animation (OVA) episode in 2003. Kyoto Animation produced a 24-episode anime series in 2006. The 2006 anime was licensed and dubbed in English by ADV Films in 2008, but the license was given to Funimation after ADV's closure. The 2006 anime plays on the association between Kanon and the musical term canon by using Pachelbel's Kanon D-dur, or Canon in D major, as a background piece at certain instances throughout the series.",,,"Dreamcast, Android, PSP, PlayStation 2, PC, Nintendo Switch, iOS","Adventure, Simulation, Casual",Singleplayer,Key,"PROTOTYPE, Prototype Games, Prototype Studios",1999
57706,racing-lagoon,Racing Lagoon,1999-06-10,,0.0,5,0,15,0,0,"Although it is a fictional world, ""Yokohama"" in 1999 is very similar to the real world.A ""car race battle"" in which men called ""Ranya"" seek their own ""driving technique"" and ""the limit of speed"".

RPG, but battle is a race. Racing Lagoon is neither an ordinary RPG nor a car racing game.
If it is an ordinary RPG, it is called a field map. The player travels in his car through the city.
You can step on the brakes and accelerate between passing cars, already at this point you can enjoy it like a mini racing game. The battle is car racing. Cars encountered on the street map, from the opponent or from yourself ""passing"" and enter the race mode, various places (course) and race conditions will appear.
Just like powering up weapons and magic, in the Racing Lagoon, remodeling your car (machine complete) is the key to victory.",https://www.jp.square-enix.com/game/detail/rl/,,PlayStation,"RPG, Racing","Singleplayer, exclusive, true exclusive","Square, Square Product Development Division 2",Square,1999
54649,giga-wing,Giga Wing,1999-11-11,,0.0,3,0,14,0,0,"Giga Wing (ギガウイング, Giga Uingu) is a 1999 vertically scrolling shooter arcade game developed by Takumi Corporation and published by Capcom on their CPS-2 arcade system board and ported later that year to the Dreamcast console. The arcade version is notable for using a horizontally aligned monitor (much like Treasure's Radiant Silvergun), something that is considered rare for a vertical shooter.",,,Dreamcast,,"Singleplayer, Local Co-Op",Takumi,"Capcom, Virgin Interactive, Japan",1999
52921,fatal-fury-wild-ambition,Fatal Fury: Wild Ambition,1999-01-28,,0.0,3,0,14,0,0,"Fatal Fury: Wild Ambition (餓狼伝説 ワイルドアンビション, Garō Densetsu Wairudo Anbishon, ""Legend of the Hungry Wolf: Wild Ambition"") is a 3D fighting video game produced by SNK and is part of the Fatal Fury series of fighting games. The game was released in Japanese arcades on January 28, 1999, although the title screen shows the year 1998. It was one of the last games released for the Hyper Neo Geo 64 system board. It was ported to the Sony PlayStation on June 24, 1999 in Japan and November 30, 1999 in North America. The game was re-released as a downloadable game for PlayStation 3 and PlayStation Portable via the PlayStation Network in Japan on April 25, 2007.
The game re-tells the story of the original Fatal Fury video game. It introduces Toji Sakata and Tsugumi Sendo to the series, and places Mai Shiranui, Kim Kaphwan, and Li Xiangfei as participants of the original King of Fighters tournament. Ryuji Yamazaki also appears as a mid-boss character and Ryo Sakazaki makes an appearance as Mr. Karate, tying the events of Art of Fighting 2 to this game.",,,PlayStation,Fighting,"Singleplayer, Multiplayer",SNK,SNK,1999
57970,warpath-jurassic-park,Warpath: Jurassic Park,1999-10-31,,3.33,5,0,14,0,0,"Warpath: Jurassic Park is a fighting video game released on the PlayStation console in 1999. It is a spin-off of the films Jurassic Park and The Lost World: Jurassic Park, in turn adapted from novels written by Michael Crichton. It was developed by Black Ops Entertainment and co-published by Electronic Arts and DreamWorks Interactive.",,,PlayStation,Fighting,"Singleplayer, Multiplayer, exclusive, true exclusive",Black Ops Entertainment,"Electronic Arts, DreamWorks Interactive",1999
57894,toca-2-touring-cars,TOCA 2: Touring Cars,1999-10-31,,0.0,4,0,14,0,0,"TOCA 2 Touring Cars (TOCA 2 Touring Car Challenge in North America) is a racing video game developed and published by Codemasters for PlayStation and Microsoft Windows. It is the second game in the TOCA series. Mainly an annual franchise update of cars and tracks, the game added more detailed graphics, physics, multiplayer modes and other minor features. Fictional (but realistic) tracks were added, and support races such as Ford Fiestas, Formula Ford and others also arrived. The level of car damage possible during a race was also enhanced, which was a significant selling point compared with the likes of Gran Turismo which had no damage model at the time. The background music features E-Z Rollers' ""Retro"". Other versions feature ""Sole Sentiment"" by Ratman in the opening intro.",,,"PlayStation, PC",Racing,"Singleplayer, Multiplayer",Codemasters,Codemasters,1999
32567,animaniacs-a-gigantic-adventure,Animaniacs: A Gigantic Adventure,1999-06-15,,0.0,4,0,14,0,0,"<p>Animaniacs: A Gigantic Adventure is an arcade game developed by EAI Interactive. It came out on 15-06-1999. It was published by Southpeak Interactive. Most rawgers rated the game as ""Recommended"". <br>You can play Animaniacs: A Gigantic Adventure on PC. </p>

<p></p>",,,PC,Arcade,Single player only,EAI Interactive,Southpeak Interactive,1999
54416,international-superstar-soccer-2000,International Superstar Soccer 2000,1999-07-29,,0.0,5,0,14,0,0,"International Superstar Soccer 2000 (officially abbreviated as ISS 2000 and released in Japan as Jikkyo J-League 1999: Perfect Striker 2 for the Nintendo 64 and as World Soccer GB 2000 for the Game Boy Color in Japan) is the second game in the Nintendo 64 Perfect Striker series and the last in Konami's Jikkyo Soccer series of N64 games developed by Konami Computer Entertainment Osaka. For the North American and European release in 2000 the rosters were updated. Introduced in the North American and European versions, it was the first and only game in the series to support the high resolution mode through an expansion pack however it suffered from some performance issues.
ISS 2000 is also notable for being the only game in the series which included players with real names, though these players only appeared in the North American release, and no team had a 100% real roster.",,,"PlayStation, Nintendo 64, Game Boy Color",Sports,Singleplayer,"Konami Digital Entertainment, KCEO",Konami,1999
52822,cool-boarders-4,Cool Boarders 4,1999-11-10,,0.0,2,0,14,0,0,"Fast and stylish snowboarding

In the game the player can play multiple tracks with multiple characters. The campaign includes scenarios such as slalom runs and time attacks. In the game the feature of multiplayer is also accessible.",,,PlayStation,"Sports, Racing","Singleplayer, Multiplayer, exclusive, true exclusive","Idol Minds, Deck Nine Games",989 Studios,1999
57613,mobil-1-rally-championship,Mobil 1 Rally Championship,1999-11-19,,0.0,5,0,14,0,0,"Mobil 1 Rally Championship (officially called Mobil 1 British Rally Championship, unofficially nicknamed Rally Championship 2000) is a rally video game which is part of the Rally Championship series. The game was released for Windows in 2000. It is developed by Magnetic Fields, distributed by Electronic Arts and Atod, and published by Actualize. The PC version is notable for stages based on real-life Ordnance Survey maps.
After the Network-Q RAC Rally Championship (1996), it is a sequel to the International Rally Championship (1997).
It features 22 cars and 36 tracks (42 in PlayStation version), drivable in two directions: Simulation and Arcade.",,,"PlayStation, PC",Racing,"Singleplayer, Multiplayer","Magnetic Fields, Creative Asylum","Ubisoft Entertainment, Europress Software, Actualize",1999
57660,omega-boost,Omega Boost,1999-04-22,,0.0,4,0,14,0,0,"Omega Boost is a three dimensional shoot 'em up developed by Polyphony Digital for the Sony PlayStation. It was released in 1999 throughout Japan, North America, and Europe by Sony Computer Entertainment.
The game features mecha designs by Shoji Kawamori of Macross fame.
Being released late in the PlayStation's life, Omega Boost is said to have some of the best graphics on the console with parts of the game running at 60 frame/s. The game was criticized by some reviewers for being too short (Nine levels with nine unlockable special missions) and simplistic. However, it is still considered one of the best Macross-style mecha simulation games produced and is thought of by many as a sleeper hit due to its poor marketing.",,,PlayStation,,"Singleplayer, exclusive, true exclusive",Polyphony Digital,"Sony Computer Entertainment, Sony Interactive Entertainment",1999
30800,supreme-snowboarding,Supreme Snowboarding,1999-11-01,,0.0,2,0,14,0,0,"<p>Supreme Snowboarding is a sports-arcade game developed by Housemarque. It was originally released in 1999. It was published by Infogrames. Most rawgers rated the game as ""Exceptional"". <br>Supreme Snowboarding is available on PC. </p>

<p></p>",,,PC,"Sports, Arcade",,Housemarque,Infogrames,1999
350006,pandoras-box-1999,Pandora's Box (1999),1999-09-02,,0.0,4,0,14,0,0,"Seven mythical tricksters escape from Pandora's Box to wreak havoc on the world. Thus begins a journey that includes 10 designs and 350 puzzles. It's up to you to solve them, capture the tricksters, and save the world from chaos. Solve 3-D puzzles specially designed for the computer. The puzzles don't require a lot of time to learn, yet they are progressively challenging to master. An overall mission provides a purpose for completing the puzzles. Game-play options allow you to follow the game's story line or jump directly to your favorite puzzle.",,,PC,Puzzle,"Story, puzzles, escape, box",Microsoft,Microsoft Studios,1999
53021,hot-wheels-turbo-racing,Hot Wheels Turbo Racing,1999-05-11,,0.0,5,0,14,0,0,"Hot Wheels Turbo Racing is a racing video game released for the Nintendo 64 and PlayStation in 1999. It features 40 cars based on the Hot Wheels series of toys. It also features Kyle Petty's 1999 NASCAR stock car, as it was sponsored by Hot Wheels. The game features music from artists like Primus, Metallica, The Reverend Horton Heat and Mix Master Mike.",,,"PlayStation, Nintendo 64",Racing,"Singleplayer, Multiplayer",Stormfront Studios,Electronic Arts,1999
57836,tank-racer,Tank Racer,1999-03-30,,4.12,8,0,14,0,0,"Tank Racer is a 3D action racing computer and video game by Grolier Interactive and Glass Ghost, copyrighted in 1998 and released on March 30 1999.",,,"PlayStation, PC","Action, Racing","Singleplayer, Multiplayer",Glass Ghost,Grolier Interactive,1999
57783,soul-of-the-samurai,Soul of the Samurai,1999-04-28,,0.0,3,0,13,0,0,"Soul of the Samurai (新時代劇アクション 羅刹の剣, Shin Jidaigeki Action Rasetsu no Ken, ""New Jidaigeki Action: Blade of the Rakshasa"", known as Ronin Blade in Europe), is an action-adventure game developed and published by Konami in 1999 for the PlayStation.",,,PlayStation,,"Singleplayer, exclusive, true exclusive","Konami Digital Entertainment, Konami Computer Entertainment Sapporo",Konami,1999
54446,monaco-grand-prix,Monaco Grand Prix,1999-06-30,,0.0,5,0,13,0,0,"Monaco Grand Prix: Racing Simulation 2, also known as just Monaco Grand Prix, is a Formula one racing game for Microsoft Windows, Nintendo 64, PlayStation, and Dreamcast. It was released in 1999. The game is based on the Formula One World Championship, but does not have the licence to use drivers names, official cars, etc. (the licence was held by Video System at the time, who made F-1 World Grand Prix and F-1 World Grand Prix II). The game does however have a licence to use Formula One's official sponsors; Schweppes and Castrol among others, helping add to the authenticity of the game.
The sequel to F1 Racing Simulation recreates the 1998 season, featuring 17 authentic tracks, 11 teams and cars with their 22 drivers. The Monaco license is used, although the teams themselves are not licensed. A total of 22 camera views are provided. Telemetry is stored and analysed in a similar way to Grand Prix 2, and physics are modeled to be realistic. There are eight different modes to race, the new ones being a career mode in which the player starts with a poor team and must drive well enough to earn competitive rides, and scenarios recreating key races for particular drivers. Returning from the first game are Time Attack, a full championship, and a 1950s retro mode. There is also a track editor for the players to create their own tracks.",,,"PC, PlayStation, Nintendo 64, Dreamcast",Racing,"Singleplayer, Multiplayer","Ubisoft, Ubisoft Paris",Ubisoft Entertainment,1999
818061,metal-gear-solid-integral,Metal Gear Solid Integral (DLC),1999-06-24,,3.5,6,0,13,0,0,"Introducing the elements added to the integral version!

* The Complete Version, surpassing the previous Director's Cut & International Version
* VR TRAINING has achieved the ultimate evolution!
Another game disc independent of the main story!
* The long-awaited English dubbed version (With optional Japanese subtitles or English subtitles)
Kojima approved, with Hollywood-esq enthusiastic performances!
* All 5 ranks of difficulty, for beginners to advanced players
* Challenging the limits of real-time full polygons
Witness the super beautiful 3D models of Naomi & Mei Ling!
* Compatible with PocketStation. Perform top secret missions, moveable in subjective mode for a new sense of tension!
* Rearranged placement of enemy soldiers!
* Commentary from the staff on the 8th frequency radio
* Includes preview videos announced at the Tokyo Game Show, E3, etc.",,,PlayStation,"Action, Adventure, RPG",,Konami Digital Entertainment,Konami,1999
52890,dragon-valor,Dragon Valor,1999-12-02,,0.0,2,12,13,0,0,"Dragon Valor (ドラゴンヴァラー, Doragon Varā) is a video game created by Namco for the Sony PlayStation and released in Japan on December 2, 1999. It is an action role-playing game containing platform and hack and slash elements. It is the third game in the Dragon Buster series.
In the Dragon Valor world, dragons are monsters with immense power; the player's role as a Dragon Valor is to slay them with a magical sword that is passed down through successive generations of the family. The game differs from other action platform games of the time in that whom the protagonist marries during the game will influence who will lead the adventure in its next phase. There are two choices in the first chapter, and a possible two choices in the second chapter, hence the game flow has three potential paths and thus three different endings.",,,PlayStation,,Singleplayer,,Namco,1999
52915,millennium-soldier-expendable,Millennium Soldier: Expendable,1999-05-28,,0.0,2,0,13,0,0,"Millennium Soldier: Expendable (known as Expendable in the U.S.A. and Seitai Heiki Expendable in Japan) is the title of a Run and Gun video game that was released by British developer Rage Software for Microsoft Windows in 1999, with ports to the Sega Dreamcast the same year, and the PlayStation in 2000. The remake of the game for Android based devices was released in late 2012 as Expendable: Rearmed. It is in the format of a modern arcade game. The player starts with 7 ""credits"" and can continue until running out of credits. A second player can join the game at any time by pressing start.
Like most top-down run and gun video games, it has collectible upgrades and weapons, and features common aspects like bosses and levels, familiar with most games of this type.
Millennium Soldier: Expendable supports Environment-Mapped Bump Mapping, a DirectX 6 feature first supported by the Matrox Millennium G400.",,,"Dreamcast, PlayStation, Classic Macintosh, PC",,"Singleplayer, 2 players",Rage Software,"Imagineer, Infogrames Multimedia, Infogrames North America",1999
52682,armored-core-master-of-arena,Armored Core: Master of Arena,1999-02-04,,0.0,4,0,13,0,0,"Armored Core: Master of Arena (アーマード・コア マスターオブアリーナ, Āmādo Koa Masutā obu Arīna) is a PlayStation video game. It is part of the Armored Core series. Master of Arena is the last Armored Core game to appear on the original PlayStation.",,,PlayStation,"Action, Shooter, Simulation","Singleplayer, Multiplayer, exclusive, true exclusive",FromSoftware,Agetec,1999
54907,survival-kids,Survival Kids,1999-06-17,,0.0,3,0,13,0,0,"Survival Kids, known as Stranded Kids in Europe and Survival Kids: Kotou no Boukensha (""Adventurer of the Solitary Island"") in Japan, is a Game Boy Color game developed by Konami that was released in 1999. The gameplay revolves around surviving on a deserted island. The game features an open-ended structure that presents the player with multiple ways to progress through the game, all at the player's own pace.",,,"Game Boy, Game Boy Color",RPG,Singleplayer,Konami Digital Entertainment,Konami,1999
56032,doshin-the-giant,Doshin the Giant,1999-12-01,,0.0,1,0,13,0,0,"Doshin the Giant is a Nintendo god simulation game for the Nintendo 64DD and GameCube. It was originally released in Japan on December 1, 1999 as a launch title for the 64DD, for which a soundtrack by Tatsuhiko Asano was released on CD by Media Factory, early the next year. Both of these received positive reviews. An expansion was released five months later called Kyojin no Doshin Kaihō Sensen Chibikko Chikko Daishūgou, which takes a very different perspective of the game, featuring short animated clips that the player can unlock after playing the original game. Doshin the Giant was later released and upgraded graphically for the GameCube and released in Japan on March 14, 2002 and Europe on September 20, 2002. The re-release received mostly positive reviews.",,,GameCube,Simulation,Singleplayer,"Nintendo, Param",Nintendo,1999
54638,dynamite-cop,Dynamite Cop,1999-05-27,,3.5,6,0,13,0,0,"Dynamite Cop, known in Japan as Dynamite Deka 2 (ダイナマイト刑事2, Dainamaito Deka Tsu), is a 1998 beat 'em up video game published by Sega and initially released in arcades on Sega Model 2 hardware. It is the sequel to the 1996 game, Dynamite Deka which was released outside Japan as Die Hard Arcade. The game was ported to the Dreamcast and released internationally in 1999, this time without the Die Hard license. A third sequel, Asian Dynamite, was released only in arcades.",,,Dreamcast,Arcade,"Singleplayer, Multiplayer","SEGA, AM1",SEGA,1999
