id,slug,name,released,metacritic,rating,ratings_count,playtime,added,twitch_count,youtube_count,description,website,reddit_url,platforms,genres,tags,developers,publishers,year
21410,fleet-command,Fleet Command,1999-05-15,,0.0,1,1,96,7,317231,"International waterways become theaters of war when the world's most formidable maritime powers exchange their fatal blows. With entire fleets at your command, you must strategically deploy vessels from every class - frigate to aircraft to nuclear submarine - to maintain the precarious balance of naval power and gain position for the deadly endgame.
Campaigns and mission scenarios straight from current headlines
Exclusive real-time strategy with cuttingedge, real-world weapons
Intuitive point and click game play
No need to memorize symbols or complex commands
Player designed task forces
Complete 3D environment rotates and zooms for intense combat action
Effects modeled in stunning detail- time of day, clouds, rain, differing sea states, ship's wake and pyrotechnics",,,PC,Strategy,"Singleplayer, Naval",Sonalysts,Strategy First,1999
22698,total-annihilation-kingdoms-iron-plague,Total Annihilation: Kingdoms + Iron Plague,1999-06-24,,2.82,11,1,94,0,0,"Massive armies will clash. Forests and cities will burn.
Tremendous magical forces will level entire castles in the blink of an eye.
Four immortal sibling monarchs are locked in a massive campaign to rule the land of Darien. Build your armies, hone your magic skills and gather resources to wage war on an epic field of battle.
The balance of power lies in your arms.
Pack includes: ""Total Annihilation: Kingdoms"" and the ""Iron Plague"" expansionCommand vast armies of skeletal archers, undead foot soldiers, magic-casting wizards and dragon riders.
Play as the monarch of one of four unique civilizations, each with its own combat strategies.
Lay siege to castles and cities and engage in combat accompanied by an epic soundtrack composed by Jeremy Soule!",,,"PC, macOS",Strategy,"Singleplayer, Multiplayer",Cavedog Entertainment,Wargaming,1999
31690,tom-clancys-rainbow-six-rogue-spear,Tom Clancy's Rainbow Six: Rogue Spear,1999-08-31,75.0,3.77,26,60,92,108,0,"Six is back--and tougher than ever. Due to the team's fantastic success with defusing major terrorist incidents, the international community has come to depend on RAINBOW as the main force secretly protecting citizens worldwide. Thus, the story continues in Rogue Spear, with the team's initial missions being business as usual: a hostage situation at the Metropolitan Museum of Art and an airplane hijacking. However, the team soon discovers that these crisis situations are actually related to the nefarious plots of not one, but two antagonists: the Russian Mafia and a Middle Eastern terrorist organization--groups who have, until now, been able to escape the jaws of international justice. Through a series of increasingly difficult missions, RAINBOW uncovers the terrorists' deadly master plan, just in the nick of time--to save the world again. Players have new weapons at their disposal as well as sniper specialists to properly take out deadly foes from afar, and with more than four hundred new motion capture moves, terrorists and hostages react even more realistically to you and your team. The frozen breaths of team members can be seen puffing from their mouths in snowy conditions while footprints are left behind. Guide your team with a joystick, add more terrorists with the mission editor, and send your friends a copy of your greatest attack with the cinematic replay feature. All of this and more will make Rogue Spear the greatest action/strategy game you've ever played. Just remember, if you fail, the game isn't over--the world is.",,,"PC, Game Boy Advance, PlayStation, Classic Macintosh, Dreamcast","Action, Shooter, Strategy","Singleplayer, Multiplayer, cooperative","Red Storm, Ubisoft Milan",Red Storm Entertainment,1999
13208,trickstyle,TrickStyle,1999-09-08,,3.45,11,5,92,17,0,"Grab your hoverboard and take to the skies in the futuristic super-speed air racing of TrickStyle. There's no need for wheels here as you choose your stylish racer and board and head for the Velodrome. At the Velodrome staging area you enter a room and decide which of the 18 tracks you'd like to strut your airborne stuff on.
Race on three continents on awesome tracks that will challenge your every reflex and skill. But wait, there's no time to rest as you face off against a champion boss character. Emerge victorious and you'll unlock brand new hoverboards to compete with.
Pull off wild tricks, spins, and jaw-dropping jumps while blazing across inventive courses. Slip between narrow passageways, avoid buildings, dive under bridges, and hop over fences as you blitz towards the finish. TrickStyle includes an iconic techno soundtrack, and inspired sound effects.",,,"Dreamcast, PC","Action, Sports, Racing, Arcade","Singleplayer, Multiplayer, Full controller support, Steam Cloud, steam-trading-cards, cooperative, Classic, Split Screen, Local Multiplayer, Retro","Criterion Games, Throwback Entertainment","Acclaim Entertainment, Throwback Entertainment",1999
54433,mario-golf-1999,Mario Golf (1999),1999-06-11,,3.67,36,0,86,0,0,"Mario Golf (マリオゴルフ64, Mario Gorufu Rokujūyon, Mario Golf 64) is a sports game developed by Camelot Software Planning and published by Nintendo for the Nintendo 64 in 1999. In the game, Mario, his friends, and his enemies play golf on a variety of Mario-themed courses. It is the second game in the Mario Golf series (though the first to carry that name). Its tagline was ""Tee up with Mario and his friends!""
A portable version of this game for Game Boy Color (known as Mario Golf GB (マリオゴルフＧＢ) in Japan) was also developed by Camelot Software Planning. Unlike the console version, it includes role-playing video game elements.",,,"Wii U, Wii, Nintendo 64, Game Boy Color",Sports,"Singleplayer, Multiplayer",Camelot Software Planning,Nintendo,1999
30539,grand-theft-auto-mission-pack-london-1969,Grand Theft Auto Mission Pack: London 1969,1999-03-31,,3.42,23,0,83,0,0,"London can be yours, but as betrayal and brutality engulf your world, you've got to keep a level head, keep earning the cash and keep driving a sleek ride. Or you'll have your head kicked in, and no mistake, sunshine. You're playing with the big boys now, and we haven't had our dinner. So, my boy, only one question remains... do you want in? If so, get to bloody work. If not, go and play with your action figures, and stop wastin' our time. Alright?",,,PC,"Racing, Arcade",work,DMA Design,Take 2 Interactive,1999
22660,expendable,Expendable,1999-05-14,,3.57,7,1,83,0,0,"Somewhere in the future a hostile alien race conquers most of the galaxy. To battle aliens scientists had developed the “Millennium Soldier” project by cloning two super-soldiers. Armed with blasters they will battle scores of monsters, robots and boss aliens to save us and get a well-earned reward.
The game itself is very entertaining – its one of those good old shoot-em-ups that you remember and boy do they make a good show for themselves! The classic scheme of “go forward, destroy, get some new toys, kill some more” works perfectly, like always, even after a few hours of playing it's still fun to watch all of those explosions and slaughter. During your quest of annihilation you will find some extra weapons that will help you keep yourself together and enemies in parts. Most of these weapons are classic, but in game a like this it's a plus, not a minus. Overall it's a great peace of a game that you will have fun playing – alone or with a friend!Features:Gameplay packed with so much action it has little room left for anything else.
A wide variety of weapons and enemies.
Diverse levels with enemies, powerups, bonuses, secrets, bosses and puzzles.",,,"PC, macOS","Action, Shooter, Adventure","Singleplayer, Multiplayer, Co-op, Sci-fi, Partial Controller Support, Classic, Retro, Top-Down Shooter",Rage Software,"Funbox Media, Blue Moon Red Owl",1999
54552,vigilante-8-2nd-offense,Vigilante 8: 2nd Offense,1999-10-31,,4.27,45,0,83,0,0,"Vigilante 8: 2nd Offense is a vehicular combat video game developed by Luxoflux and published by Activision for PlayStation, Dreamcast and Nintendo 64. It is the sequel to Vigilante 8.",,,"PlayStation, Nintendo 64, Dreamcast",Action,"Singleplayer, Multiplayer, exclusive, Combat Racing",Luxoflux,Activison,1999
58009,yu-gi-oh-forbidden-memories,Yu-Gi-Oh! Forbidden Memories,1999-12-09,,4.0,38,52,82,0,0,"Yu-Gi-Oh Forbidden Memories, known in Japan as Yu-Gi-Oh! Shin Duel Monsters (遊戯王真デュエルモンスターズ封印されし記憶) is a video game loosely based on the Yu-Gi-Oh! manga and anime series.
The game, made for the PlayStation, takes place in Ancient Egypt. The players play the Yu-Gi-Oh! Trading Card Game alongside characters that appear in the series.",,,PlayStation,,"exclusive, true exclusive","Konami Digital Entertainment, Konami Computer Entertainment Japan",Konami,1999
57938,twisted-metal-4,Twisted Metal 4,1999-10-31,,4.11,38,0,82,0,0,"Twisted Metal 4 is a vehicular combat video game developed by 989 Studios and published by Sony Computer Entertainment for the PlayStation. The game was released in North America on October 31, 1999 and was re-released for the Sony Greatest Hits line-up in 2000. Like the previous installment, it wasn't released in the PAL regions.
Twisted Metal 4 is the fourth installment in the Twisted Metal series and the second and last installment to be developed by 989 Studios. The game's plot centers on Sweet Tooth, the long-time mascot of the titular Twisted Metal competition, overthrowing Calypso, the mysterious organizer of the competition, in a coup d'état. He then takes over the mantle of granting the winner of the competition a single wish, regardless of price, size or even reality.
Twisted Metal 4 received mixed to positive reviews from critics, who considered it to be an improvement over the previous Twisted Metal III, particularly in terms of level design.",,,PlayStation,,"Singleplayer, Multiplayer, exclusive, true exclusive, Combat Racing",989 Studios,"Sony Computer Entertainment, Sony Interactive Entertainment",1999
4715,missile-command,Missile Command,1999-01-01,,2.73,11,0,81,37,351396,"Purchase this PS one® Classic and play it on both your PS3™ and PSP® (PlayStation®Portable) systems!

Defend the cities of the Earth against an alien invasion in this reimagining of an arcade classic.
Download this PS one® Classic today!
Transferring to a PSP® system from your PS3™ system:
You must be signed into the PlayStation®Network account that originally purchased the game.  You must have at least 193 MB free on your Memory Stick Duo™.  Connect your PSP® system to your PS3™ system with a USB cable and switch your PSP® system to USB Mode. Highlight the game on the PS3™ XMB™, press the Δ button and select Copy.

PC Store Customers:
Log into your PlayStation®Network account that you originally used to purchased the game.  Then, download the game from your ""Download List"" in the PlayStation®Store onto your PS3™ system.
This title has been converted from the original PlayStation® disc to the PSP® and the PS3™ systems. Consequently, there may be times where the title plays differently from the PlayStation® disc version, or where some features may not function properly.  This version does not support PlayStation® peripherals (controller, memory card, multitap, etc.), therefore functionalities such as multiplayer, versus, and co-op modes are not available.
Purchase indicates acceptance of the PlayStation®Network Terms of Service/User Agreement and this item's use restrictions.  If you do not wish to accept all these terms, do not purchase this item.  One-time license fee for downloads to up to 2 console systems and 2 portable systems that are associated with the purchasing account.
Missile Command ® © 1999 Atari Interactive, Inc.
""PS one"", ""PlayStation"", ""PS"" Family logo, and ""PSP"" are registered trademarks of Sony Computer Entertainment Inc.",,,"PC, Game Boy, PlayStation, Xbox 360","Action, Shooter, Strategy, Arcade","Multiplayer, Controller, alien, memory, atari","Sony Interactive Entertainment, Stainless Games, Meyer/Glass Interactive","Atari, Hasbro Interactive",1999
22942,corsairs-gold,Corsairs Gold,1999-04-29,,0.0,2,1,81,0,0,"Plunge into a world of adventure and freedom and discover the excitement of sailing, the thirst for gold, thundering cannons, and savage pirate attacks.
A fascinating quest will drive you to the four corners of the Earth and new adventures will await you in each port along your journey.
You will accumulate fortune for yourself and for your country, either by force or through your shrewd business dealings.
As an accomplished warrior and a skillful negotiator, only strategy will serve to forge your reputation. You may even succeed in becoming more admired than the king and more feared than the most barbaric of pirates!
div.game_top { height:312px; }
ul.labels > .lang_bubble { margin-bottom: 20px;}
ul.details > .lang_details { height: 30px; line-height:16px; max-width:360px; padding-top:1px;}
Includes Corsairs: Conquest at Sea, and its expansion Corsairs: The New Conquerors.
Command every aspect of your fleet, from your crew's morale to the sale of your cargo.
Sail authentically reproduced vessels using historically accurate maps.
Meet famous characters such as Blackbeard, Surcouf, and Rackham the Red, and take part in major battles based on real events.",,,PC,Strategy,Singleplayer,Microids,Anuman Interactive,1999
31153,baldurs-gate-tales-of-the-sword-coast,Baldur's Gate: Tales of the Sword Coast,1999-04-30,,4.15,34,0,81,0,0,"<p>Baldur's Gate: Tales of the Sword Coast is a RPG game developed by BioWare. It was originally released in 1999. It was published by Interplay Productions. The game is rated as ""Recommended"" on RAWG. <br>Baldur's Gate: Tales of the Sword Coast is available on PC. </p>

<p></p>",,,PC,RPG,,BioWare,Interplay Productions,1999
50504,descent-3,Descent 3,1999-06-17,89.0,3.5,10,1,80,34,0,"The vertigo continues as the highly anticipated sequel to Descent I and II takes the mind-bending, pulse-pounding experience to another level! This time around, you will experience not only the same frenzied, subterranean shooting action, but also the thrill of flying out of the mines into the planetary atmosphere; where you can soar above the surface of the planet, engage in combat with enemy air and ground forces and use 10 new, lethal weapons to obliterate the most sophisticated robots to date!",http://www.interplay.com/games/descent.php,,PC,Action,"Singleplayer, Multiplayer, Sci-fi, FPS, Classic, 6DOF",Outrage Entertainment,Interplay Productions,1999
35203,exist,Exist,1999-01-01,,0.0,3,1,79,0,0,"The goal of Exist is to survive on a island using gathered or stolen materials. They must successfully manage their hunger, thirst, and health or risk dying. While there is harmful wildlife, the most important threat is other players. Combat uses firearms and  weapons from the old age, such as bows and spears etc. The game features crafting, To stay protected, players must build bases or join clans with others to improve their survivability. with raiding being ordinary and done more oftenby other players or clans.",https://vaddim.itch.io/exist,,"PC, macOS","Action, Shooter, Adventure, Casual, Massively Multiplayer, Indie","Singleplayer, Multiplayer, Co-op, Online Co-Op, Survival, Violent, Online multiplayer, Split Screen, Local Co-Op, Local Multiplayer, Early Access, mmo","UMBRESS, BullBox Studios","UMBRESS, Mike Fricker, BullBox Studios",1999
52650,ace-combat-3-electrosphere,Ace Combat 3: Electrosphere,1999-05-27,,4.33,43,0,79,0,0,"""Ace Combat"" which made ""Fun to fly in the sky"" very familiar, ""Ace Combat 2"" which has evolved dramatically beautifully. And now, the latest series ""Ace Combat 3 Electrosphere"" will inherit this essence. The stage is a near future world where the power of ""economy"" has jumped far beyond the power of the state. There, the two companies had a mighty power. One is a multinational composite company ""General Resources"" with a huge capital, with the military industry as the base, and the other is a ""Newcom company"" with advanced information technology and science and technology as the base. The two companies, which had a subtle tension relationship, finally entered into a state of engagement. The main character (player) belongs to an organization called UPEO [Yupeio], and it fights at fighter plane to suppress the conflict between the two companies.",,,PlayStation,"Action, Simulation, Arcade","Singleplayer, exclusive, true exclusive, combat flight, combat flight space",NAMCO,"Sony Interactive Entertainment, Namco",1999
31729,midtown-madness,Midtown Madness,1999-05-01,,4.23,39,2,79,9,0,"<p>Midtown Madness is a racing-arcade game developed by Angel Studios. It was originally released in 1999. It was published by Microsoft Studios. The game is rated as ""Recommended"" on RAWG. <br>You can play Midtown Madness on PC. </p>

<p></p>",,,PC,"Racing, Arcade",,Angel Studios,Microsoft Studios,1999
54934,xena-warrior-princess,Xena: Warrior Princess,1999-09-30,,3.72,32,0,77,0,0,"Xena: Warrior Princess is a hack and slash action video game developed by VU Games and published by Electronic Arts for the PlayStation in 1999. A Game Boy Color version was developed and published by Titus Software in 2001. A PlayStation 2 version, developed by EM Studios and published by Blast! Entertainment, was released exclusively in PAL territories in 2006. Each version is based on the television series, Xena: Warrior Princess, which aired from 1995 to 2001.",,,"PlayStation, Game Boy Color",,Singleplayer,"EM Studios, Vivendi, Universal Digital Arts, Titus Interactive Studios","Electronic Arts, Titus Software, Blast! Entertainment",1999
5355,the-king-of-fighters-99,The King of Fighters '99,1999-06-24,67.0,4.07,28,0,75,0,0,"Purchase this PS one® Classic and play it on both your PS3™ and PSP® (PlayStation®Portable) systems!

Another King of Fighters tournament is on the horizon and it's up to you and your team of brawlers to come out on top.  Select your crew from a healthy roster of old favorites along with new.  Battle your friends in the all new Striker match, as well!
Download this PS one® Classic today and become the King of Fighters!
Transferring to a PSP® system from your PS3™ system:
You must be signed into the PlayStation®Network account that originally purchased the game.  You must have at least 157 MB free on your Memory Stick Duo™.  Connect your PSP® system to your PS3™ system with a USB cable and switch your PSP® system to USB Mode. Highlight the game on the PS3™ XMB™, press the Δ button and select Copy.

PC Store Customers:
Log into your PlayStation®Network account that you originally used to purchased the game.  Then, download the game from your 'Download List' in the PlayStation®Store onto your PS3™ system.
Software subject to license (us.playstation.com/softwarelicense).  Online activity subject to Terms of Services and User Agreement (www.playstationnetwork.com/terms-of-service).
This title has been converted from the original PlayStation® disc to the PSP® and the PS3™ systems. Consequently, there may be times where the title plays differently from the PlayStation® disc version, or where some features may not function properly.  This version does not support PlayStation® peripherals (controller, memory card, multitap, etc.), therefore functionalities such as multiplayer, versus, and co-op modes are not available.
Purchase indicates acceptance of the PlayStation®Network Terms of Service/User Agreement and this item's use restrictions.  If you do not wish to accept all these terms, do not purchase this item.  One-time license fee for downloads to up to 2 console systems and 2 portable systems that are associated with the purchasing account.
The King of Fighters '99 © SNK Playmore, The King of Fighters is a registered trademark of SNK Playmore Corporation.  All Rights Reserved.
'PlayStation', 'PS' Family logo, and 'PSP' are registered trademarks of Sony Computer Entertainment Inc.",,,"Dreamcast, PlayStation, Neo Geo, Nintendo Switch, PC, Xbox One, PlayStation 4","Arcade, Fighting","Singleplayer, Multiplayer, Controller, battle, console, match, memory, 2 players, versus","Sony Interactive Entertainment, SNK","SNK, D4Enterprise Co.",1999
23970,super-mario-bros-deluxe,Super Mario Bros. Deluxe,1999-05-01,,4.0,28,3,74,116,0,"Bowser has taken over the Mushroom Kingdom, and it's up to Mario to put
an end to his sinister reign! Battle Bowser's vile henchmen through 32
levels in the Original 1985 game mode. Move on to collecting special Red
Coins and Yoshi Eggs in Challenge mode. Then, try to unlock a secret
mode that's waiting to be found by super players like you! Every mode
will give you the chance to beat your own score, and there's a lot more
to do than just saving a princess. So get ready for a brick-smashin',
pipe-warpin', turtle-stompin' good time!
This game is only playable in 2D.This classic game is part of the Virtual Console service, which brings you great games created for consoles such as NES™, Super NES™ and Game Boy™ Advance. See more Virtual Console games for Nintendo 3DS.",,,"Nintendo 3DS, Game Boy Color",Platformer,"battle, console, NES, mario, coins, brick, turtle",Nintendo,Nintendo,1999
54634,dead-or-alive-2,Dead or Alive 2,1999-10-16,,4.15,27,0,74,0,0,"Dead or Alive 2 (Japanese: デッドオアアライブ2, Hepburn: Deddo Oa Araibu 2, abbreviated as DOA2) is a fighting game in the Dead or Alive series, developed by Team Ninja and published by Tecmo. It debuted in arcades in 1999 and was later ported for the Dreamcast and the PlayStation 2 in 2000. Several enhanced editions of the game were released, including the updates Dead or Alive 2 Hardcore and Dead or Alive 2 Hard*Core.
Dead or Alive 2 improved upon the graphics engine of its predecessor by using Sega NAOMI hardware and on the gameplay system by including many new features, leading to critical acclaim and strong sales. In 2004, DOA2 was remade for the Xbox as part of Dead or Alive Ultimate.",,,"Dreamcast, PlayStation 2",Fighting,"2 players, Up to 4 players simultaneously",Team NINJA,"Acclaim Entertainment, SCEE, Tecmo Koei, Tecmo",1999
30298,croc-2,Croc 2,1999-06-30,,3.75,20,0,74,108,0,"<p>Croc 2 is an arcade game developed by NATSUME, Argonaut Games and Argonaut Software. It was originally released in 1999. It was published by Koei. Most rawgers rated the game as ""Recommended"". <br>Croc 2 is available on PlayStation, Game Boy Color and PC. <br>It was produced by Iku Mizutani and Jon Osborn. It was directed by Hidesi Ito. It was scored by Iku Mizutani, Justin Scharvona, Karin Griffin and Kinuyo Yamashita. <br></p>",,,"PlayStation, Game Boy Color, PC",Arcade,"Singleplayer, Multiplayer","NATSUME, Argonaut Games, Argonaut Software","THQ, Koei, Fox Interactive, vgrelease",1999
52636,tomorrow-never-dies,007: Tomorrow Never Dies,1999-11-16,,3.32,28,0,74,0,0,"Tomorrow Never Dies (also known as 007: Tomorrow Never Dies) is a third-person shooter stealth video game based on the James Bond film of the same name. Developed by Black Ops Entertainment and co-published by Electronic Arts and MGM Interactive, it was released for the Sony PlayStation in November 1999. It is the first 007 game that was published by Electronic Arts since acquiring the James Bond licence. This game marks the second appearance of Pierce Brosnan's James Bond, although the voice of Bond is provided by actor Adam Blackwood in the game.",,,PlayStation,"Action, Shooter","Singleplayer, Third-Person Shooter, exclusive, true exclusive, 3rd-person-shooter",Black Ops Entertainment,"Electronic Arts, MGM Interactive",1999
3081,tomba-2,Tomba! 2: The Evil Swine Return,1999-10-28,,4.45,29,0,73,99,0,"Explore an all new 3D world. Use your trusty fire hammer, ice boomerang or or blackjack to turn the evil pigs into bacon. Throw on super-duds like a flying squirrel suit or high speed turbo pants. There's no limit to the stuff you can do.",,,PlayStation,"Action, Platformer",Singleplayer,Whoopee Camp,SCEA,1999
29717,sid-meiers-alpha-centauri,Sid Meier's Alpha Centauri,1999-02-12,92.0,4.16,30,1,72,43,0,"<p>Sid Meier's Alpha Centauri is a strategy game developed by Firaxis. It was originally released in 1999. Electronic Arts published the game. On review aggregator Metacritic, Sid Meier's Alpha Centauri has a score of 92. The game is rated as ""Exceptional"" on RAWG. <br>You can play Sid Meier's Alpha Centauri on PC. <br>It was produced by Andy Hollis. Sid Meier directed the game. It was scored by Jeffery L. Briggs. <br></p>",http://www.firaxis.com/smac/,,PC,Strategy,,Firaxis,Electronic Arts,1999
