id,slug,name,released,metacritic,rating,ratings_count,playtime,added,twitch_count,youtube_count,description,website,reddit_url,platforms,genres,tags,developers,publishers,year
21265,half-life-opposing-force,Half-Life: Opposing Force,1999-11-19,,3.85,734,3,6988,122,1000000,"Half-Life: Opposing Force is an expansion pack for the original first-person shooter Half-Life. The game setting is the same as the one in the original game: the story takes place in the science laboratory called Black Mesa Research Facility in New Mexico at the same time. However, instead of following the original characters, players are offered to assume the role of Adrien Shephard a Hazardous Environment Combat Unit (initially antagonist organization) operator, who is sent to Black Mesa to prevent an extraterrestrial menace. Nevertheless, shooting scientists is not required, as the main threat comes out of aliens. The overall gameplay has few differences comparing to the one existing in Half-life, as far as it is based on completing the sequence of levels. Although the combat system looks almost the same, it features the non-player character’s assistance so the protagonist will receive support from scientists, security guards, and marines (soldiers, combat medics, and engineers) during firefights or while solving puzzles. Players will also face new aliens types added to the existing ones.",,https://www.reddit.com/r/HalfLife/,"Linux, macOS, PC","Action, Shooter","Singleplayer, Multiplayer, Atmospheric, Great Soundtrack, Co-op, Story Rich, cooperative, First-Person, Sci-fi, FPS, Classic, Aliens, Military, Valve Anti-Cheat enabled, 1990's, Silent Protagonist",Gearbox Software,Valve,1999
20406,team-fortress-classic,Team Fortress Classic,1999-04-01,,2.92,382,1,6132,131,1000000,"A world whose atmosphere consists of fire and flying fragments of flesh. The shooting and explosions are just as natural in this world as the birds' singing in the forest. Without a continually working Hastings machine gun, you just do not survive. And it is necessary to forget about steps - running is better.
The game has six modes - each mode is different for the purpose of the game:
Capture the enemy flag on the enemy’s base and bring it to your base.
Set your flag on the territory of the enemy or in an area not occupied by anyone.
Bring one of the players - an unarmed ""civilian"" (but he does have an umbrella!) - to a safe place, do not let him be shot by enemy snipers.
Grab the ball (not the flag) and carry it to your base.
Grab more control points (not territories).
Capture places that are protected by enemies, or defend sites from invaders.
There are only two means to achieve the goal. The first is obvious - to kill as many strangers as possible, but better all at once. The second is to establish interaction with the players on your team. This game is created to play in a team. For a diversity, there are nine classes for players - each class has one unique weapon.",,,"macOS, Linux, PC",Action,"Multiplayer, Co-op, Story Rich, cooperative, First-Person, FPS, Online Co-Op, Funny, Classic, Retro, Team-Based, Fast-Paced, Competitive, Valve Anti-Cheat enabled, Remake, 1990's, Class-Based, Mod",Valve Software,Valve,1999
10615,system-shock-2,System Shock 2,1999-08-11,92.0,4.14,404,2,4366,110,1000000,"The game is set in the distant future of 2114, 42 years after the events of the original System Shock. We are onboard the spaceship Von Braun that returns from humanity's first interstellar expedition to Tau Ceti system. The plot follows the main character who awakens from the cryosleep, with no idea what's going on. The rest of the crew was affected by some disaster that either killed them or turned into brainwashed slaves of an alien entity called The Many. The only other survivor is presumed to be mysterious Dr. Janice Polito, who instructs the player via radio. To survive and find out what happened, the protagonist sets out to explore the dimly lit corridors of Von Braun, encountering his former friends mutated into abominations. The player can use guns, but ammunition is scarce, which forces the player to use it prudently and move ahead with caution.

The game was created by Ken Levine, the Irrational Games founder and famous designer behind such titles as BioShock and Thief: The Dark Project. System Shock series was a major inspiration for Bioshock series, which is considered its spiritual successor, as well as, to some extent, Portal series.",http://www.nightdivestudios.com/games/system-shock-2/?utm_source=steampowered.com&amp;utm_medium=product&amp;utm_campaign=website%20-%20system%20shock%202,https://www.reddit.com/r/SystemShock2/,"PC, macOS, Linux","Action, Shooter, RPG","Singleplayer, Atmospheric, steam-trading-cards, Great Soundtrack, RPG, Co-op, Story Rich, cooperative, First-Person, Sci-fi, Horror, FPS, Classic, Survival, Space, role-playing, Survival Horror, Cyberpunk, Cult Classic, Masterpiece, Immersive Sim, Inventory Management","Irrational Games, Looking Glass Studios","Electronic Arts, Nightdive Studios",1999
10050,thief-gold,Thief Gold,1999-10-29,92.0,4.0,257,1,3627,0,1000000,"Stalk your prey on the quest for stolen goods with your blackjack, sword, and an assortment of unique arrows. Steal for money and uncover the hidden agendas of your allies and enemies as you play through an unravelling story of deception and revenge. Survive in a world where shadows are your only ally, trust is not an option, and confrontation results in death!Key Features:Pioneering stealth based gameplay brings a new dimension to first person action.
Thief™ Gold includes Thief™ The Dark Project (12 huge missions with multiple environments) and the Gold update (3 new campaign missions which deepen the plot and add five new types of enemies)
Advanced enemies can see, hear, speak, and sound alarms.
Your arsenal includes: blackjack, sword, fire arrows, water arrows, rope arrows and more",http://na.square-enix.com/us/home,,PC,"Action, Simulation","Singleplayer, Atmospheric, Story Rich, First-Person, Horror, FPS, Fantasy, Exploration, Classic, Stealth, Dark, Zombies, Moddable, Dark Fantasy, Medieval, Steampunk, 1990's, Cult Classic, Immersive Sim",Looking Glass Studios,Square Enix,1999
20466,worms-armageddon,Worms Armageddon,1999-01-29,,4.31,554,2,3133,123,994397,"Worms Armageddon is a 2D artillery tactical shooter with turn-based gameplay. It follows the visual style of the series, and you control a team of cartoonish worms that fight with real-based weapons. While the game was developed in the late 90s, the newest version is available on Steam since 2013.

The core gameplay is focused on turn-based PvP battles. Each player can perform an action during their turn. You have numerous possibilities: you can move your worms, attack opponents, use different items and so on. The goal is to defeat other players.

The only stat a worm has is its health. On the contrary, there is a huge variety of weapons and constructions that can be used during the fight. Weapons have different parameters and unique abilities. Some of them, such as flamethrower, are based on real models, while the others, like explosive moles,  are completely fictional.",http://www.team17.com,,"PC, Dreamcast, PlayStation, Game Boy Color, Nintendo 64",Strategy,"Singleplayer, Multiplayer, Co-op, cooperative, 2D, Funny, Classic, Comedy, Split Screen, Local Co-Op, Local Multiplayer, Turn-Based, Physics, Turn-Based Strategy, 1990's",Team17 Digital,"Team17 Digital, Atari, Hasbro Interactive",1999
54629,crazy-taxi,Crazy Taxi (1999),1999-01-01,82.0,3.83,423,1,2757,0,61337,"Crazy Taxi is the renewed version of arcade machine title of the same name that was released in 1999. It’s a taxi driver simulator. The goal of the game is to deliver passengers to their destinations, performing numerous tricks. The game also features 16 mini-games.

Crazy Taxi follows the classic mechanics of score games: you need to get from a passenger as much money as possible. In the beginning you can choose a driver and a car; their stats are quite similar with slight differences in speed and turning. To raise your tips you need to reach the destination on time. To earn extra money you can perform multiple tricks, including drifts, jumps, near-misses, and combos of these moves. 

Driving through the city isn’t that easy as it seems to be. There are numerous obstacles in your way, such as frustratingly slowly buses, that make you take risks during your maneuvers on the road. Moreover, the amount of potential passengers is limited: once you pick up a person, it’s unavailable for the rest of the game.",,,"PlayStation 3, PlayStation 2, Xbox 360, PC, iOS, Android, GameCube, Dreamcast","Action, Racing, Arcade","Singleplayer, Great Soundtrack, Open World, Partial Controller Support, Classic, Driving","SEGA, Acclaim Cheltenham, Hitmaker, Strangelite","SEGA, Activision Value Publishing, Acclaim Entertainment",1999
12280,tomb-raider-the-last-revelation,Tomb Raider IV: The Last Revelation,1999-10-31,,3.73,168,1,2449,0,26382,"Tomb Raider IV: The Last Revelation is an action-adventure game developed by Core Design. It is the fourth game in the Tomb Raider series.

###Plot
Young Lara Croft who is accompanied by professor Werner Von Croy goes to Cambodia to find a mysterious artifact known as Iris. Unfortunately, due to an accident, the professor dies and Lara has to return to Great Britain. 15 years later, Lara opens up an Egyptian tomb where an ancient Egyptian god Set was buried. She incidentally awakens an old god, so now Lara has to get him back to the tomb to prevent the Apocalypse from happening.

###Gameplay
The main gameplay formula of Tomb Raider is largely the same. The players have to explore the levels in order to find certain items. In their search, the players have to avoid and fight enemies and use aerobatics to progress further into the level.

However, compared to the last game, The Last Revelation features some major gameplay changes. Now Lara can swing on ropes to get over gaps and pits, she can use pipes to climb up the buildings, and shimmy on ledges. Instead of using the old circular inventory system, it is now linear, where all the items in your inventory are placed in a horizontal line. The players can now utilize a compass, yet it is only used for putting in cheat codes or solving a puzzle on one of the game's levels. The items in your inventory can be combined together.",,,"PC, Dreamcast, Classic Macintosh, PlayStation","Action, Shooter, Adventure, Puzzle","Singleplayer, Third Person, Classic, Female Protagonist, Action-Adventure, Third-Person Shooter, Lara Croft","Sony Interactive Entertainment, Core Design","Square Enix, Capcom, Eidos Interactive",1999
54718,quake-iii-arena-1999,Quake III Arena,1999-12-02,69.0,4.33,514,1,2424,0,383014,"The third game in the genre of first-person shooter in a series of Quake. Unlike previous games in the series, the game is focused on a multiplayer mode, and does not have a full-fledged single-player campaign.

###Previous and next games of the series
Quake (1996)
A first-person shooter, the player controls a nameless fighter, the base of which was attacked by enemies whose common name is Quake.

The game was a breakthrough in 3D video game technology - implemented a fully three-dimensional world.

The game has a single player campaign and multiplayer mode. The first Quake is the ancestor of cybersport, the major championships began to be held on the basis of the game.

The game code was made publicly available, which led to the appearance of a large number of add-ons not related to the creators of the game. There are also official additions.

Quake II (1997)
Quake II, despite the name, is not a continuation of Quake and its additions. The plot of Quake II tells the story of the confrontation between people and the race Stroggs. The player controls the soldier Bitterman.

Despite the similarities in weapons and objects, the enemies and the storyline have nothing in common.

Initially, the creators did not plan to call the game Quake, but due to the fact that many of the names that came to their mind were already used somewhere, they had to dwell on the old name. In addition, their decision was also influenced by the fact that by the time Quake, as a trademark, was able to ensure commercial success.

Quake IV (2005)
The game continues the story of the battle of humanity with the Stroggs. Spaceships and military equipment of earthlings borrowed from the movie ""Star Troopers"", and the overall design of the Stroggs and their equipment (especially living computers with human body parts) is made in the style of Giger's biomechanoids.

The player acts as a paratrooper of Rhino squad involved in a counterattack on the capital planet of the Stroggs.

After Quake IV were created:
Enemy Territory: Quake Wars (2007) is a game in the world of Quake II and Quake IV, events take place 50 years before the events of Quake II. The game is notable for the use of ground and air vehicles.

Quake Champions (2017)
The game introduces a series of champions - characters with unique abilities. There are fourteen Champions in this game.

###Quake III Arena (1999)
The game emphasizes the multiplayer mode. There is a single mode in the game, but it is not full-fledged and consists of battles with bots.

Quake III Arena Story
The mysterious race Vadrigar built the Arena Eternal, and arranges fights for the best gladiators of the world there - this is the favorite entertainment of this race. Gladiators do not die completely - they are reborn, enriched by the experience of the battle, even if the battle was lost.

Quake III Arena Multiplayer Basic Modes
Free For All - classic Deathmatch;
Team Deathmatch - team battle;
Tournament
Capture The Flag

After the discovery of the code, numerous modifications appeared and gained popularity, including DeFRaG - a modification focused on performing various tricks.

There is an official addition to the game Quake III: Team Arena, and the updated version of the game called Quake Live (2010).",,,"Dreamcast, PC, Linux, PlayStation 2, PlayStation, Classic Macintosh","Action, Shooter","Singleplayer, Multiplayer, Steam Cloud, First-Person, Sci-fi, FPS, Gore, Difficult, Classic, Moddable, Fast-Paced, Competitive, 1990's, Arena Shooter, e-sports","id Software, Digital Anvil, Raster Games","Electronic Arts, SEGA, Bethesda Softworks, Activision Blizzard, Activison, id Software, Acer",1999
22798,tyrian-2000,Tyrian 2000,1999-11-29,,2.4,174,1,2284,61,11317,"And you thought being a Terraforming Engineer would be a quiet life compared to being a Space Marine?
Blasting rocks to make way for new settlements on Tyrian seemed like a quiet life, but your long-time Huzundra friend is now dead - bless his lizard hide. Murdered! And obviously Microsol, the Terraforming company wants you dead too!
It's that huge new rock formation you and Buce uncovered - it's Gravitium, and it's priceless. Tyrian is the only planet where it exists in commercial quantities, and Microsol are determined to control it. You can expect them to throw all their resources against you - and they won't pull any punches.
Classic, oldschool and just awesome vertical schooter gameplay at its best.
Gameplay mechanics that are easy to learn but hard to master.
Ship Editor - create your own ship and rule the skies.",,,"PC, macOS","Action, Shooter",Singleplayer,Eclipse Productions,Eclipse Productions,1999
5158,legacy-of-kain-soul-reaver,Legacy of Kain: Soul Reaver,1999-08-16,91.0,4.1,236,1,2273,157,149378,"Legacy of Kain: Soul Reaver is a third-person action-adventure title developed by Crystal Dynamics. It is the direct continuation of Blood Omen: Legacy of Kain and is the second title in the series.

###Plot
The game takes place 1500 years after the events of Blood Omen. It tells the story of Raziel, a lieutenant vampire in the Kain's army. Kain almost kills Raziel and throws him down the Lake of the Dead. However, an elder god saves Raziel from death and turns him into a Soul Stealer to help him take revenge on Kain. 

###Gameplay
The game is completely different from its predecessor. The game is played from the third person with the player being able to move it by themselves.

The gameplay is based on the ability to travel between the material and spirit worlds. This allows the player to continue on the game's plot. The item interaction in the spirit world is limited, yet it also benefits Raziel as he can pass the gates that he is unable to go through in the material world. Many of the game's puzzles are based on the differences between these two worlds. The puzzle environment of the material world can be completely different in the spirit one.

The game's combat system is based on the hack and slash principle and consists out of multiple attacks and finishing moves. The enemies of Raziel are divided into three groups: humans, spirit beings, and vampires. The main feature of the combat system is the usage of the in-world items as your own weapons.",,,"Dreamcast, PlayStation, PC","Action, Adventure, Platformer","Singleplayer, Atmospheric, Great Soundtrack, Story Rich, Third Person, Horror, Fantasy, Classic, Action-Adventure, Retro, Dark Fantasy, Metroidvania, Gothic, Vampire","Sony Interactive Entertainment, Crystal Dynamics, Nixxes software","Square Enix, Eidos Interactive",1999
15764,gorky-17,Gorky 17,1999-09-28,,3.37,187,4,2272,0,9978,"Gorky 17 is a role-playing game set in a fictional polish town of Gorky 17. The town was attacked by mutants and destroyed. Several years after these events a NATO group disappeared near Gorky 17. You take control of the second team sent to find missing allies. Another goal of the game is to reveal the reason why monsters appear.

You manage a group of three people: Cole Sullivan, the operation leader, and his two subordinates. The characters can be upgraded; the line-up changes during the game. Gorky 17 features several huge locations you can freely explore while some areas require special items to be opened.

The game features turn-based battles with a heavy tactical accent. You are strictly limited in supplies so wise ammo management is a must. Sometimes you need to fulfill a certain task during fights, such as protecting someone; some fights are time limited. A character’s death leads to restarting the battle.",http://www.gorky17.com,,"Linux, macOS, PC","RPG, Strategy","Singleplayer, Atmospheric, RPG, Sci-fi, Horror, Classic, Tactical, role-playing, Turn-Based, Post-apocalyptic, Isometric, Turn-Based Strategy","Hyperion Entertainment, Metropolis Software","Topware Interactive ACE, Monolith Productions",1999
52997,grand-theft-auto-2-1999,Grand Theft Auto 2,1999-10-22,70.0,4.02,438,1,1988,0,1000000,"Grand Theft Auto is back. The cars are faster. The streets are busier. The bad guys are nastier. The police are angrier. And now, the FBI and the Army are getting involved...

Seven ruthless gangs are involved in a ruthless power struggle and it is up to you to make a name for yourself.

Respect is earned, not given.",https://www.rockstargames.com/games/gta2,,"PC, PlayStation, Game Boy Color, PlayStation 3, Dreamcast","Action, Racing","Singleplayer, Multiplayer, Open World, 2D, Gore, Classic, Violent, Crime, Top-Down",DMA Design,Rockstar Games,1999
16264,commandos-beyond-the-call-of-duty,Commandos: Beyond the Call of Duty,1999-04-07,,4.05,147,1,1940,6,45792,"Commandos: Beyond the Call of Duty is a real-time tactical strategy game with stealth elements. The game serves as a standalone expansion to the original release of Commandos, set during the WWII. The player leads a squad of different operatives in the field of battle, tasked with different discreet missions.
The expansion pack adds a new character to the playable roster and expands the capabilities of other soldiers at player’s command. As in the base game, each mission features an objective, such as retrieving documents or destroying a strategic object, and each time it requires a different strategy on how to approach the enemies and achieve the goal of the mission. Every playable character has unique skills, with some having infiltration and concealment abilities, others capable of distracting the enemy and wreaking havoc upon them, and so on. 
The graphical composition of the game fits its time of release, with voxel surroundings and an isometric view of the mission’s map bringing joy to the eyes of veteran players and new coming fans of retro games alike.",,,PC,Action,"Singleplayer, Multiplayer, Co-op, Classic, Stealth, Tactical, RTS, Military, 1990's, World War II",Pyro Studios,Merge Games,1999
5115,final-fantasy-viii,FINAL FANTASY VIII,1999-02-11,90.0,4.27,414,3,1939,155,1000000,"Final Fantasy VIII is a Japanese role-playing game, the eight main installments in Final Fantasy series.  

###Plot and setting 
Like most other Final Fantasy entries, the game takes place in an entirely new world that is not connected with previous games in the series. It can be described as the mix of modern Europe and futuristic setting with high fantasy influences. The game follows six main heroes, five of which are members of the elite military organization called SeeD, on their quest to defeat Ultimecia, an evil sorceress who wishes to compress time. Like its predecessor, Final Fantasy VII, the game heavily focuses on its story, characters and game world exposure.  

###Gameplay 
The gameplay of Final Fantasy VIII shares many similarities with other JRPGs of that era. The player can explore the overworld, visit different locations such as town, settlements, forests, interact with NPCs and fight numerous types of monsters in turn-based battles.
While the world exploration aspect, for the most part, is similar to that of the previous game, the battle system has several notable differences. The combat in the game is centered on Junction system that allows the player to junction summoned monsters known as Guardian Forces to platy members. That gives characters the ability to use various magic, alter their stats and draw spells from enemies during the battles. Because of the system’s flexibility regarding character customization, the game is absent of job system typical for the series.",http://www.ffviiipc.com/,,"PlayStation 4, PC, PlayStation",RPG,"Singleplayer, Steam Achievements, Steam Cloud, Atmospheric, Great Soundtrack, RPG, Story Rich, Open World, Sci-fi, Partial Controller Support, Fantasy, Classic, Controller, Retro, Turn-Based, JRPG, 1990's, Romance, Card Game",Square,"Square Enix, Microsoft Studios, Eidos Interactive, Square, SCE Australia",1999
16159,the-longest-journey,The Longest Journey,1999-11-18,91.0,4.37,217,1,1506,118,1000000,"The Longest Journey is an amazing graphical adventure, where the player controls the protagonist, April Ryan, on her journey between parallel universes. Embark on an exciting and original journey of discovery, where you will explore, solve puzzles, meet new people, face terrifying monsters, learn, grow, and live the adventure of a lifetime!
Over 150 locations spanning two distinct and detailed worlds
More than 70 speaking characters
40+ hours of gameplay
20+ minutes of high-resolution pre-rendered video footage
Cinematic musical score",http://www.longestjourney.com,,PC,"Adventure, Puzzle","Singleplayer, Atmospheric, Great Soundtrack, RPG, Story Rich, 2D, Sci-fi, Fantasy, Funny, Classic, Female Protagonist, Point & Click, Futuristic, Cyberpunk",Funcom,Funcom,1999
22748,septerra-core,Septerra Core: Legacy of the Creator,1999-10-31,70.0,2.8,51,4,1477,108,8220,"Enter a world where the laws of nature work in strange new ways, allowing continents to orbit at different elevations around the planet. Living battleships float overhead and Junk Pirates roam the darkness. This is a world whose very Core is a living computer, quietly watching over the fruits of its master’s creation.
On the Outer Shell Layer above, the ancient society of the Chosen live an extravagant lifestyle, consuming mass amounts of energy and dumping their waste onto the Layers below. They have discovered secrets about the world in which they live, and begin a descent towards the inner Core, caring not who gets in their way.
Full game title:
Septerra Core: Legacy of the CreatorA unique mix of Japanese RPG with a steampunk atmosphere
A whopping 100 hours of gameplay with a very intriguing storyline
Exciting mechanics that mix real-time and turn-based combat system",,,"PC, macOS, Linux","Adventure, RPG","Singleplayer, Steam Cloud, steam-trading-cards, RPG, Story Rich, Sci-fi, Classic, Female Protagonist, Anime, role-playing, Turn-Based, Isometric, JRPG",Valkyrie Studios,,1999
