id,slug,name,released,metacritic,rating,ratings_count,playtime,added,twitch_count,youtube_count,description,website,reddit_url,platforms,genres,tags,developers,publishers,year
52402,breakout-1976,Breakout (1976),1976-01-01,,3.28,22,0,58,0,0,"Breakout is an arcade game developed and published by Atari, Inc., released on May 13, 1976. It was conceptualized by Nolan Bushnell and Steve Bristow, influenced by the 1972 Atari arcade game Pong, and built by Steve Wozniak aided by Steve Jobs. The game was ported to multiple platforms and upgraded to video games such as Super Breakout. In addition, Breakout was the basis and inspiration for certain aspects of the Apple II personal computer.
In the game, a layer of bricks lines the top third of the screen. A ball travels across the screen, bouncing off the top and side walls of the screen. When a brick is hit, the ball bounces away and the brick is destroyed. The player loses a turn when the ball touches the bottom of the screen. To prevent this from happening, the player has a movable paddle to bounce the ball upward, keeping it in play.",,,"Atari ST, Atari Flashback, Game Boy, Game Boy Advance, PlayStation, Atari 2600, Commodore / Amiga",Arcade,"Singleplayer, Multiplayer, 2 players, alternating turns",Atari,"Atari, Namco",1976
54997,colossal-cave-adventure,Colossal Cave Adventure,1976-01-01,,3.5,9,0,48,0,0,"Colossal Cave Adventure (also known as ADVENT, Colossal Cave, or Adventure) is a text adventure game, developed originally in 1976, by Will Crowther for the PDP-10 mainframe. The game was expanded upon in 1977, with help from Don Woods, and other programmers created variations on the game and ports to other systems in the following years.
In the game, the player controls a character through simple text commands to explore a cave rumored to be filled with wealth. Players earn predetermined points for acquiring treasure and escaping the cave alive, with the goal to earn the maximum number of points offered. The concept bore out from Crowther's background as a caving enthusiast, with the game's cave structured loosely around the Mammoth Cave system in Kentucky.
Colossal Cave Adventure is the first known work of interactive fiction and, as the first text adventure game, is considered the precursor for the adventure game genre. Colossal Cave Adventure also contributed towards the role playing and roguelike genres.",,,"Android, PC, Atari ST, Commodore / Amiga",Adventure,"Singleplayer, Interactive Fiction, Text-Based, text-adventure","Willie Crowther, Wolfgang Strobl, Don Woods, William Crowther",Wolfgang Strobl,1976
55308,outlaw,Outlaw,1976-01-01,,2.5,8,0,33,0,0,"Outlaw is a single-player arcade game by Atari Inc., originally released in 1976. It simulates an Old West fast draw duel between the player and the computer. Outlaw was a response to Gun Fight, released by Midway in North America the year before.",,,"Atari Flashback, Atari 2600",Shooter,"fight, gun, fast, duel",Atari,,1976
52440,night-driver,Night Driver,1976-10-01,,2.0,7,0,29,0,0,"Night Driver is an arcade game developed by Atari Inc for release in the United States in October, 1976. It was inspired by the earlier German coin-op Nürburgring 1. Along with Micronetics' Night Racer and Midway's 280 ZZZAP, Night Driver is one of the earliest first-person racing video games, and is commonly believed to be one of the first published games to display real-time first-person graphics.",,,Atari 2600,Racing,Singleplayer,Atari,Atari,1976
58061,sea-wolf,Sea Wolf,1976-01-01,,3.12,7,0,27,0,0,"Sea Wolf is an arcade game by Midway, originally released in 1976. It was a video game update of an earlier coin-operated electro-mechanical (em) Midway game, Sea Devil, itself based on Sega's 1966 coin-op electro-mechanical arcade submarine simulator Periscope. Midway's video game version was designed by Dave Nutting and eventually sold 10,000 video game arcade cabinets. A color sequel, Sea Wolf II, was released in 1978 that sold another 4,000 units.
In 1982 Commodore International produced ports of Sea Wolf for the VIC-20 and then-new Commodore 64 computers, released in cartridge form.",,,Commodore / Amiga,Shooter,"sea, simulator, color, submarine, wolf","Dave Nutting Associates, Dave Nutting",Midway Games,1976
58023,blockade,Blockade,1976-01-01,,3.5,5,0,26,0,0,"Blockade is a monochrome arcade maze game developed by Gremlin and released in October 1976. Using four directional buttons, each player moves their character around leaving a solid line behind them, turning at 90 degree angles. To win, a player must last longer than the opponent before hitting something, with the first person to hit something losing. The game ends after one player gains six wins.
Blockade is the first of what would become known as snake games.",,,,Puzzle,"Multiplayer, 2 players","Gremlin, Gremlin Industries",Gremlin Industries,1976
58058,fonz,Fonz,1976-02-01,,0.0,4,0,22,0,0,"Fonz is a 1976 arcade racing video game developed by Sega and published by Sega-Gremlin. The game was based on the hit TV show Happy Days and the slogan was ""TV's hottest name, Your hottest game."" The game itself was simply a rebranded variant of Sega's earlier 1976 game Moto-Cross, also known as Man T.T. (released August 1976), in a customized arcade cabinet. In turn, Moto-Cross and Man T.T. were motorbike variants of Road Race, a car driving game released in February 1976. Sega was allowed to rebrand their game as Fonz because its American branch at the time was owned by Charles Bluhdorn's Gulf+Western Company and thus had access to Paramount Television's intellectual property.",,,,Racing,Singleplayer,SEGA,"Gremlin Industries, Sega-Gremlin",1976
